0:0:1.000000000 0.0.1.1.1024 > 0.0.3.2.25: S win 28000 <mss 1000,sackOK,nop,nop>
0:0:1.211641600 0.0.3.2.25 > 0.0.1.1.1024: S ack 2 win 28000 <mss 1000,sackOK,nop,nop>
0:0:1.211641600 0.0.1.1.1024 > 0.0.3.2.25: . ack 256002 win 28000 
0:0:1.211642600 0.0.1.1.1024 > 0.0.3.2.25: P 2:1002(1000) ack 256002 win 28000 
0:0:1.433964800 0.0.3.2.25 > 0.0.1.1.1024: . ack 1002 win 28000 
0:0:1.433964800 0.0.1.1.1024 > 0.0.3.2.25: . 1002:2002(1000) ack 256002 win 28000 
0:0:1.433964800 0.0.1.1.1024 > 0.0.3.2.25: . 2002:3002(1000) ack 256002 win 28000 
0:0:1.656233600 0.0.3.2.25 > 0.0.1.1.1024: . ack 2002 win 28000 
0:0:1.656233600 0.0.1.1.1024 > 0.0.3.2.25: . 3002:4002(1000) ack 256002 win 28000 
0:0:1.656233600 0.0.1.1.1024 > 0.0.3.2.25: . 4002:5002(1000) ack 256002 win 28000 
0:0:1.666913600 0.0.3.2.25 > 0.0.1.1.1024: . ack 3002 win 28000 
0:0:1.666913600 0.0.1.1.1024 > 0.0.3.2.25: . 5002:6002(1000) ack 256002 win 28000 
0:0:1.666913600 0.0.1.1.1024 > 0.0.3.2.25: . 6002:7002(1000) ack 256002 win 28000 
0:0:1.878502400 0.0.3.2.25 > 0.0.1.1.1024: . ack 4002 win 28000 
0:0:1.878502400 0.0.1.1.1024 > 0.0.3.2.25: . 7002:8002(1000) ack 256002 win 28000 
0:0:1.878502400 0.0.1.1.1024 > 0.0.3.2.25: . 8002:9002(1000) ack 256002 win 28000 
0:0:1.889182400 0.0.3.2.25 > 0.0.1.1.1024: . ack 5002 win 28000 
0:0:1.889182400 0.0.1.1.1024 > 0.0.3.2.25: . 9002:10002(1000) ack 256002 win 28000 
0:0:1.889182400 0.0.1.1.1024 > 0.0.3.2.25: . 10002:11002(1000) ack 256002 win 28000 
0:0:1.899862400 0.0.3.2.25 > 0.0.1.1.1024: . ack 6002 win 28000 
0:0:1.899862400 0.0.1.1.1024 > 0.0.3.2.25: . 11002:12002(1000) ack 256002 win 28000 
0:0:1.899862400 0.0.1.1.1024 > 0.0.3.2.25: . 12002:13002(1000) ack 256002 win 28000 
0:0:1.910542400 0.0.3.2.25 > 0.0.1.1.1024: . ack 7002 win 28000 
0:0:1.910542400 0.0.1.1.1024 > 0.0.3.2.25: . 13002:14002(1000) ack 256002 win 28000 
0:0:1.910542400 0.0.1.1.1024 > 0.0.3.2.25: . 14002:15002(1000) ack 256002 win 28000 
0:0:2.100771200 0.0.3.2.25 > 0.0.1.1.1024: . ack 8002 win 28000 
0:0:2.100771200 0.0.1.1.1024 > 0.0.3.2.25: . 15002:16002(1000) ack 256002 win 28000 
0:0:2.100771200 0.0.1.1.1024 > 0.0.3.2.25: . 16002:17002(1000) ack 256002 win 28000 
0:0:2.111451200 0.0.3.2.25 > 0.0.1.1.1024: . ack 9002 win 28000 
0:0:2.111451200 0.0.1.1.1024 > 0.0.3.2.25: . 17002:18002(1000) ack 256002 win 28000 
0:0:2.111451200 0.0.1.1.1024 > 0.0.3.2.25: . 18002:19002(1000) ack 256002 win 28000 
0:0:2.122131200 0.0.3.2.25 > 0.0.1.1.1024: . ack 10002 win 28000 
0:0:2.122131200 0.0.1.1.1024 > 0.0.3.2.25: . 19002:20002(1000) ack 256002 win 28000 
0:0:2.122131200 0.0.1.1.1024 > 0.0.3.2.25: . 20002:21002(1000) ack 256002 win 28000 
0:0:2.132811200 0.0.3.2.25 > 0.0.1.1.1024: . ack 11002 win 28000 
0:0:2.132811200 0.0.1.1.1024 > 0.0.3.2.25: . 21002:22002(1000) ack 256002 win 28000 
0:0:2.132811200 0.0.1.1.1024 > 0.0.3.2.25: . 22002:23002(1000) ack 256002 win 28000 
0:0:2.143491200 0.0.3.2.25 > 0.0.1.1.1024: . ack 12002 win 28000 
0:0:2.143491200 0.0.1.1.1024 > 0.0.3.2.25: . 23002:24002(1000) ack 256002 win 28000 
0:0:2.143491200 0.0.1.1.1024 > 0.0.3.2.25: . 24002:25002(1000) ack 256002 win 28000 
0:0:2.154171200 0.0.3.2.25 > 0.0.1.1.1024: . ack 13002 win 28000 
0:0:2.154171200 0.0.1.1.1024 > 0.0.3.2.25: . 25002:26002(1000) ack 256002 win 28000 
0:0:2.154171200 0.0.1.1.1024 > 0.0.3.2.25: . 26002:27002(1000) ack 256002 win 28000 
0:0:2.164851200 0.0.3.2.25 > 0.0.1.1.1024: . ack 14002 win 28000 
0:0:2.164851200 0.0.1.1.1024 > 0.0.3.2.25: . 27002:28002(1000) ack 256002 win 28000 
0:0:2.164851200 0.0.1.1.1024 > 0.0.3.2.25: . 28002:29002(1000) ack 256002 win 28000 
0:0:2.323169600 0.0.3.2.25 > 0.0.1.1.1024: . ack 14002 win 28000 <nop,nop,sack 15002 16002>
0:0:2.333849600 0.0.3.2.25 > 0.0.1.1.1024: . ack 14002 win 28000 <nop,nop,sack 15002 17002>
0:0:2.344529600 0.0.3.2.25 > 0.0.1.1.1024: . ack 14002 win 28000 <nop,nop,sack 15002 18002>
0:0:2.344529600 0.0.1.1.1024 > 0.0.3.2.25: . 14002:15002(1000) ack 256002 win 28000 
0:0:2.355209600 0.0.3.2.25 > 0.0.1.1.1024: . ack 14002 win 28000 <nop,nop,sack 15002 19002>
0:0:2.365889600 0.0.3.2.25 > 0.0.1.1.1024: . ack 14002 win 28000 <nop,nop,sack 15002 20002>
0:0:2.376569600 0.0.3.2.25 > 0.0.1.1.1024: . ack 14002 win 28000 <nop,nop,sack 15002 21002>
0:0:2.387249600 0.0.3.2.25 > 0.0.1.1.1024: . ack 14002 win 28000 <nop,nop,sack 15002 22002>
0:0:2.397929600 0.0.3.2.25 > 0.0.1.1.1024: . ack 14002 win 28000 <nop,nop,sack 15002 23002>
0:0:2.408609600 0.0.3.2.25 > 0.0.1.1.1024: . ack 14002 win 28000 <nop,nop,sack 15002 24002>
0:0:2.408609600 0.0.1.1.1024 > 0.0.3.2.25: . 29002:30002(1000) ack 256002 win 28000 
0:0:2.419289600 0.0.3.2.25 > 0.0.1.1.1024: . ack 14002 win 28000 <nop,nop,sack 15002 25002>
0:0:2.419289600 0.0.1.1.1024 > 0.0.3.2.25: . 30002:31002(1000) ack 256002 win 28000 
0:0:2.429969600 0.0.3.2.25 > 0.0.1.1.1024: . ack 14002 win 28000 <nop,nop,sack 15002 26002>
0:0:2.429969600 0.0.1.1.1024 > 0.0.3.2.25: . 31002:32002(1000) ack 256002 win 28000 
0:0:2.451416000 0.0.3.2.25 > 0.0.1.1.1024: . ack 14002 win 28000 <nop,nop,sack 27002 28002 15002 26002>
0:0:2.451416000 0.0.1.1.1024 > 0.0.3.2.25: . 26002:27002(1000) ack 256002 win 28000 
0:0:2.566928000 0.0.3.2.25 > 0.0.1.1.1024: . ack 26002 win 28000 <nop,nop,sack 27002 28002>
0:0:2.566928000 0.0.1.1.1024 > 0.0.3.2.25: . 32002:33002(1000) ack 256002 win 28000 
0:0:2.566928000 0.0.1.1.1024 > 0.0.3.2.25: . 33002:34002(1000) ack 256002 win 28000 
0:0:2.631094400 0.0.3.2.25 > 0.0.1.1.1024: . ack 26002 win 28000 <nop,nop,sack 29002 30002 27002 28002>
0:0:2.631094400 0.0.1.1.1024 > 0.0.3.2.25: . 28002:29002(1000) ack 256002 win 28000 
0:0:2.641774400 0.0.3.2.25 > 0.0.1.1.1024: . ack 26002 win 28000 <nop,nop,sack 29002 31002 27002 28002>
0:0:2.641774400 0.0.1.1.1024 > 0.0.3.2.25: . 34002:35002(1000) ack 256002 win 28000 
0:0:2.652454400 0.0.3.2.25 > 0.0.1.1.1024: . ack 26002 win 28000 <nop,nop,sack 29002 32002 27002 28002>
0:0:2.652454400 0.0.1.1.1024 > 0.0.3.2.25: . 35002:36002(1000) ack 256002 win 28000 
0:0:2.673814400 0.0.3.2.25 > 0.0.1.1.1024: . ack 28002 win 28000 <nop,nop,sack 29002 32002>
0:0:2.673814400 0.0.1.1.1024 > 0.0.3.2.25: . 36002:37002(1000) ack 256002 win 28000 
0:0:2.673814400 0.0.1.1.1024 > 0.0.3.2.25: . 37002:38002(1000) ack 256002 win 28000 
0:0:2.789326400 0.0.3.2.25 > 0.0.1.1.1024: . ack 28002 win 28000 <nop,nop,sack 29002 33002>
0:0:2.789326400 0.0.1.1.1024 > 0.0.3.2.25: . 38002:39002(1000) ack 256002 win 28000 
0:0:2.800006400 0.0.3.2.25 > 0.0.1.1.1024: . ack 28002 win 28000 <nop,nop,sack 29002 34002>
0:0:2.800006400 0.0.1.1.1024 > 0.0.3.2.25: . 39002:40002(1000) ack 256002 win 28000 
0:0:2.853363200 0.0.3.2.25 > 0.0.1.1.1024: . ack 34002 win 28000 
0:0:2.853363200 0.0.1.1.1024 > 0.0.3.2.25: . 40002:41002(1000) ack 256002 win 28000 
0:0:2.853363200 0.0.1.1.1024 > 0.0.3.2.25: . 41002:42002(1000) ack 256002 win 28000 
0:0:2.864043200 0.0.3.2.25 > 0.0.1.1.1024: . ack 35002 win 28000 
0:0:2.864043200 0.0.1.1.1024 > 0.0.3.2.25: . 42002:43002(1000) ack 256002 win 28000 
0:0:2.874723200 0.0.3.2.25 > 0.0.1.1.1024: . ack 36002 win 28000 
0:0:2.874723200 0.0.1.1.1024 > 0.0.3.2.25: . 43002:44002(1000) ack 256002 win 28000 
0:0:2.896083200 0.0.3.2.25 > 0.0.1.1.1024: . ack 37002 win 28000 
0:0:2.896083200 0.0.1.1.1024 > 0.0.3.2.25: . 44002:45002(1000) ack 256002 win 28000 
0:0:2.906763200 0.0.3.2.25 > 0.0.1.1.1024: . ack 38002 win 28000 
0:0:2.906763200 0.0.1.1.1024 > 0.0.3.2.25: . 45002:46002(1000) ack 256002 win 28000 
0:0:3.011595200 0.0.3.2.25 > 0.0.1.1.1024: . ack 39002 win 28000 
0:0:3.011595200 0.0.1.1.1024 > 0.0.3.2.25: . 46002:47002(1000) ack 256002 win 28000 
0:0:3.022275200 0.0.3.2.25 > 0.0.1.1.1024: . ack 40002 win 28000 
0:0:3.022275200 0.0.1.1.1024 > 0.0.3.2.25: . 47002:48002(1000) ack 256002 win 28000 
0:0:3.075632000 0.0.3.2.25 > 0.0.1.1.1024: . ack 41002 win 28000 
0:0:3.075632000 0.0.1.1.1024 > 0.0.3.2.25: . 48002:49002(1000) ack 256002 win 28000 
0:0:3.086312000 0.0.3.2.25 > 0.0.1.1.1024: . ack 42002 win 28000 
0:0:3.086312000 0.0.1.1.1024 > 0.0.3.2.25: . 49002:50002(1000) ack 256002 win 28000 
0:0:3.096992000 0.0.3.2.25 > 0.0.1.1.1024: . ack 43002 win 28000 
0:0:3.096992000 0.0.1.1.1024 > 0.0.3.2.25: . 50002:51002(1000) ack 256002 win 28000 
0:0:3.096992000 0.0.1.1.1024 > 0.0.3.2.25: . 51002:52002(1000) ack 256002 win 28000 
0:0:3.107672000 0.0.3.2.25 > 0.0.1.1.1024: . ack 44002 win 28000 
0:0:3.107672000 0.0.1.1.1024 > 0.0.3.2.25: . 52002:53002(1000) ack 256002 win 28000 
0:0:3.118352000 0.0.3.2.25 > 0.0.1.1.1024: . ack 45002 win 28000 
0:0:3.118352000 0.0.1.1.1024 > 0.0.3.2.25: . 53002:54002(1000) ack 256002 win 28000 
0:0:3.129032000 0.0.3.2.25 > 0.0.1.1.1024: . ack 46002 win 28000 
0:0:3.129032000 0.0.1.1.1024 > 0.0.3.2.25: . 54002:55002(1000) ack 256002 win 28000 
0:0:3.233864000 0.0.3.2.25 > 0.0.1.1.1024: . ack 47002 win 28000 
0:0:3.233864000 0.0.1.1.1024 > 0.0.3.2.25: . 55002:56002(1000) ack 256002 win 28000 
0:0:3.244544000 0.0.3.2.25 > 0.0.1.1.1024: . ack 48002 win 28000 
0:0:3.244544000 0.0.1.1.1024 > 0.0.3.2.25: . 56002:57002(1000) ack 256002 win 28000 
0:0:3.297900800 0.0.3.2.25 > 0.0.1.1.1024: . ack 49002 win 28000 
0:0:3.297900800 0.0.1.1.1024 > 0.0.3.2.25: . 57002:58002(1000) ack 256002 win 28000 
0:0:3.308580800 0.0.3.2.25 > 0.0.1.1.1024: . ack 50002 win 28000 
0:0:3.308580800 0.0.1.1.1024 > 0.0.3.2.25: . 58002:59002(1000) ack 256002 win 28000 
0:0:3.319260800 0.0.3.2.25 > 0.0.1.1.1024: . ack 51002 win 28000 
0:0:3.319260800 0.0.1.1.1024 > 0.0.3.2.25: . 59002:60002(1000) ack 256002 win 28000 
0:0:3.329940800 0.0.3.2.25 > 0.0.1.1.1024: . ack 52002 win 28000 
0:0:3.329940800 0.0.1.1.1024 > 0.0.3.2.25: . 60002:61002(1000) ack 256002 win 28000 
0:0:3.329940800 0.0.1.1.1024 > 0.0.3.2.25: . 61002:62002(1000) ack 256002 win 28000 
0:0:3.340620800 0.0.3.2.25 > 0.0.1.1.1024: . ack 53002 win 28000 
0:0:3.340620800 0.0.1.1.1024 > 0.0.3.2.25: . 62002:63002(1000) ack 256002 win 28000 
0:0:3.351300800 0.0.3.2.25 > 0.0.1.1.1024: . ack 54002 win 28000 
0:0:3.351300800 0.0.1.1.1024 > 0.0.3.2.25: . 63002:64002(1000) ack 256002 win 28000 
0:0:3.361980800 0.0.3.2.25 > 0.0.1.1.1024: . ack 55002 win 28000 
0:0:3.361980800 0.0.1.1.1024 > 0.0.3.2.25: . 64002:65002(1000) ack 256002 win 28000 
0:0:3.456132800 0.0.3.2.25 > 0.0.1.1.1024: . ack 56002 win 28000 
0:0:3.456132800 0.0.1.1.1024 > 0.0.3.2.25: . 65002:66002(1000) ack 256002 win 28000 
0:0:3.466812800 0.0.3.2.25 > 0.0.1.1.1024: . ack 57002 win 28000 
0:0:3.466812800 0.0.1.1.1024 > 0.0.3.2.25: . 66002:67002(1000) ack 256002 win 28000 
0:0:3.520169600 0.0.3.2.25 > 0.0.1.1.1024: . ack 58002 win 28000 
0:0:3.520169600 0.0.1.1.1024 > 0.0.3.2.25: . 67002:68002(1000) ack 256002 win 28000 
0:0:3.530849600 0.0.3.2.25 > 0.0.1.1.1024: . ack 59002 win 28000 
0:0:3.530849600 0.0.1.1.1024 > 0.0.3.2.25: . 68002:69002(1000) ack 256002 win 28000 
0:0:3.541529600 0.0.3.2.25 > 0.0.1.1.1024: . ack 60002 win 28000 
0:0:3.541529600 0.0.1.1.1024 > 0.0.3.2.25: . 69002:70002(1000) ack 256002 win 28000 
0:0:3.552209600 0.0.3.2.25 > 0.0.1.1.1024: . ack 61002 win 28000 
0:0:3.552209600 0.0.1.1.1024 > 0.0.3.2.25: . 70002:71002(1000) ack 256002 win 28000 
0:0:3.562889600 0.0.3.2.25 > 0.0.1.1.1024: . ack 62002 win 28000 
0:0:3.562889600 0.0.1.1.1024 > 0.0.3.2.25: . 71002:72002(1000) ack 256002 win 28000 
0:0:3.573569600 0.0.3.2.25 > 0.0.1.1.1024: . ack 63002 win 28000 
0:0:3.573569600 0.0.1.1.1024 > 0.0.3.2.25: . 72002:73002(1000) ack 256002 win 28000 
0:0:3.573569600 0.0.1.1.1024 > 0.0.3.2.25: . 73002:74002(1000) ack 256002 win 28000 
0:0:3.584249600 0.0.3.2.25 > 0.0.1.1.1024: . ack 64002 win 28000 
0:0:3.584249600 0.0.1.1.1024 > 0.0.3.2.25: . 74002:75002(1000) ack 256002 win 28000 
0:0:3.594929600 0.0.3.2.25 > 0.0.1.1.1024: . ack 65002 win 28000 
0:0:3.594929600 0.0.1.1.1024 > 0.0.3.2.25: . 75002:76002(1000) ack 256002 win 28000 
0:0:3.678401600 0.0.3.2.25 > 0.0.1.1.1024: . ack 66002 win 28000 
0:0:3.678401600 0.0.1.1.1024 > 0.0.3.2.25: . 76002:77002(1000) ack 256002 win 28000 
0:0:3.689081600 0.0.3.2.25 > 0.0.1.1.1024: . ack 67002 win 28000 
0:0:3.689081600 0.0.1.1.1024 > 0.0.3.2.25: . 77002:78002(1000) ack 256002 win 28000 
0:0:3.742438400 0.0.3.2.25 > 0.0.1.1.1024: . ack 68002 win 28000 
0:0:3.742438400 0.0.1.1.1024 > 0.0.3.2.25: . 78002:79002(1000) ack 256002 win 28000 
0:0:3.753118400 0.0.3.2.25 > 0.0.1.1.1024: . ack 69002 win 28000 
0:0:3.753118400 0.0.1.1.1024 > 0.0.3.2.25: . 79002:80002(1000) ack 256002 win 28000 
0:0:3.763798400 0.0.3.2.25 > 0.0.1.1.1024: . ack 70002 win 28000 
0:0:3.763798400 0.0.1.1.1024 > 0.0.3.2.25: . 80002:81002(1000) ack 256002 win 28000 
0:0:3.774478400 0.0.3.2.25 > 0.0.1.1.1024: . ack 71002 win 28000 
0:0:3.774478400 0.0.1.1.1024 > 0.0.3.2.25: . 81002:82002(1000) ack 256002 win 28000 
0:0:3.785158400 0.0.3.2.25 > 0.0.1.1.1024: . ack 72002 win 28000 
0:0:3.785158400 0.0.1.1.1024 > 0.0.3.2.25: . 82002:83002(1000) ack 256002 win 28000 
0:0:3.795838400 0.0.3.2.25 > 0.0.1.1.1024: . ack 73002 win 28000 
0:0:3.795838400 0.0.1.1.1024 > 0.0.3.2.25: . 83002:84002(1000) ack 256002 win 28000 
0:0:3.806518400 0.0.3.2.25 > 0.0.1.1.1024: . ack 74002 win 28000 
0:0:3.806518400 0.0.1.1.1024 > 0.0.3.2.25: . 84002:85002(1000) ack 256002 win 28000 
0:0:3.806518400 0.0.1.1.1024 > 0.0.3.2.25: . 85002:86002(1000) ack 256002 win 28000 
0:0:3.817198400 0.0.3.2.25 > 0.0.1.1.1024: . ack 75002 win 28000 
0:0:3.817198400 0.0.1.1.1024 > 0.0.3.2.25: . 86002:87002(1000) ack 256002 win 28000 
0:0:3.828518400 0.0.3.2.25 > 0.0.1.1.1024: . ack 76002 win 28000 
0:0:3.828518400 0.0.1.1.1024 > 0.0.3.2.25: . 87002:88002(1000) ack 256002 win 28000 
0:0:3.900670400 0.0.3.2.25 > 0.0.1.1.1024: . ack 77002 win 28000 
0:0:3.900670400 0.0.1.1.1024 > 0.0.3.2.25: . 88002:89002(1000) ack 256002 win 28000 
0:0:3.911350400 0.0.3.2.25 > 0.0.1.1.1024: . ack 78002 win 28000 
0:0:3.911350400 0.0.1.1.1024 > 0.0.3.2.25: . 89002:90002(1000) ack 256002 win 28000 
0:0:3.964707200 0.0.3.2.25 > 0.0.1.1.1024: . ack 79002 win 28000 
0:0:3.964707200 0.0.1.1.1024 > 0.0.3.2.25: . 90002:91002(1000) ack 256002 win 28000 
0:0:3.975387200 0.0.3.2.25 > 0.0.1.1.1024: . ack 80002 win 28000 
0:0:3.975387200 0.0.1.1.1024 > 0.0.3.2.25: . 91002:92002(1000) ack 256002 win 28000 
0:0:3.986067200 0.0.3.2.25 > 0.0.1.1.1024: . ack 81002 win 28000 
0:0:3.986067200 0.0.1.1.1024 > 0.0.3.2.25: . 92002:93002(1000) ack 256002 win 28000 
0:0:3.996747200 0.0.3.2.25 > 0.0.1.1.1024: . ack 82002 win 28000 
0:0:3.996747200 0.0.1.1.1024 > 0.0.3.2.25: . 93002:94002(1000) ack 256002 win 28000 
0:0:4.007427200 0.0.3.2.25 > 0.0.1.1.1024: . ack 83002 win 28000 
0:0:4.007427200 0.0.1.1.1024 > 0.0.3.2.25: . 94002:95002(1000) ack 256002 win 28000 
0:0:4.018107200 0.0.3.2.25 > 0.0.1.1.1024: . ack 84002 win 28000 
0:0:4.018107200 0.0.1.1.1024 > 0.0.3.2.25: . 95002:96002(1000) ack 256002 win 28000 
0:0:4.028787200 0.0.3.2.25 > 0.0.1.1.1024: . ack 85002 win 28000 
0:0:4.028787200 0.0.1.1.1024 > 0.0.3.2.25: . 96002:97002(1000) ack 256002 win 28000 
0:0:4.039467200 0.0.3.2.25 > 0.0.1.1.1024: . ack 86002 win 28000 
0:0:4.039467200 0.0.1.1.1024 > 0.0.3.2.25: . 97002:98002(1000) ack 256002 win 28000 
0:0:4.050147200 0.0.3.2.25 > 0.0.1.1.1024: . ack 87002 win 28000 
0:0:4.050147200 0.0.1.1.1024 > 0.0.3.2.25: . 98002:99002(1000) ack 256002 win 28000 
0:0:4.050147200 0.0.1.1.1024 > 0.0.3.2.25: . 99002:100002(1000) ack 256002 win 28000 
0:0:4.060827200 0.0.3.2.25 > 0.0.1.1.1024: . ack 88002 win 28000 
0:0:4.060827200 0.0.1.1.1024 > 0.0.3.2.25: . 100002:101002(1000) ack 256002 win 28000 
0:0:4.122939200 0.0.3.2.25 > 0.0.1.1.1024: . ack 89002 win 28000 
0:0:4.122939200 0.0.1.1.1024 > 0.0.3.2.25: . 101002:102002(1000) ack 256002 win 28000 
0:0:4.133619200 0.0.3.2.25 > 0.0.1.1.1024: . ack 90002 win 28000 
0:0:4.133619200 0.0.1.1.1024 > 0.0.3.2.25: . 102002:103002(1000) ack 256002 win 28000 
0:0:4.186976000 0.0.3.2.25 > 0.0.1.1.1024: . ack 91002 win 28000 
0:0:4.186976000 0.0.1.1.1024 > 0.0.3.2.25: . 103002:104002(1000) ack 256002 win 28000 
0:0:4.197656000 0.0.3.2.25 > 0.0.1.1.1024: . ack 92002 win 28000 
0:0:4.197656000 0.0.1.1.1024 > 0.0.3.2.25: . 104002:105002(1000) ack 256002 win 28000 
0:0:4.208336000 0.0.3.2.25 > 0.0.1.1.1024: . ack 93002 win 28000 
0:0:4.208336000 0.0.1.1.1024 > 0.0.3.2.25: . 105002:106002(1000) ack 256002 win 28000 
0:0:4.219016000 0.0.3.2.25 > 0.0.1.1.1024: . ack 94002 win 28000 
0:0:4.219016000 0.0.1.1.1024 > 0.0.3.2.25: . 106002:107002(1000) ack 256002 win 28000 
0:0:4.229696000 0.0.3.2.25 > 0.0.1.1.1024: . ack 95002 win 28000 
0:0:4.229696000 0.0.1.1.1024 > 0.0.3.2.25: . 107002:108002(1000) ack 256002 win 28000 
0:0:4.240376000 0.0.3.2.25 > 0.0.1.1.1024: . ack 96002 win 28000 
0:0:4.240376000 0.0.1.1.1024 > 0.0.3.2.25: . 108002:109002(1000) ack 256002 win 28000 
0:0:4.251056000 0.0.3.2.25 > 0.0.1.1.1024: . ack 97002 win 28000 
0:0:4.251056000 0.0.1.1.1024 > 0.0.3.2.25: . 109002:110002(1000) ack 256002 win 28000 
0:0:4.261736000 0.0.3.2.25 > 0.0.1.1.1024: . ack 98002 win 28000 
0:0:4.261736000 0.0.1.1.1024 > 0.0.3.2.25: . 110002:111002(1000) ack 256002 win 28000 
0:0:4.272416000 0.0.3.2.25 > 0.0.1.1.1024: . ack 99002 win 28000 
0:0:4.272416000 0.0.1.1.1024 > 0.0.3.2.25: . 111002:112002(1000) ack 256002 win 28000 
0:0:4.283096000 0.0.3.2.25 > 0.0.1.1.1024: . ack 100002 win 28000 
0:0:4.283096000 0.0.1.1.1024 > 0.0.3.2.25: . 112002:113002(1000) ack 256002 win 28000 
0:0:4.293776000 0.0.3.2.25 > 0.0.1.1.1024: . ack 101002 win 28000 
0:0:4.293776000 0.0.1.1.1024 > 0.0.3.2.25: . 113002:114002(1000) ack 256002 win 28000 
0:0:4.293776000 0.0.1.1.1024 > 0.0.3.2.25: . 114002:115002(1000) ack 256002 win 28000 
0:0:4.345208000 0.0.3.2.25 > 0.0.1.1.1024: . ack 102002 win 28000 
0:0:4.345208000 0.0.1.1.1024 > 0.0.3.2.25: . 115002:116002(1000) ack 256002 win 28000 
0:0:4.355888000 0.0.3.2.25 > 0.0.1.1.1024: . ack 103002 win 28000 
0:0:4.355888000 0.0.1.1.1024 > 0.0.3.2.25: . 116002:117002(1000) ack 256002 win 28000 
0:0:4.409244800 0.0.3.2.25 > 0.0.1.1.1024: . ack 104002 win 28000 
0:0:4.409244800 0.0.1.1.1024 > 0.0.3.2.25: . 117002:118002(1000) ack 256002 win 28000 
0:0:4.419924800 0.0.3.2.25 > 0.0.1.1.1024: . ack 105002 win 28000 
0:0:4.419924800 0.0.1.1.1024 > 0.0.3.2.25: . 118002:119002(1000) ack 256002 win 28000 
0:0:4.430604800 0.0.3.2.25 > 0.0.1.1.1024: . ack 106002 win 28000 
0:0:4.430604800 0.0.1.1.1024 > 0.0.3.2.25: . 119002:120002(1000) ack 256002 win 28000 
0:0:4.441284800 0.0.3.2.25 > 0.0.1.1.1024: . ack 107002 win 28000 
0:0:4.441284800 0.0.1.1.1024 > 0.0.3.2.25: . 120002:121002(1000) ack 256002 win 28000 
0:0:4.451964800 0.0.3.2.25 > 0.0.1.1.1024: . ack 108002 win 28000 
0:0:4.451964800 0.0.1.1.1024 > 0.0.3.2.25: . 121002:122002(1000) ack 256002 win 28000 
0:0:4.462644800 0.0.3.2.25 > 0.0.1.1.1024: . ack 109002 win 28000 
0:0:4.462644800 0.0.1.1.1024 > 0.0.3.2.25: . 122002:123002(1000) ack 256002 win 28000 
0:0:4.473324800 0.0.3.2.25 > 0.0.1.1.1024: . ack 110002 win 28000 
0:0:4.473324800 0.0.1.1.1024 > 0.0.3.2.25: . 123002:124002(1000) ack 256002 win 28000 
0:0:4.484004800 0.0.3.2.25 > 0.0.1.1.1024: . ack 111002 win 28000 
0:0:4.484004800 0.0.1.1.1024 > 0.0.3.2.25: . 124002:125002(1000) ack 256002 win 28000 
0:0:4.494684800 0.0.3.2.25 > 0.0.1.1.1024: . ack 112002 win 28000 
0:0:4.494684800 0.0.1.1.1024 > 0.0.3.2.25: . 125002:126002(1000) ack 256002 win 28000 
0:0:4.505364800 0.0.3.2.25 > 0.0.1.1.1024: . ack 113002 win 28000 
0:0:4.505364800 0.0.1.1.1024 > 0.0.3.2.25: . 126002:127002(1000) ack 256002 win 28000 
0:0:4.516044800 0.0.3.2.25 > 0.0.1.1.1024: . ack 114002 win 28000 
0:0:4.516044800 0.0.1.1.1024 > 0.0.3.2.25: . 127002:128002(1000) ack 256002 win 28000 
0:0:4.526724800 0.0.3.2.25 > 0.0.1.1.1024: . ack 115002 win 28000 
0:0:4.526724800 0.0.1.1.1024 > 0.0.3.2.25: . 128002:129002(1000) ack 256002 win 28000 
0:0:4.526724800 0.0.1.1.1024 > 0.0.3.2.25: . 129002:130002(1000) ack 256002 win 28000 
0:0:4.567476800 0.0.3.2.25 > 0.0.1.1.1024: . ack 116002 win 28000 
0:0:4.567476800 0.0.1.1.1024 > 0.0.3.2.25: . 130002:131002(1000) ack 256002 win 28000 
0:0:4.578156800 0.0.3.2.25 > 0.0.1.1.1024: . ack 117002 win 28000 
0:0:4.578156800 0.0.1.1.1024 > 0.0.3.2.25: . 131002:132002(1000) ack 256002 win 28000 
0:0:4.631513600 0.0.3.2.25 > 0.0.1.1.1024: . ack 118002 win 28000 
0:0:4.631513600 0.0.1.1.1024 > 0.0.3.2.25: . 132002:133002(1000) ack 256002 win 28000 
0:0:4.642193600 0.0.3.2.25 > 0.0.1.1.1024: . ack 119002 win 28000 
0:0:4.642193600 0.0.1.1.1024 > 0.0.3.2.25: . 133002:134002(1000) ack 256002 win 28000 
0:0:4.652873600 0.0.3.2.25 > 0.0.1.1.1024: . ack 120002 win 28000 
0:0:4.652873600 0.0.1.1.1024 > 0.0.3.2.25: . 134002:135002(1000) ack 256002 win 28000 
0:0:4.663553600 0.0.3.2.25 > 0.0.1.1.1024: . ack 121002 win 28000 
0:0:4.663553600 0.0.1.1.1024 > 0.0.3.2.25: . 135002:136002(1000) ack 256002 win 28000 
0:0:4.674233600 0.0.3.2.25 > 0.0.1.1.1024: . ack 122002 win 28000 
0:0:4.674233600 0.0.1.1.1024 > 0.0.3.2.25: . 136002:137002(1000) ack 256002 win 28000 
0:0:4.684913600 0.0.3.2.25 > 0.0.1.1.1024: . ack 123002 win 28000 
0:0:4.684913600 0.0.1.1.1024 > 0.0.3.2.25: . 137002:138002(1000) ack 256002 win 28000 
0:0:4.695593600 0.0.3.2.25 > 0.0.1.1.1024: . ack 124002 win 28000 
0:0:4.695593600 0.0.1.1.1024 > 0.0.3.2.25: . 138002:139002(1000) ack 256002 win 28000 
0:0:4.706273600 0.0.3.2.25 > 0.0.1.1.1024: . ack 125002 win 28000 
0:0:4.706273600 0.0.1.1.1024 > 0.0.3.2.25: . 139002:140002(1000) ack 256002 win 28000 
0:0:4.716953600 0.0.3.2.25 > 0.0.1.1.1024: . ack 126002 win 28000 
0:0:4.716953600 0.0.1.1.1024 > 0.0.3.2.25: . 140002:141002(1000) ack 256002 win 28000 
0:0:4.727633600 0.0.3.2.25 > 0.0.1.1.1024: . ack 127002 win 28000 
0:0:4.727633600 0.0.1.1.1024 > 0.0.3.2.25: . 141002:142002(1000) ack 256002 win 28000 
0:0:4.738313600 0.0.3.2.25 > 0.0.1.1.1024: . ack 128002 win 28000 
0:0:4.738313600 0.0.1.1.1024 > 0.0.3.2.25: . 142002:143002(1000) ack 256002 win 28000 
0:0:4.748993600 0.0.3.2.25 > 0.0.1.1.1024: . ack 129002 win 28000 
0:0:4.748993600 0.0.1.1.1024 > 0.0.3.2.25: . 143002:144002(1000) ack 256002 win 28000 
0:0:4.759673600 0.0.3.2.25 > 0.0.1.1.1024: . ack 130002 win 28000 
0:0:4.759673600 0.0.1.1.1024 > 0.0.3.2.25: . 144002:145002(1000) ack 256002 win 28000 
0:0:4.789745600 0.0.3.2.25 > 0.0.1.1.1024: . ack 131002 win 28000 
0:0:4.789745600 0.0.1.1.1024 > 0.0.3.2.25: . 145002:146002(1000) ack 256002 win 28000 
0:0:4.789745600 0.0.1.1.1024 > 0.0.3.2.25: . 146002:147002(1000) ack 256002 win 28000 
0:0:4.800425600 0.0.3.2.25 > 0.0.1.1.1024: . ack 132002 win 28000 
0:0:4.800425600 0.0.1.1.1024 > 0.0.3.2.25: . 147002:148002(1000) ack 256002 win 28000 
0:0:4.853782400 0.0.3.2.25 > 0.0.1.1.1024: . ack 133002 win 28000 
0:0:4.853782400 0.0.1.1.1024 > 0.0.3.2.25: . 148002:149002(1000) ack 256002 win 28000 
0:0:4.864462400 0.0.3.2.25 > 0.0.1.1.1024: . ack 134002 win 28000 
0:0:4.864462400 0.0.1.1.1024 > 0.0.3.2.25: . 149002:150002(1000) ack 256002 win 28000 
0:0:4.875142400 0.0.3.2.25 > 0.0.1.1.1024: . ack 135002 win 28000 
0:0:4.875142400 0.0.1.1.1024 > 0.0.3.2.25: . 150002:151002(1000) ack 256002 win 28000 
0:0:4.885822400 0.0.3.2.25 > 0.0.1.1.1024: . ack 136002 win 28000 
0:0:4.885822400 0.0.1.1.1024 > 0.0.3.2.25: . 151002:152002(1000) ack 256002 win 28000 
0:0:4.896502400 0.0.3.2.25 > 0.0.1.1.1024: . ack 137002 win 28000 
0:0:4.896502400 0.0.1.1.1024 > 0.0.3.2.25: . 152002:153002(1000) ack 256002 win 28000 
0:0:4.907182400 0.0.3.2.25 > 0.0.1.1.1024: . ack 138002 win 28000 
0:0:4.907182400 0.0.1.1.1024 > 0.0.3.2.25: . 153002:154002(1000) ack 256002 win 28000 
0:0:4.917862400 0.0.3.2.25 > 0.0.1.1.1024: . ack 139002 win 28000 
0:0:4.917862400 0.0.1.1.1024 > 0.0.3.2.25: . 154002:155002(1000) ack 256002 win 28000 
0:0:4.928542400 0.0.3.2.25 > 0.0.1.1.1024: . ack 140002 win 28000 
0:0:4.928542400 0.0.1.1.1024 > 0.0.3.2.25: . 155002:156002(1000) ack 256002 win 28000 
0:0:4.939222400 0.0.3.2.25 > 0.0.1.1.1024: . ack 141002 win 28000 
0:0:4.939222400 0.0.1.1.1024 > 0.0.3.2.25: . 156002:157002(1000) ack 256002 win 28000 
0:0:4.949902400 0.0.3.2.25 > 0.0.1.1.1024: . ack 142002 win 28000 
0:0:4.949902400 0.0.1.1.1024 > 0.0.3.2.25: . 157002:158002(1000) ack 256002 win 28000 
0:0:4.960582400 0.0.3.2.25 > 0.0.1.1.1024: . ack 143002 win 28000 
0:0:4.960582400 0.0.1.1.1024 > 0.0.3.2.25: . 158002:159002(1000) ack 256002 win 28000 
0:0:4.971262400 0.0.3.2.25 > 0.0.1.1.1024: . ack 144002 win 28000 
0:0:4.971262400 0.0.1.1.1024 > 0.0.3.2.25: . 159002:160002(1000) ack 256002 win 28000 
0:0:4.981942400 0.0.3.2.25 > 0.0.1.1.1024: . ack 145002 win 28000 
0:0:4.981942400 0.0.1.1.1024 > 0.0.3.2.25: . 160002:161002(1000) ack 256002 win 28000 
0:0:5.012014400 0.0.3.2.25 > 0.0.1.1.1024: . ack 146002 win 28000 
0:0:5.012014400 0.0.1.1.1024 > 0.0.3.2.25: . 161002:162002(1000) ack 256002 win 28000 
0:0:5.022694400 0.0.3.2.25 > 0.0.1.1.1024: . ack 147002 win 28000 
0:0:5.022694400 0.0.1.1.1024 > 0.0.3.2.25: . 162002:163002(1000) ack 256002 win 28000 
0:0:5.022694400 0.0.1.1.1024 > 0.0.3.2.25: . 163002:164002(1000) ack 256002 win 28000 
0:0:5.033374400 0.0.3.2.25 > 0.0.1.1.1024: . ack 148002 win 28000 
0:0:5.033374400 0.0.1.1.1024 > 0.0.3.2.25: . 164002:165002(1000) ack 256002 win 28000 
0:0:5.076051200 0.0.3.2.25 > 0.0.1.1.1024: . ack 149002 win 28000 
0:0:5.076051200 0.0.1.1.1024 > 0.0.3.2.25: . 165002:166002(1000) ack 256002 win 28000 
0:0:5.086731200 0.0.3.2.25 > 0.0.1.1.1024: . ack 150002 win 28000 
0:0:5.086731200 0.0.1.1.1024 > 0.0.3.2.25: . 166002:167002(1000) ack 256002 win 28000 
0:0:5.097411200 0.0.3.2.25 > 0.0.1.1.1024: . ack 151002 win 28000 
0:0:5.097411200 0.0.1.1.1024 > 0.0.3.2.25: . 167002:168002(1000) ack 256002 win 28000 
0:0:5.108091200 0.0.3.2.25 > 0.0.1.1.1024: . ack 152002 win 28000 
0:0:5.108091200 0.0.1.1.1024 > 0.0.3.2.25: . 168002:169002(1000) ack 256002 win 28000 
0:0:5.118771200 0.0.3.2.25 > 0.0.1.1.1024: . ack 153002 win 28000 
0:0:5.118771200 0.0.1.1.1024 > 0.0.3.2.25: . 169002:170002(1000) ack 256002 win 28000 
0:0:5.129451200 0.0.3.2.25 > 0.0.1.1.1024: . ack 154002 win 28000 
0:0:5.129451200 0.0.1.1.1024 > 0.0.3.2.25: . 170002:171002(1000) ack 256002 win 28000 
0:0:5.140131200 0.0.3.2.25 > 0.0.1.1.1024: . ack 155002 win 28000 
0:0:5.140131200 0.0.1.1.1024 > 0.0.3.2.25: . 171002:172002(1000) ack 256002 win 28000 
0:0:5.150811200 0.0.3.2.25 > 0.0.1.1.1024: . ack 156002 win 28000 
0:0:5.150811200 0.0.1.1.1024 > 0.0.3.2.25: . 172002:173002(1000) ack 256002 win 28000 
0:0:5.161491200 0.0.3.2.25 > 0.0.1.1.1024: . ack 157002 win 28000 
0:0:5.161491200 0.0.1.1.1024 > 0.0.3.2.25: . 173002:174002(1000) ack 256002 win 28000 
0:0:5.172171200 0.0.3.2.25 > 0.0.1.1.1024: . ack 158002 win 28000 
0:0:5.172171200 0.0.1.1.1024 > 0.0.3.2.25: . 174002:175002(1000) ack 256002 win 28000 
0:0:5.182851200 0.0.3.2.25 > 0.0.1.1.1024: . ack 159002 win 28000 
0:0:5.182851200 0.0.1.1.1024 > 0.0.3.2.25: . 175002:176002(1000) ack 256002 win 28000 
0:0:5.193531200 0.0.3.2.25 > 0.0.1.1.1024: . ack 160002 win 28000 
0:0:5.193531200 0.0.1.1.1024 > 0.0.3.2.25: . 176002:177002(1000) ack 256002 win 28000 
0:0:5.204211200 0.0.3.2.25 > 0.0.1.1.1024: . ack 161002 win 28000 
0:0:5.204211200 0.0.1.1.1024 > 0.0.3.2.25: . 177002:178002(1000) ack 256002 win 28000 
0:0:5.234283200 0.0.3.2.25 > 0.0.1.1.1024: . ack 162002 win 28000 
0:0:5.234283200 0.0.1.1.1024 > 0.0.3.2.25: . 178002:179002(1000) ack 256002 win 28000 
0:0:5.244963200 0.0.3.2.25 > 0.0.1.1.1024: . ack 163002 win 28000 
0:0:5.244963200 0.0.1.1.1024 > 0.0.3.2.25: . 179002:180002(1000) ack 256002 win 28000 
0:0:5.255643200 0.0.3.2.25 > 0.0.1.1.1024: . ack 164002 win 28000 
0:0:5.255643200 0.0.1.1.1024 > 0.0.3.2.25: . 180002:181002(1000) ack 256002 win 28000 
0:0:5.266323200 0.0.3.2.25 > 0.0.1.1.1024: . ack 165002 win 28000 
0:0:5.266323200 0.0.1.1.1024 > 0.0.3.2.25: . 181002:182002(1000) ack 256002 win 28000 
0:0:5.266323200 0.0.1.1.1024 > 0.0.3.2.25: . 182002:183002(1000) ack 256002 win 28000 
0:0:5.298320000 0.0.3.2.25 > 0.0.1.1.1024: . ack 166002 win 28000 
0:0:5.298320000 0.0.1.1.1024 > 0.0.3.2.25: . 183002:184002(1000) ack 256002 win 28000 
0:0:5.309000000 0.0.3.2.25 > 0.0.1.1.1024: . ack 167002 win 28000 
0:0:5.309000000 0.0.1.1.1024 > 0.0.3.2.25: . 184002:185002(1000) ack 256002 win 28000 
0:0:5.319680000 0.0.3.2.25 > 0.0.1.1.1024: . ack 168002 win 28000 
0:0:5.319680000 0.0.1.1.1024 > 0.0.3.2.25: . 185002:186002(1000) ack 256002 win 28000 
0:0:5.330360000 0.0.3.2.25 > 0.0.1.1.1024: . ack 169002 win 28000 
0:0:5.330360000 0.0.1.1.1024 > 0.0.3.2.25: . 186002:187002(1000) ack 256002 win 28000 
0:0:5.341040000 0.0.3.2.25 > 0.0.1.1.1024: . ack 170002 win 28000 
0:0:5.341040000 0.0.1.1.1024 > 0.0.3.2.25: . 187002:188002(1000) ack 256002 win 28000 
0:0:5.351720000 0.0.3.2.25 > 0.0.1.1.1024: . ack 171002 win 28000 
0:0:5.351720000 0.0.1.1.1024 > 0.0.3.2.25: . 188002:189002(1000) ack 256002 win 28000 
0:0:5.362400000 0.0.3.2.25 > 0.0.1.1.1024: . ack 172002 win 28000 
0:0:5.362400000 0.0.1.1.1024 > 0.0.3.2.25: . 189002:190002(1000) ack 256002 win 28000 
0:0:5.373080000 0.0.3.2.25 > 0.0.1.1.1024: . ack 173002 win 28000 
0:0:5.373080000 0.0.1.1.1024 > 0.0.3.2.25: . 190002:191002(1000) ack 256002 win 28000 
0:0:5.383760000 0.0.3.2.25 > 0.0.1.1.1024: . ack 174002 win 28000 
0:0:5.383760000 0.0.1.1.1024 > 0.0.3.2.25: . 191002:192002(1000) ack 256002 win 28000 
0:0:5.394440000 0.0.3.2.25 > 0.0.1.1.1024: . ack 175002 win 28000 
0:0:5.394440000 0.0.1.1.1024 > 0.0.3.2.25: . 192002:193002(1000) ack 256002 win 28000 
0:0:5.405120000 0.0.3.2.25 > 0.0.1.1.1024: . ack 176002 win 28000 
0:0:5.405120000 0.0.1.1.1024 > 0.0.3.2.25: . 193002:194002(1000) ack 256002 win 28000 
0:0:5.415800000 0.0.3.2.25 > 0.0.1.1.1024: . ack 177002 win 28000 
0:0:5.415800000 0.0.1.1.1024 > 0.0.3.2.25: . 194002:195002(1000) ack 256002 win 28000 
0:0:5.426480000 0.0.3.2.25 > 0.0.1.1.1024: . ack 178002 win 28000 
0:0:5.426480000 0.0.1.1.1024 > 0.0.3.2.25: . 195002:196002(1000) ack 256002 win 28000 
0:0:5.456552000 0.0.3.2.25 > 0.0.1.1.1024: . ack 179002 win 28000 
0:0:5.456552000 0.0.1.1.1024 > 0.0.3.2.25: . 196002:197002(1000) ack 256002 win 28000 
0:0:5.467232000 0.0.3.2.25 > 0.0.1.1.1024: . ack 180002 win 28000 
0:0:5.467232000 0.0.1.1.1024 > 0.0.3.2.25: . 197002:198002(1000) ack 256002 win 28000 
0:0:5.477912000 0.0.3.2.25 > 0.0.1.1.1024: . ack 181002 win 28000 
0:0:5.477912000 0.0.1.1.1024 > 0.0.3.2.25: . 198002:199002(1000) ack 256002 win 28000 
0:0:5.488592000 0.0.3.2.25 > 0.0.1.1.1024: . ack 182002 win 28000 
0:0:5.488592000 0.0.1.1.1024 > 0.0.3.2.25: . 199002:200002(1000) ack 256002 win 28000 
0:0:5.499272000 0.0.3.2.25 > 0.0.1.1.1024: . ack 183002 win 28000 
0:0:5.499272000 0.0.1.1.1024 > 0.0.3.2.25: . 200002:201002(1000) ack 256002 win 28000 
0:0:5.520588800 0.0.3.2.25 > 0.0.1.1.1024: . ack 184002 win 28000 
0:0:5.520588800 0.0.1.1.1024 > 0.0.3.2.25: . 201002:202002(1000) ack 256002 win 28000 
0:0:5.520588800 0.0.1.1.1024 > 0.0.3.2.25: . 202002:203002(1000) ack 256002 win 28000 
0:0:5.531268800 0.0.3.2.25 > 0.0.1.1.1024: . ack 185002 win 28000 
0:0:5.531268800 0.0.1.1.1024 > 0.0.3.2.25: . 203002:204002(1000) ack 256002 win 28000 
0:0:5.541948800 0.0.3.2.25 > 0.0.1.1.1024: . ack 186002 win 28000 
0:0:5.541948800 0.0.1.1.1024 > 0.0.3.2.25: . 204002:205002(1000) ack 256002 win 28000 
0:0:5.552628800 0.0.3.2.25 > 0.0.1.1.1024: . ack 187002 win 28000 
0:0:5.552628800 0.0.1.1.1024 > 0.0.3.2.25: . 205002:206002(1000) ack 256002 win 28000 
0:0:5.563308800 0.0.3.2.25 > 0.0.1.1.1024: . ack 188002 win 28000 
0:0:5.563308800 0.0.1.1.1024 > 0.0.3.2.25: . 206002:207002(1000) ack 256002 win 28000 
0:0:5.573988800 0.0.3.2.25 > 0.0.1.1.1024: . ack 189002 win 28000 
0:0:5.573988800 0.0.1.1.1024 > 0.0.3.2.25: . 207002:208002(1000) ack 256002 win 28000 
0:0:5.584668800 0.0.3.2.25 > 0.0.1.1.1024: . ack 190002 win 28000 
0:0:5.584668800 0.0.1.1.1024 > 0.0.3.2.25: . 208002:209002(1000) ack 256002 win 28000 
0:0:5.595348800 0.0.3.2.25 > 0.0.1.1.1024: . ack 191002 win 28000 
0:0:5.595348800 0.0.1.1.1024 > 0.0.3.2.25: . 209002:210002(1000) ack 256002 win 28000 
0:0:5.606028800 0.0.3.2.25 > 0.0.1.1.1024: . ack 192002 win 28000 
0:0:5.606028800 0.0.1.1.1024 > 0.0.3.2.25: . 210002:211002(1000) ack 256002 win 28000 
0:0:5.616708800 0.0.3.2.25 > 0.0.1.1.1024: . ack 193002 win 28000 
0:0:5.616708800 0.0.1.1.1024 > 0.0.3.2.25: . 211002:212002(1000) ack 256002 win 28000 
0:0:5.627388800 0.0.3.2.25 > 0.0.1.1.1024: . ack 194002 win 28000 
0:0:5.627388800 0.0.1.1.1024 > 0.0.3.2.25: . 212002:213002(1000) ack 256002 win 28000 
0:0:5.638068800 0.0.3.2.25 > 0.0.1.1.1024: . ack 195002 win 28000 
0:0:5.638068800 0.0.1.1.1024 > 0.0.3.2.25: . 213002:214002(1000) ack 256002 win 28000 
0:0:5.648748800 0.0.3.2.25 > 0.0.1.1.1024: . ack 196002 win 28000 
0:0:5.648748800 0.0.1.1.1024 > 0.0.3.2.25: . 214002:215002(1000) ack 256002 win 28000 
0:0:5.678820800 0.0.3.2.25 > 0.0.1.1.1024: . ack 197002 win 28000 
0:0:5.678820800 0.0.1.1.1024 > 0.0.3.2.25: . 215002:216002(1000) ack 256002 win 28000 
0:0:5.689500800 0.0.3.2.25 > 0.0.1.1.1024: . ack 198002 win 28000 
0:0:5.689500800 0.0.1.1.1024 > 0.0.3.2.25: . 216002:217002(1000) ack 256002 win 28000 
0:0:5.700180800 0.0.3.2.25 > 0.0.1.1.1024: . ack 199002 win 28000 
0:0:5.700180800 0.0.1.1.1024 > 0.0.3.2.25: . 217002:218002(1000) ack 256002 win 28000 
0:0:5.710860800 0.0.3.2.25 > 0.0.1.1.1024: . ack 200002 win 28000 
0:0:5.710860800 0.0.1.1.1024 > 0.0.3.2.25: . 218002:219002(1000) ack 256002 win 28000 
0:0:5.721540800 0.0.3.2.25 > 0.0.1.1.1024: . ack 201002 win 28000 
0:0:5.721540800 0.0.1.1.1024 > 0.0.3.2.25: . 219002:220002(1000) ack 256002 win 28000 
0:0:5.742857600 0.0.3.2.25 > 0.0.1.1.1024: . ack 202002 win 28000 
0:0:5.742857600 0.0.1.1.1024 > 0.0.3.2.25: . 220002:221002(1000) ack 256002 win 28000 
0:0:5.753537600 0.0.3.2.25 > 0.0.1.1.1024: . ack 203002 win 28000 
0:0:5.753537600 0.0.1.1.1024 > 0.0.3.2.25: . 221002:222002(1000) ack 256002 win 28000 
0:0:5.753537600 0.0.1.1.1024 > 0.0.3.2.25: . 222002:223002(1000) ack 256002 win 28000 
0:0:5.764217600 0.0.3.2.25 > 0.0.1.1.1024: . ack 204002 win 28000 
0:0:5.764217600 0.0.1.1.1024 > 0.0.3.2.25: . 223002:224002(1000) ack 256002 win 28000 
0:0:5.774897600 0.0.3.2.25 > 0.0.1.1.1024: . ack 205002 win 28000 
0:0:5.774897600 0.0.1.1.1024 > 0.0.3.2.25: . 224002:225002(1000) ack 256002 win 28000 
0:0:5.785577600 0.0.3.2.25 > 0.0.1.1.1024: . ack 206002 win 28000 
0:0:5.785577600 0.0.1.1.1024 > 0.0.3.2.25: . 225002:226002(1000) ack 256002 win 28000 
0:0:5.796257600 0.0.3.2.25 > 0.0.1.1.1024: . ack 207002 win 28000 
0:0:5.796257600 0.0.1.1.1024 > 0.0.3.2.25: . 226002:227002(1000) ack 256002 win 28000 
0:0:5.806937600 0.0.3.2.25 > 0.0.1.1.1024: . ack 208002 win 28000 
0:0:5.806937600 0.0.1.1.1024 > 0.0.3.2.25: . 227002:228002(1000) ack 256002 win 28000 
0:0:5.817617600 0.0.3.2.25 > 0.0.1.1.1024: . ack 209002 win 28000 
0:0:5.817617600 0.0.1.1.1024 > 0.0.3.2.25: . 228002:229002(1000) ack 256002 win 28000 
0:0:5.828297600 0.0.3.2.25 > 0.0.1.1.1024: . ack 210002 win 28000 
0:0:5.828297600 0.0.1.1.1024 > 0.0.3.2.25: . 229002:230002(1000) ack 256002 win 28000 
0:0:5.838977600 0.0.3.2.25 > 0.0.1.1.1024: . ack 211002 win 28000 
0:0:5.838977600 0.0.1.1.1024 > 0.0.3.2.25: . 230002:231002(1000) ack 256002 win 28000 
0:0:5.849657600 0.0.3.2.25 > 0.0.1.1.1024: . ack 212002 win 28000 
0:0:5.849657600 0.0.1.1.1024 > 0.0.3.2.25: . 231002:232002(1000) ack 256002 win 28000 
0:0:5.860337600 0.0.3.2.25 > 0.0.1.1.1024: . ack 213002 win 28000 
0:0:5.860337600 0.0.1.1.1024 > 0.0.3.2.25: . 232002:233002(1000) ack 256002 win 28000 
0:0:5.871017600 0.0.3.2.25 > 0.0.1.1.1024: . ack 214002 win 28000 
0:0:5.871017600 0.0.1.1.1024 > 0.0.3.2.25: . 233002:234002(1000) ack 256002 win 28000 
0:0:5.881697600 0.0.3.2.25 > 0.0.1.1.1024: . ack 215002 win 28000 
0:0:5.881697600 0.0.1.1.1024 > 0.0.3.2.25: . 234002:235002(1000) ack 256002 win 28000 
0:0:5.901089600 0.0.3.2.25 > 0.0.1.1.1024: . ack 216002 win 28000 
0:0:5.901089600 0.0.1.1.1024 > 0.0.3.2.25: . 235002:236002(1000) ack 256002 win 28000 
0:0:5.911769600 0.0.3.2.25 > 0.0.1.1.1024: . ack 217002 win 28000 
0:0:5.911769600 0.0.1.1.1024 > 0.0.3.2.25: . 236002:237002(1000) ack 256002 win 28000 
0:0:5.922449600 0.0.3.2.25 > 0.0.1.1.1024: . ack 218002 win 28000 
0:0:5.922449600 0.0.1.1.1024 > 0.0.3.2.25: . 237002:238002(1000) ack 256002 win 28000 
0:0:5.933129600 0.0.3.2.25 > 0.0.1.1.1024: . ack 219002 win 28000 
0:0:5.933129600 0.0.1.1.1024 > 0.0.3.2.25: . 238002:239002(1000) ack 256002 win 28000 
0:0:5.943809600 0.0.3.2.25 > 0.0.1.1.1024: . ack 220002 win 28000 
0:0:5.943809600 0.0.1.1.1024 > 0.0.3.2.25: . 239002:240002(1000) ack 256002 win 28000 
0:0:5.965126400 0.0.3.2.25 > 0.0.1.1.1024: . ack 221002 win 28000 
0:0:5.965126400 0.0.1.1.1024 > 0.0.3.2.25: . 240002:241002(1000) ack 256002 win 28000 
0:0:5.975806400 0.0.3.2.25 > 0.0.1.1.1024: . ack 222002 win 28000 
0:0:5.975806400 0.0.1.1.1024 > 0.0.3.2.25: . 241002:242002(1000) ack 256002 win 28000 
0:0:5.986486400 0.0.3.2.25 > 0.0.1.1.1024: . ack 223002 win 28000 
0:0:5.986486400 0.0.1.1.1024 > 0.0.3.2.25: . 242002:243002(1000) ack 256002 win 28000 
0:0:5.997166400 0.0.3.2.25 > 0.0.1.1.1024: . ack 224002 win 28000 
0:0:5.997166400 0.0.1.1.1024 > 0.0.3.2.25: . 243002:244002(1000) ack 256002 win 28000 
0:0:5.997166400 0.0.1.1.1024 > 0.0.3.2.25: . 244002:245002(1000) ack 256002 win 28000 
