0:0:1.000000000 0.0.1.1.1024 > 0.0.3.2.25: S win 28000 <mss 1000>
0:0:1.211555200 0.0.3.2.25 > 0.0.1.1.1024: S ack 2 win 28000 <mss 1000>
0:0:1.211555200 0.0.1.1.1024 > 0.0.3.2.25: . ack 256002 win 28000 
0:0:1.211556200 0.0.1.1.1024 > 0.0.3.2.25: P 2:1002(1000) ack 256002 win 28000 
0:0:1.433878400 0.0.3.2.25 > 0.0.1.1.1024: . ack 1002 win 28000 
0:0:1.433878400 0.0.1.1.1024 > 0.0.3.2.25: . 1002:2002(1000) ack 256002 win 28000 
0:0:1.433878400 0.0.1.1.1024 > 0.0.3.2.25: . 2002:3002(1000) ack 256002 win 28000 
0:0:1.656147200 0.0.3.2.25 > 0.0.1.1.1024: . ack 2002 win 28000 
0:0:1.656147200 0.0.1.1.1024 > 0.0.3.2.25: . 3002:4002(1000) ack 256002 win 28000 
0:0:1.656147200 0.0.1.1.1024 > 0.0.3.2.25: . 4002:5002(1000) ack 256002 win 28000 
0:0:1.666827200 0.0.3.2.25 > 0.0.1.1.1024: . ack 3002 win 28000 
0:0:1.666827200 0.0.1.1.1024 > 0.0.3.2.25: . 5002:6002(1000) ack 256002 win 28000 
0:0:1.666827200 0.0.1.1.1024 > 0.0.3.2.25: . 6002:7002(1000) ack 256002 win 28000 
0:0:1.878416000 0.0.3.2.25 > 0.0.1.1.1024: . ack 4002 win 28000 
0:0:1.878416000 0.0.1.1.1024 > 0.0.3.2.25: . 7002:8002(1000) ack 256002 win 28000 
0:0:1.878416000 0.0.1.1.1024 > 0.0.3.2.25: . 8002:9002(1000) ack 256002 win 28000 
0:0:1.889096000 0.0.3.2.25 > 0.0.1.1.1024: . ack 5002 win 28000 
0:0:1.889096000 0.0.1.1.1024 > 0.0.3.2.25: . 9002:10002(1000) ack 256002 win 28000 
0:0:1.889096000 0.0.1.1.1024 > 0.0.3.2.25: . 10002:11002(1000) ack 256002 win 28000 
0:0:1.899776000 0.0.3.2.25 > 0.0.1.1.1024: . ack 6002 win 28000 
0:0:1.899776000 0.0.1.1.1024 > 0.0.3.2.25: . 11002:12002(1000) ack 256002 win 28000 
0:0:1.899776000 0.0.1.1.1024 > 0.0.3.2.25: . 12002:13002(1000) ack 256002 win 28000 
0:0:1.910456000 0.0.3.2.25 > 0.0.1.1.1024: . ack 7002 win 28000 
0:0:1.910456000 0.0.1.1.1024 > 0.0.3.2.25: . 13002:14002(1000) ack 256002 win 28000 
0:0:1.910456000 0.0.1.1.1024 > 0.0.3.2.25: . 14002:15002(1000) ack 256002 win 28000 
0:0:2.100684800 0.0.3.2.25 > 0.0.1.1.1024: . ack 8002 win 28000 
0:0:2.100684800 0.0.1.1.1024 > 0.0.3.2.25: . 15002:16002(1000) ack 256002 win 28000 
0:0:2.100684800 0.0.1.1.1024 > 0.0.3.2.25: . 16002:17002(1000) ack 256002 win 28000 
0:0:2.111364800 0.0.3.2.25 > 0.0.1.1.1024: . ack 9002 win 28000 
0:0:2.111364800 0.0.1.1.1024 > 0.0.3.2.25: . 17002:18002(1000) ack 256002 win 28000 
0:0:2.111364800 0.0.1.1.1024 > 0.0.3.2.25: . 18002:19002(1000) ack 256002 win 28000 
0:0:2.122044800 0.0.3.2.25 > 0.0.1.1.1024: . ack 10002 win 28000 
0:0:2.122044800 0.0.1.1.1024 > 0.0.3.2.25: . 19002:20002(1000) ack 256002 win 28000 
0:0:2.122044800 0.0.1.1.1024 > 0.0.3.2.25: . 20002:21002(1000) ack 256002 win 28000 
0:0:2.132724800 0.0.3.2.25 > 0.0.1.1.1024: . ack 11002 win 28000 
0:0:2.132724800 0.0.1.1.1024 > 0.0.3.2.25: . 21002:22002(1000) ack 256002 win 28000 
0:0:2.132724800 0.0.1.1.1024 > 0.0.3.2.25: . 22002:23002(1000) ack 256002 win 28000 
0:0:2.143404800 0.0.3.2.25 > 0.0.1.1.1024: . ack 12002 win 28000 
0:0:2.143404800 0.0.1.1.1024 > 0.0.3.2.25: . 23002:24002(1000) ack 256002 win 28000 
0:0:2.143404800 0.0.1.1.1024 > 0.0.3.2.25: . 24002:25002(1000) ack 256002 win 28000 
0:0:2.154084800 0.0.3.2.25 > 0.0.1.1.1024: . ack 13002 win 28000 
0:0:2.154084800 0.0.1.1.1024 > 0.0.3.2.25: . 25002:26002(1000) ack 256002 win 28000 
0:0:2.154084800 0.0.1.1.1024 > 0.0.3.2.25: . 26002:27002(1000) ack 256002 win 28000 
0:0:2.164764800 0.0.3.2.25 > 0.0.1.1.1024: . ack 14002 win 28000 
0:0:2.164764800 0.0.1.1.1024 > 0.0.3.2.25: . 27002:28002(1000) ack 256002 win 28000 
0:0:2.164764800 0.0.1.1.1024 > 0.0.3.2.25: . 28002:29002(1000) ack 256002 win 28000 
0:0:2.322953600 0.0.3.2.25 > 0.0.1.1.1024: . ack 14002 win 28000 
0:0:2.333633600 0.0.3.2.25 > 0.0.1.1.1024: . ack 14002 win 28000 
0:0:2.344313600 0.0.3.2.25 > 0.0.1.1.1024: . ack 14002 win 28000 
0:0:2.344313600 0.0.1.1.1024 > 0.0.3.2.25: . 14002:15002(1000) ack 256002 win 28000 
0:0:2.354993600 0.0.3.2.25 > 0.0.1.1.1024: . ack 14002 win 28000 
0:0:2.365673600 0.0.3.2.25 > 0.0.1.1.1024: . ack 14002 win 28000 
0:0:2.376353600 0.0.3.2.25 > 0.0.1.1.1024: . ack 14002 win 28000 
0:0:2.387033600 0.0.3.2.25 > 0.0.1.1.1024: . ack 14002 win 28000 
0:0:2.397713600 0.0.3.2.25 > 0.0.1.1.1024: . ack 14002 win 28000 
0:0:2.408393600 0.0.3.2.25 > 0.0.1.1.1024: . ack 14002 win 28000 
0:0:2.408393600 0.0.1.1.1024 > 0.0.3.2.25: . 29002:30002(1000) ack 256002 win 28000 
0:0:2.429753600 0.0.3.2.25 > 0.0.1.1.1024: . ack 14002 win 28000 
0:0:2.429753600 0.0.1.1.1024 > 0.0.3.2.25: . 30002:31002(1000) ack 256002 win 28000 
0:0:2.451113600 0.0.3.2.25 > 0.0.1.1.1024: . ack 14002 win 28000 
0:0:2.451113600 0.0.1.1.1024 > 0.0.3.2.25: . 31002:32002(1000) ack 256002 win 28000 
0:0:2.566582400 0.0.3.2.25 > 0.0.1.1.1024: . ack 24002 win 28000 
0:0:2.630662400 0.0.3.2.25 > 0.0.1.1.1024: . ack 24002 win 28000 
0:0:2.652022400 0.0.3.2.25 > 0.0.1.1.1024: . ack 24002 win 28000 
0:0:2.673382400 0.0.3.2.25 > 0.0.1.1.1024: . ack 24002 win 28000 
0:0:2.673382400 0.0.1.1.1024 > 0.0.3.2.25: . 24002:25002(1000) ack 256002 win 28000 
0:0:2.895651200 0.0.3.2.25 > 0.0.1.1.1024: . ack 26002 win 28000 
0:0:5.652332788 0.0.1.1.1024 > 0.0.3.2.25: . 26002:27002(1000) ack 256002 win 28000 
0:0:5.874601588 0.0.3.2.25 > 0.0.1.1.1024: . ack 28002 win 28000 
0:0:5.874601588 0.0.1.1.1024 > 0.0.3.2.25: . 28002:29002(1000) ack 256002 win 28000 
0:0:5.874601588 0.0.1.1.1024 > 0.0.3.2.25: . 29002:30002(1000) ack 256002 win 28000 
