0:0:1.000000000 2001:0:1:1::1.1024 > 2001:0:1:3::2.25: S win 28000 <mss 1000>
0:0:1.211987200 2001:0:1:3::2.25 > 2001:0:1:1::1.1024: S ack 2 win 28000 <mss 1000>
0:0:1.211987200 2001:0:1:1::1.1024 > 2001:0:1:3::2.25: . ack 256002 win 28000 
0:0:1.211988200 2001:0:1:1::1.1024 > 2001:0:1:3::2.25: P 2:1002(1000) ack 256002 win 28000 
0:0:1.434768000 2001:0:1:3::2.25 > 2001:0:1:1::1.1024: . ack 1002 win 28000 
0:0:1.434768000 2001:0:1:1::1.1024 > 2001:0:1:3::2.25: . 1002:2002(1000) ack 256002 win 28000 
0:0:1.434768000 2001:0:1:1::1.1024 > 2001:0:1:3::2.25: . 2002:3002(1000) ack 256002 win 28000 
0:0:1.657468800 2001:0:1:3::2.25 > 2001:0:1:1::1.1024: . ack 2002 win 28000 
0:0:1.657468800 2001:0:1:1::1.1024 > 2001:0:1:3::2.25: . 3002:4002(1000) ack 256002 win 28000 
0:0:1.657468800 2001:0:1:1::1.1024 > 2001:0:1:3::2.25: . 4002:5002(1000) ack 256002 win 28000 
0:0:1.668348800 2001:0:1:3::2.25 > 2001:0:1:1::1.1024: . ack 3002 win 28000 
0:0:1.668348800 2001:0:1:1::1.1024 > 2001:0:1:3::2.25: . 5002:6002(1000) ack 256002 win 28000 
0:0:1.668348800 2001:0:1:1::1.1024 > 2001:0:1:3::2.25: . 6002:7002(1000) ack 256002 win 28000 
0:0:1.880169600 2001:0:1:3::2.25 > 2001:0:1:1::1.1024: . ack 4002 win 28000 
0:0:1.880169600 2001:0:1:1::1.1024 > 2001:0:1:3::2.25: . 7002:8002(1000) ack 256002 win 28000 
0:0:1.880169600 2001:0:1:1::1.1024 > 2001:0:1:3::2.25: . 8002:9002(1000) ack 256002 win 28000 
0:0:1.891049600 2001:0:1:3::2.25 > 2001:0:1:1::1.1024: . ack 5002 win 28000 
0:0:1.891049600 2001:0:1:1::1.1024 > 2001:0:1:3::2.25: . 9002:10002(1000) ack 256002 win 28000 
0:0:1.891049600 2001:0:1:1::1.1024 > 2001:0:1:3::2.25: . 10002:11002(1000) ack 256002 win 28000 
0:0:1.901929600 2001:0:1:3::2.25 > 2001:0:1:1::1.1024: . ack 6002 win 28000 
0:0:1.901929600 2001:0:1:1::1.1024 > 2001:0:1:3::2.25: . 11002:12002(1000) ack 256002 win 28000 
0:0:1.901929600 2001:0:1:1::1.1024 > 2001:0:1:3::2.25: . 12002:13002(1000) ack 256002 win 28000 
0:0:1.912809600 2001:0:1:3::2.25 > 2001:0:1:1::1.1024: . ack 7002 win 28000 
0:0:1.912809600 2001:0:1:1::1.1024 > 2001:0:1:3::2.25: . 13002:14002(1000) ack 256002 win 28000 
0:0:1.912809600 2001:0:1:1::1.1024 > 2001:0:1:3::2.25: . 14002:15002(1000) ack 256002 win 28000 
0:0:2.102870400 2001:0:1:3::2.25 > 2001:0:1:1::1.1024: . ack 8002 win 28000 
0:0:2.102870400 2001:0:1:1::1.1024 > 2001:0:1:3::2.25: . 15002:16002(1000) ack 256002 win 28000 
0:0:2.102870400 2001:0:1:1::1.1024 > 2001:0:1:3::2.25: . 16002:17002(1000) ack 256002 win 28000 
0:0:2.113750400 2001:0:1:3::2.25 > 2001:0:1:1::1.1024: . ack 9002 win 28000 
0:0:2.113750400 2001:0:1:1::1.1024 > 2001:0:1:3::2.25: . 17002:18002(1000) ack 256002 win 28000 
0:0:2.113750400 2001:0:1:1::1.1024 > 2001:0:1:3::2.25: . 18002:19002(1000) ack 256002 win 28000 
0:0:2.124630400 2001:0:1:3::2.25 > 2001:0:1:1::1.1024: . ack 10002 win 28000 
0:0:2.124630400 2001:0:1:1::1.1024 > 2001:0:1:3::2.25: . 19002:20002(1000) ack 256002 win 28000 
0:0:2.124630400 2001:0:1:1::1.1024 > 2001:0:1:3::2.25: . 20002:21002(1000) ack 256002 win 28000 
0:0:2.135510400 2001:0:1:3::2.25 > 2001:0:1:1::1.1024: . ack 11002 win 28000 
0:0:2.135510400 2001:0:1:1::1.1024 > 2001:0:1:3::2.25: . 21002:22002(1000) ack 256002 win 28000 
0:0:2.135510400 2001:0:1:1::1.1024 > 2001:0:1:3::2.25: . 22002:23002(1000) ack 256002 win 28000 
0:0:2.146390400 2001:0:1:3::2.25 > 2001:0:1:1::1.1024: . ack 12002 win 28000 
0:0:2.146390400 2001:0:1:1::1.1024 > 2001:0:1:3::2.25: . 23002:24002(1000) ack 256002 win 28000 
0:0:2.146390400 2001:0:1:1::1.1024 > 2001:0:1:3::2.25: . 24002:25002(1000) ack 256002 win 28000 
0:0:2.157270400 2001:0:1:3::2.25 > 2001:0:1:1::1.1024: . ack 13002 win 28000 
0:0:2.157270400 2001:0:1:1::1.1024 > 2001:0:1:3::2.25: . 25002:26002(1000) ack 256002 win 28000 
0:0:2.157270400 2001:0:1:1::1.1024 > 2001:0:1:3::2.25: . 26002:27002(1000) ack 256002 win 28000 
0:0:2.168150400 2001:0:1:3::2.25 > 2001:0:1:1::1.1024: . ack 14002 win 28000 
0:0:2.168150400 2001:0:1:1::1.1024 > 2001:0:1:3::2.25: . 27002:28002(1000) ack 256002 win 28000 
0:0:2.168150400 2001:0:1:1::1.1024 > 2001:0:1:3::2.25: . 28002:29002(1000) ack 256002 win 28000 
0:0:2.325571200 2001:0:1:3::2.25 > 2001:0:1:1::1.1024: . ack 14002 win 28000 
0:0:2.336451200 2001:0:1:3::2.25 > 2001:0:1:1::1.1024: . ack 14002 win 28000 
0:0:2.347331200 2001:0:1:3::2.25 > 2001:0:1:1::1.1024: . ack 14002 win 28000 
0:0:2.347331200 2001:0:1:1::1.1024 > 2001:0:1:3::2.25: . 14002:15002(1000) ack 256002 win 28000 
0:0:2.358211200 2001:0:1:3::2.25 > 2001:0:1:1::1.1024: . ack 14002 win 28000 
0:0:2.369091200 2001:0:1:3::2.25 > 2001:0:1:1::1.1024: . ack 14002 win 28000 
0:0:2.379971200 2001:0:1:3::2.25 > 2001:0:1:1::1.1024: . ack 14002 win 28000 
0:0:2.390851200 2001:0:1:3::2.25 > 2001:0:1:1::1.1024: . ack 14002 win 28000 
0:0:2.401731200 2001:0:1:3::2.25 > 2001:0:1:1::1.1024: . ack 14002 win 28000 
0:0:2.412611200 2001:0:1:3::2.25 > 2001:0:1:1::1.1024: . ack 14002 win 28000 
0:0:2.423491200 2001:0:1:3::2.25 > 2001:0:1:1::1.1024: . ack 14002 win 28000 
0:0:2.434371200 2001:0:1:3::2.25 > 2001:0:1:1::1.1024: . ack 14002 win 28000 
0:0:2.456131200 2001:0:1:3::2.25 > 2001:0:1:1::1.1024: . ack 14002 win 28000 
0:0:2.570032000 2001:0:1:3::2.25 > 2001:0:1:1::1.1024: . ack 26002 win 28000 
0:0:2.570032000 2001:0:1:1::1.1024 > 2001:0:1:3::2.25: . 26002:27002(1000) ack 256002 win 28000 
0:0:2.570032000 2001:0:1:1::1.1024 > 2001:0:1:3::2.25: . 27002:28002(1000) ack 256002 win 28000 
0:0:2.792732800 2001:0:1:3::2.25 > 2001:0:1:1::1.1024: . ack 28002 win 28000 
0:0:2.792732800 2001:0:1:1::1.1024 > 2001:0:1:3::2.25: . 28002:29002(1000) ack 256002 win 28000 
0:0:2.792732800 2001:0:1:1::1.1024 > 2001:0:1:3::2.25: . 29002:30002(1000) ack 256002 win 28000 
0:0:2.792732800 2001:0:1:1::1.1024 > 2001:0:1:3::2.25: . 30002:31002(1000) ack 256002 win 28000 
0:0:2.803612800 2001:0:1:3::2.25 > 2001:0:1:1::1.1024: . ack 28002 win 28000 
0:0:3.015433600 2001:0:1:3::2.25 > 2001:0:1:1::1.1024: . ack 29002 win 28000 
0:0:3.015433600 2001:0:1:1::1.1024 > 2001:0:1:3::2.25: . 31002:32002(1000) ack 256002 win 28000 
0:0:3.015433600 2001:0:1:1::1.1024 > 2001:0:1:3::2.25: . 32002:33002(1000) ack 256002 win 28000 
0:0:3.026313600 2001:0:1:3::2.25 > 2001:0:1:1::1.1024: . ack 30002 win 28000 
0:0:3.026313600 2001:0:1:1::1.1024 > 2001:0:1:3::2.25: . 33002:34002(1000) ack 256002 win 28000 
0:0:3.026313600 2001:0:1:1::1.1024 > 2001:0:1:3::2.25: . 34002:35002(1000) ack 256002 win 28000 
0:0:3.037193600 2001:0:1:3::2.25 > 2001:0:1:1::1.1024: . ack 31002 win 28000 
0:0:3.037193600 2001:0:1:1::1.1024 > 2001:0:1:3::2.25: . 35002:36002(1000) ack 256002 win 28000 
0:0:3.037193600 2001:0:1:1::1.1024 > 2001:0:1:3::2.25: . 36002:37002(1000) ack 256002 win 28000 
0:0:3.238134400 2001:0:1:3::2.25 > 2001:0:1:1::1.1024: . ack 32002 win 28000 
0:0:3.238134400 2001:0:1:1::1.1024 > 2001:0:1:3::2.25: . 37002:38002(1000) ack 256002 win 28000 
0:0:3.238134400 2001:0:1:1::1.1024 > 2001:0:1:3::2.25: . 38002:39002(1000) ack 256002 win 28000 
0:0:3.249014400 2001:0:1:3::2.25 > 2001:0:1:1::1.1024: . ack 33002 win 28000 
0:0:3.249014400 2001:0:1:1::1.1024 > 2001:0:1:3::2.25: . 39002:40002(1000) ack 256002 win 28000 
0:0:3.249014400 2001:0:1:1::1.1024 > 2001:0:1:3::2.25: . 40002:41002(1000) ack 256002 win 28000 
0:0:3.259894400 2001:0:1:3::2.25 > 2001:0:1:1::1.1024: . ack 34002 win 28000 
0:0:3.259894400 2001:0:1:1::1.1024 > 2001:0:1:3::2.25: . 41002:42002(1000) ack 256002 win 28000 
0:0:3.270774400 2001:0:1:3::2.25 > 2001:0:1:1::1.1024: . ack 35002 win 28000 
0:0:3.270774400 2001:0:1:1::1.1024 > 2001:0:1:3::2.25: . 42002:43002(1000) ack 256002 win 28000 
0:0:3.281654400 2001:0:1:3::2.25 > 2001:0:1:1::1.1024: . ack 36002 win 28000 
0:0:3.281654400 2001:0:1:1::1.1024 > 2001:0:1:3::2.25: . 43002:44002(1000) ack 256002 win 28000 
0:0:3.292534400 2001:0:1:3::2.25 > 2001:0:1:1::1.1024: . ack 37002 win 28000 
0:0:3.292534400 2001:0:1:1::1.1024 > 2001:0:1:3::2.25: . 44002:45002(1000) ack 256002 win 28000 
0:0:3.460835200 2001:0:1:3::2.25 > 2001:0:1:1::1.1024: . ack 38002 win 28000 
0:0:3.460835200 2001:0:1:1::1.1024 > 2001:0:1:3::2.25: . 45002:46002(1000) ack 256002 win 28000 
0:0:3.471715200 2001:0:1:3::2.25 > 2001:0:1:1::1.1024: . ack 39002 win 28000 
0:0:3.471715200 2001:0:1:1::1.1024 > 2001:0:1:3::2.25: . 46002:47002(1000) ack 256002 win 28000 
0:0:3.482595200 2001:0:1:3::2.25 > 2001:0:1:1::1.1024: . ack 40002 win 28000 
0:0:3.482595200 2001:0:1:1::1.1024 > 2001:0:1:3::2.25: . 47002:48002(1000) ack 256002 win 28000 
0:0:3.493475200 2001:0:1:3::2.25 > 2001:0:1:1::1.1024: . ack 41002 win 28000 
0:0:3.493475200 2001:0:1:1::1.1024 > 2001:0:1:3::2.25: . 48002:49002(1000) ack 256002 win 28000 
0:0:3.504355200 2001:0:1:3::2.25 > 2001:0:1:1::1.1024: . ack 42002 win 28000 
0:0:3.504355200 2001:0:1:1::1.1024 > 2001:0:1:3::2.25: . 49002:50002(1000) ack 256002 win 28000 
0:0:3.504355200 2001:0:1:1::1.1024 > 2001:0:1:3::2.25: . 50002:51002(1000) ack 256002 win 28000 
0:0:3.515235200 2001:0:1:3::2.25 > 2001:0:1:1::1.1024: . ack 43002 win 28000 
0:0:3.515235200 2001:0:1:1::1.1024 > 2001:0:1:3::2.25: . 51002:52002(1000) ack 256002 win 28000 
0:0:3.526115200 2001:0:1:3::2.25 > 2001:0:1:1::1.1024: . ack 44002 win 28000 
0:0:3.526115200 2001:0:1:1::1.1024 > 2001:0:1:3::2.25: . 52002:53002(1000) ack 256002 win 28000 
0:0:3.536995200 2001:0:1:3::2.25 > 2001:0:1:1::1.1024: . ack 45002 win 28000 
0:0:3.536995200 2001:0:1:1::1.1024 > 2001:0:1:3::2.25: . 53002:54002(1000) ack 256002 win 28000 
0:0:3.683536000 2001:0:1:3::2.25 > 2001:0:1:1::1.1024: . ack 46002 win 28000 
0:0:3.683536000 2001:0:1:1::1.1024 > 2001:0:1:3::2.25: . 54002:55002(1000) ack 256002 win 28000 
0:0:3.694416000 2001:0:1:3::2.25 > 2001:0:1:1::1.1024: . ack 47002 win 28000 
0:0:3.694416000 2001:0:1:1::1.1024 > 2001:0:1:3::2.25: . 55002:56002(1000) ack 256002 win 28000 
0:0:3.705296000 2001:0:1:3::2.25 > 2001:0:1:1::1.1024: . ack 48002 win 28000 
0:0:3.705296000 2001:0:1:1::1.1024 > 2001:0:1:3::2.25: . 56002:57002(1000) ack 256002 win 28000 
0:0:3.716176000 2001:0:1:3::2.25 > 2001:0:1:1::1.1024: . ack 49002 win 28000 
0:0:3.716176000 2001:0:1:1::1.1024 > 2001:0:1:3::2.25: . 57002:58002(1000) ack 256002 win 28000 
0:0:3.727056000 2001:0:1:3::2.25 > 2001:0:1:1::1.1024: . ack 50002 win 28000 
0:0:3.727056000 2001:0:1:1::1.1024 > 2001:0:1:3::2.25: . 58002:59002(1000) ack 256002 win 28000 
0:0:3.737936000 2001:0:1:3::2.25 > 2001:0:1:1::1.1024: . ack 51002 win 28000 
0:0:3.737936000 2001:0:1:1::1.1024 > 2001:0:1:3::2.25: . 59002:60002(1000) ack 256002 win 28000 
0:0:3.737936000 2001:0:1:1::1.1024 > 2001:0:1:3::2.25: . 60002:61002(1000) ack 256002 win 28000 
0:0:3.748816000 2001:0:1:3::2.25 > 2001:0:1:1::1.1024: . ack 52002 win 28000 
0:0:3.748816000 2001:0:1:1::1.1024 > 2001:0:1:3::2.25: . 61002:62002(1000) ack 256002 win 28000 
0:0:3.759696000 2001:0:1:3::2.25 > 2001:0:1:1::1.1024: . ack 53002 win 28000 
0:0:3.759696000 2001:0:1:1::1.1024 > 2001:0:1:3::2.25: . 62002:63002(1000) ack 256002 win 28000 
0:0:3.770576000 2001:0:1:3::2.25 > 2001:0:1:1::1.1024: . ack 54002 win 28000 
0:0:3.770576000 2001:0:1:1::1.1024 > 2001:0:1:3::2.25: . 63002:64002(1000) ack 256002 win 28000 
0:0:3.906236800 2001:0:1:3::2.25 > 2001:0:1:1::1.1024: . ack 55002 win 28000 
0:0:3.906236800 2001:0:1:1::1.1024 > 2001:0:1:3::2.25: . 64002:65002(1000) ack 256002 win 28000 
0:0:3.917116800 2001:0:1:3::2.25 > 2001:0:1:1::1.1024: . ack 56002 win 28000 
0:0:3.917116800 2001:0:1:1::1.1024 > 2001:0:1:3::2.25: . 65002:66002(1000) ack 256002 win 28000 
0:0:3.927996800 2001:0:1:3::2.25 > 2001:0:1:1::1.1024: . ack 57002 win 28000 
0:0:3.927996800 2001:0:1:1::1.1024 > 2001:0:1:3::2.25: . 66002:67002(1000) ack 256002 win 28000 
0:0:3.938876800 2001:0:1:3::2.25 > 2001:0:1:1::1.1024: . ack 58002 win 28000 
0:0:3.938876800 2001:0:1:1::1.1024 > 2001:0:1:3::2.25: . 67002:68002(1000) ack 256002 win 28000 
0:0:3.949756800 2001:0:1:3::2.25 > 2001:0:1:1::1.1024: . ack 59002 win 28000 
0:0:3.949756800 2001:0:1:1::1.1024 > 2001:0:1:3::2.25: . 68002:69002(1000) ack 256002 win 28000 
0:0:3.960636800 2001:0:1:3::2.25 > 2001:0:1:1::1.1024: . ack 60002 win 28000 
0:0:3.960636800 2001:0:1:1::1.1024 > 2001:0:1:3::2.25: . 69002:70002(1000) ack 256002 win 28000 
0:0:3.971516800 2001:0:1:3::2.25 > 2001:0:1:1::1.1024: . ack 61002 win 28000 
0:0:3.971516800 2001:0:1:1::1.1024 > 2001:0:1:3::2.25: . 70002:71002(1000) ack 256002 win 28000 
0:0:3.982396800 2001:0:1:3::2.25 > 2001:0:1:1::1.1024: . ack 62002 win 28000 
0:0:3.982396800 2001:0:1:1::1.1024 > 2001:0:1:3::2.25: . 71002:72002(1000) ack 256002 win 28000 
0:0:3.982396800 2001:0:1:1::1.1024 > 2001:0:1:3::2.25: . 72002:73002(1000) ack 256002 win 28000 
0:0:3.993276800 2001:0:1:3::2.25 > 2001:0:1:1::1.1024: . ack 63002 win 28000 
0:0:3.993276800 2001:0:1:1::1.1024 > 2001:0:1:3::2.25: . 73002:74002(1000) ack 256002 win 28000 
0:0:4.004156800 2001:0:1:3::2.25 > 2001:0:1:1::1.1024: . ack 64002 win 28000 
0:0:4.004156800 2001:0:1:1::1.1024 > 2001:0:1:3::2.25: . 74002:75002(1000) ack 256002 win 28000 
0:0:4.128937600 2001:0:1:3::2.25 > 2001:0:1:1::1.1024: . ack 65002 win 28000 
0:0:4.128937600 2001:0:1:1::1.1024 > 2001:0:1:3::2.25: . 75002:76002(1000) ack 256002 win 28000 
0:0:4.139817600 2001:0:1:3::2.25 > 2001:0:1:1::1.1024: . ack 66002 win 28000 
0:0:4.139817600 2001:0:1:1::1.1024 > 2001:0:1:3::2.25: . 76002:77002(1000) ack 256002 win 28000 
0:0:4.150697600 2001:0:1:3::2.25 > 2001:0:1:1::1.1024: . ack 67002 win 28000 
0:0:4.150697600 2001:0:1:1::1.1024 > 2001:0:1:3::2.25: . 77002:78002(1000) ack 256002 win 28000 
0:0:4.161577600 2001:0:1:3::2.25 > 2001:0:1:1::1.1024: . ack 68002 win 28000 
0:0:4.161577600 2001:0:1:1::1.1024 > 2001:0:1:3::2.25: . 78002:79002(1000) ack 256002 win 28000 
0:0:4.172457600 2001:0:1:3::2.25 > 2001:0:1:1::1.1024: . ack 69002 win 28000 
0:0:4.172457600 2001:0:1:1::1.1024 > 2001:0:1:3::2.25: . 79002:80002(1000) ack 256002 win 28000 
0:0:4.183337600 2001:0:1:3::2.25 > 2001:0:1:1::1.1024: . ack 70002 win 28000 
0:0:4.183337600 2001:0:1:1::1.1024 > 2001:0:1:3::2.25: . 80002:81002(1000) ack 256002 win 28000 
0:0:4.194217600 2001:0:1:3::2.25 > 2001:0:1:1::1.1024: . ack 71002 win 28000 
0:0:4.194217600 2001:0:1:1::1.1024 > 2001:0:1:3::2.25: . 81002:82002(1000) ack 256002 win 28000 
0:0:4.205097600 2001:0:1:3::2.25 > 2001:0:1:1::1.1024: . ack 72002 win 28000 
0:0:4.205097600 2001:0:1:1::1.1024 > 2001:0:1:3::2.25: . 82002:83002(1000) ack 256002 win 28000 
0:0:4.215977600 2001:0:1:3::2.25 > 2001:0:1:1::1.1024: . ack 73002 win 28000 
0:0:4.215977600 2001:0:1:1::1.1024 > 2001:0:1:3::2.25: . 83002:84002(1000) ack 256002 win 28000 
0:0:4.215977600 2001:0:1:1::1.1024 > 2001:0:1:3::2.25: . 84002:85002(1000) ack 256002 win 28000 
0:0:4.226857600 2001:0:1:3::2.25 > 2001:0:1:1::1.1024: . ack 74002 win 28000 
0:0:4.226857600 2001:0:1:1::1.1024 > 2001:0:1:3::2.25: . 85002:86002(1000) ack 256002 win 28000 
0:0:4.237737600 2001:0:1:3::2.25 > 2001:0:1:1::1.1024: . ack 75002 win 28000 
0:0:4.237737600 2001:0:1:1::1.1024 > 2001:0:1:3::2.25: . 86002:87002(1000) ack 256002 win 28000 
0:0:4.351638400 2001:0:1:3::2.25 > 2001:0:1:1::1.1024: . ack 76002 win 28000 
0:0:4.351638400 2001:0:1:1::1.1024 > 2001:0:1:3::2.25: . 87002:88002(1000) ack 256002 win 28000 
0:0:4.362518400 2001:0:1:3::2.25 > 2001:0:1:1::1.1024: . ack 77002 win 28000 
0:0:4.362518400 2001:0:1:1::1.1024 > 2001:0:1:3::2.25: . 88002:89002(1000) ack 256002 win 28000 
0:0:4.373398400 2001:0:1:3::2.25 > 2001:0:1:1::1.1024: . ack 78002 win 28000 
0:0:4.373398400 2001:0:1:1::1.1024 > 2001:0:1:3::2.25: . 89002:90002(1000) ack 256002 win 28000 
0:0:4.384278400 2001:0:1:3::2.25 > 2001:0:1:1::1.1024: . ack 79002 win 28000 
0:0:4.384278400 2001:0:1:1::1.1024 > 2001:0:1:3::2.25: . 90002:91002(1000) ack 256002 win 28000 
0:0:4.395158400 2001:0:1:3::2.25 > 2001:0:1:1::1.1024: . ack 80002 win 28000 
0:0:4.395158400 2001:0:1:1::1.1024 > 2001:0:1:3::2.25: . 91002:92002(1000) ack 256002 win 28000 
0:0:4.406038400 2001:0:1:3::2.25 > 2001:0:1:1::1.1024: . ack 81002 win 28000 
0:0:4.406038400 2001:0:1:1::1.1024 > 2001:0:1:3::2.25: . 92002:93002(1000) ack 256002 win 28000 
0:0:4.416918400 2001:0:1:3::2.25 > 2001:0:1:1::1.1024: . ack 82002 win 28000 
0:0:4.416918400 2001:0:1:1::1.1024 > 2001:0:1:3::2.25: . 93002:94002(1000) ack 256002 win 28000 
0:0:4.427798400 2001:0:1:3::2.25 > 2001:0:1:1::1.1024: . ack 83002 win 28000 
0:0:4.427798400 2001:0:1:1::1.1024 > 2001:0:1:3::2.25: . 94002:95002(1000) ack 256002 win 28000 
0:0:4.438678400 2001:0:1:3::2.25 > 2001:0:1:1::1.1024: . ack 84002 win 28000 
0:0:4.438678400 2001:0:1:1::1.1024 > 2001:0:1:3::2.25: . 95002:96002(1000) ack 256002 win 28000 
0:0:4.449558400 2001:0:1:3::2.25 > 2001:0:1:1::1.1024: . ack 85002 win 28000 
0:0:4.449558400 2001:0:1:1::1.1024 > 2001:0:1:3::2.25: . 96002:97002(1000) ack 256002 win 28000 
0:0:4.460438400 2001:0:1:3::2.25 > 2001:0:1:1::1.1024: . ack 86002 win 28000 
0:0:4.460438400 2001:0:1:1::1.1024 > 2001:0:1:3::2.25: . 97002:98002(1000) ack 256002 win 28000 
0:0:4.460438400 2001:0:1:1::1.1024 > 2001:0:1:3::2.25: . 98002:99002(1000) ack 256002 win 28000 
0:0:4.471318400 2001:0:1:3::2.25 > 2001:0:1:1::1.1024: . ack 87002 win 28000 
0:0:4.471318400 2001:0:1:1::1.1024 > 2001:0:1:3::2.25: . 99002:100002(1000) ack 256002 win 28000 
0:0:4.574339200 2001:0:1:3::2.25 > 2001:0:1:1::1.1024: . ack 88002 win 28000 
0:0:4.574339200 2001:0:1:1::1.1024 > 2001:0:1:3::2.25: . 100002:101002(1000) ack 256002 win 28000 
0:0:4.585219200 2001:0:1:3::2.25 > 2001:0:1:1::1.1024: . ack 89002 win 28000 
0:0:4.585219200 2001:0:1:1::1.1024 > 2001:0:1:3::2.25: . 101002:102002(1000) ack 256002 win 28000 
0:0:4.596099200 2001:0:1:3::2.25 > 2001:0:1:1::1.1024: . ack 90002 win 28000 
0:0:4.596099200 2001:0:1:1::1.1024 > 2001:0:1:3::2.25: . 102002:103002(1000) ack 256002 win 28000 
0:0:4.606979200 2001:0:1:3::2.25 > 2001:0:1:1::1.1024: . ack 91002 win 28000 
0:0:4.606979200 2001:0:1:1::1.1024 > 2001:0:1:3::2.25: . 103002:104002(1000) ack 256002 win 28000 
0:0:4.617859200 2001:0:1:3::2.25 > 2001:0:1:1::1.1024: . ack 92002 win 28000 
0:0:4.617859200 2001:0:1:1::1.1024 > 2001:0:1:3::2.25: . 104002:105002(1000) ack 256002 win 28000 
0:0:4.628739200 2001:0:1:3::2.25 > 2001:0:1:1::1.1024: . ack 93002 win 28000 
0:0:4.628739200 2001:0:1:1::1.1024 > 2001:0:1:3::2.25: . 105002:106002(1000) ack 256002 win 28000 
0:0:4.639619200 2001:0:1:3::2.25 > 2001:0:1:1::1.1024: . ack 94002 win 28000 
0:0:4.639619200 2001:0:1:1::1.1024 > 2001:0:1:3::2.25: . 106002:107002(1000) ack 256002 win 28000 
0:0:4.650499200 2001:0:1:3::2.25 > 2001:0:1:1::1.1024: . ack 95002 win 28000 
0:0:4.650499200 2001:0:1:1::1.1024 > 2001:0:1:3::2.25: . 107002:108002(1000) ack 256002 win 28000 
0:0:4.661379200 2001:0:1:3::2.25 > 2001:0:1:1::1.1024: . ack 96002 win 28000 
0:0:4.661379200 2001:0:1:1::1.1024 > 2001:0:1:3::2.25: . 108002:109002(1000) ack 256002 win 28000 
0:0:4.672259200 2001:0:1:3::2.25 > 2001:0:1:1::1.1024: . ack 97002 win 28000 
0:0:4.672259200 2001:0:1:1::1.1024 > 2001:0:1:3::2.25: . 109002:110002(1000) ack 256002 win 28000 
0:0:4.683139200 2001:0:1:3::2.25 > 2001:0:1:1::1.1024: . ack 98002 win 28000 
0:0:4.683139200 2001:0:1:1::1.1024 > 2001:0:1:3::2.25: . 110002:111002(1000) ack 256002 win 28000 
0:0:4.694019200 2001:0:1:3::2.25 > 2001:0:1:1::1.1024: . ack 99002 win 28000 
0:0:4.694019200 2001:0:1:1::1.1024 > 2001:0:1:3::2.25: . 111002:112002(1000) ack 256002 win 28000 
0:0:4.704899200 2001:0:1:3::2.25 > 2001:0:1:1::1.1024: . ack 100002 win 28000 
0:0:4.704899200 2001:0:1:1::1.1024 > 2001:0:1:3::2.25: . 112002:113002(1000) ack 256002 win 28000 
0:0:4.704899200 2001:0:1:1::1.1024 > 2001:0:1:3::2.25: . 113002:114002(1000) ack 256002 win 28000 
0:0:4.797040000 2001:0:1:3::2.25 > 2001:0:1:1::1.1024: . ack 101002 win 28000 
0:0:4.797040000 2001:0:1:1::1.1024 > 2001:0:1:3::2.25: . 114002:115002(1000) ack 256002 win 28000 
0:0:4.807920000 2001:0:1:3::2.25 > 2001:0:1:1::1.1024: . ack 102002 win 28000 
0:0:4.807920000 2001:0:1:1::1.1024 > 2001:0:1:3::2.25: . 115002:116002(1000) ack 256002 win 28000 
0:0:4.818800000 2001:0:1:3::2.25 > 2001:0:1:1::1.1024: . ack 103002 win 28000 
0:0:4.818800000 2001:0:1:1::1.1024 > 2001:0:1:3::2.25: . 116002:117002(1000) ack 256002 win 28000 
0:0:4.829680000 2001:0:1:3::2.25 > 2001:0:1:1::1.1024: . ack 104002 win 28000 
0:0:4.829680000 2001:0:1:1::1.1024 > 2001:0:1:3::2.25: . 117002:118002(1000) ack 256002 win 28000 
0:0:4.840560000 2001:0:1:3::2.25 > 2001:0:1:1::1.1024: . ack 105002 win 28000 
0:0:4.840560000 2001:0:1:1::1.1024 > 2001:0:1:3::2.25: . 118002:119002(1000) ack 256002 win 28000 
0:0:4.851440000 2001:0:1:3::2.25 > 2001:0:1:1::1.1024: . ack 106002 win 28000 
0:0:4.851440000 2001:0:1:1::1.1024 > 2001:0:1:3::2.25: . 119002:120002(1000) ack 256002 win 28000 
0:0:4.862320000 2001:0:1:3::2.25 > 2001:0:1:1::1.1024: . ack 107002 win 28000 
0:0:4.862320000 2001:0:1:1::1.1024 > 2001:0:1:3::2.25: . 120002:121002(1000) ack 256002 win 28000 
0:0:4.873200000 2001:0:1:3::2.25 > 2001:0:1:1::1.1024: . ack 108002 win 28000 
0:0:4.873200000 2001:0:1:1::1.1024 > 2001:0:1:3::2.25: . 121002:122002(1000) ack 256002 win 28000 
0:0:4.884080000 2001:0:1:3::2.25 > 2001:0:1:1::1.1024: . ack 109002 win 28000 
0:0:4.884080000 2001:0:1:1::1.1024 > 2001:0:1:3::2.25: . 122002:123002(1000) ack 256002 win 28000 
0:0:4.894960000 2001:0:1:3::2.25 > 2001:0:1:1::1.1024: . ack 110002 win 28000 
0:0:4.894960000 2001:0:1:1::1.1024 > 2001:0:1:3::2.25: . 123002:124002(1000) ack 256002 win 28000 
0:0:4.905840000 2001:0:1:3::2.25 > 2001:0:1:1::1.1024: . ack 111002 win 28000 
0:0:4.905840000 2001:0:1:1::1.1024 > 2001:0:1:3::2.25: . 124002:125002(1000) ack 256002 win 28000 
0:0:4.916720000 2001:0:1:3::2.25 > 2001:0:1:1::1.1024: . ack 112002 win 28000 
0:0:4.916720000 2001:0:1:1::1.1024 > 2001:0:1:3::2.25: . 125002:126002(1000) ack 256002 win 28000 
0:0:4.927600000 2001:0:1:3::2.25 > 2001:0:1:1::1.1024: . ack 113002 win 28000 
0:0:4.927600000 2001:0:1:1::1.1024 > 2001:0:1:3::2.25: . 126002:127002(1000) ack 256002 win 28000 
0:0:4.938480000 2001:0:1:3::2.25 > 2001:0:1:1::1.1024: . ack 114002 win 28000 
0:0:4.938480000 2001:0:1:1::1.1024 > 2001:0:1:3::2.25: . 127002:128002(1000) ack 256002 win 28000 
0:0:4.938480000 2001:0:1:1::1.1024 > 2001:0:1:3::2.25: . 128002:129002(1000) ack 256002 win 28000 
0:0:5.019740800 2001:0:1:3::2.25 > 2001:0:1:1::1.1024: . ack 115002 win 28000 
0:0:5.019740800 2001:0:1:1::1.1024 > 2001:0:1:3::2.25: . 129002:130002(1000) ack 256002 win 28000 
0:0:5.030620800 2001:0:1:3::2.25 > 2001:0:1:1::1.1024: . ack 116002 win 28000 
0:0:5.030620800 2001:0:1:1::1.1024 > 2001:0:1:3::2.25: . 130002:131002(1000) ack 256002 win 28000 
0:0:5.041500800 2001:0:1:3::2.25 > 2001:0:1:1::1.1024: . ack 117002 win 28000 
0:0:5.041500800 2001:0:1:1::1.1024 > 2001:0:1:3::2.25: . 131002:132002(1000) ack 256002 win 28000 
0:0:5.052380800 2001:0:1:3::2.25 > 2001:0:1:1::1.1024: . ack 118002 win 28000 
0:0:5.052380800 2001:0:1:1::1.1024 > 2001:0:1:3::2.25: . 132002:133002(1000) ack 256002 win 28000 
0:0:5.063260800 2001:0:1:3::2.25 > 2001:0:1:1::1.1024: . ack 119002 win 28000 
0:0:5.063260800 2001:0:1:1::1.1024 > 2001:0:1:3::2.25: . 133002:134002(1000) ack 256002 win 28000 
0:0:5.074140800 2001:0:1:3::2.25 > 2001:0:1:1::1.1024: . ack 120002 win 28000 
0:0:5.074140800 2001:0:1:1::1.1024 > 2001:0:1:3::2.25: . 134002:135002(1000) ack 256002 win 28000 
0:0:5.086020800 2001:0:1:3::2.25 > 2001:0:1:1::1.1024: . ack 121002 win 28000 
0:0:5.086020800 2001:0:1:1::1.1024 > 2001:0:1:3::2.25: . 135002:136002(1000) ack 256002 win 28000 
0:0:5.096900800 2001:0:1:3::2.25 > 2001:0:1:1::1.1024: . ack 122002 win 28000 
0:0:5.096900800 2001:0:1:1::1.1024 > 2001:0:1:3::2.25: . 136002:137002(1000) ack 256002 win 28000 
0:0:5.107780800 2001:0:1:3::2.25 > 2001:0:1:1::1.1024: . ack 123002 win 28000 
0:0:5.107780800 2001:0:1:1::1.1024 > 2001:0:1:3::2.25: . 137002:138002(1000) ack 256002 win 28000 
0:0:5.118660800 2001:0:1:3::2.25 > 2001:0:1:1::1.1024: . ack 124002 win 28000 
0:0:5.118660800 2001:0:1:1::1.1024 > 2001:0:1:3::2.25: . 138002:139002(1000) ack 256002 win 28000 
0:0:5.129540800 2001:0:1:3::2.25 > 2001:0:1:1::1.1024: . ack 125002 win 28000 
0:0:5.129540800 2001:0:1:1::1.1024 > 2001:0:1:3::2.25: . 139002:140002(1000) ack 256002 win 28000 
0:0:5.140420800 2001:0:1:3::2.25 > 2001:0:1:1::1.1024: . ack 126002 win 28000 
0:0:5.140420800 2001:0:1:1::1.1024 > 2001:0:1:3::2.25: . 140002:141002(1000) ack 256002 win 28000 
0:0:5.151300800 2001:0:1:3::2.25 > 2001:0:1:1::1.1024: . ack 127002 win 28000 
0:0:5.151300800 2001:0:1:1::1.1024 > 2001:0:1:3::2.25: . 141002:142002(1000) ack 256002 win 28000 
0:0:5.162180800 2001:0:1:3::2.25 > 2001:0:1:1::1.1024: . ack 128002 win 28000 
0:0:5.162180800 2001:0:1:1::1.1024 > 2001:0:1:3::2.25: . 142002:143002(1000) ack 256002 win 28000 
0:0:5.173060800 2001:0:1:3::2.25 > 2001:0:1:1::1.1024: . ack 129002 win 28000 
0:0:5.173060800 2001:0:1:1::1.1024 > 2001:0:1:3::2.25: . 143002:144002(1000) ack 256002 win 28000 
0:0:5.242441600 2001:0:1:3::2.25 > 2001:0:1:1::1.1024: . ack 130002 win 28000 
0:0:5.242441600 2001:0:1:1::1.1024 > 2001:0:1:3::2.25: . 144002:145002(1000) ack 256002 win 28000 
0:0:5.242441600 2001:0:1:1::1.1024 > 2001:0:1:3::2.25: . 145002:146002(1000) ack 256002 win 28000 
0:0:5.253321600 2001:0:1:3::2.25 > 2001:0:1:1::1.1024: . ack 131002 win 28000 
0:0:5.253321600 2001:0:1:1::1.1024 > 2001:0:1:3::2.25: . 146002:147002(1000) ack 256002 win 28000 
0:0:5.264201600 2001:0:1:3::2.25 > 2001:0:1:1::1.1024: . ack 132002 win 28000 
0:0:5.264201600 2001:0:1:1::1.1024 > 2001:0:1:3::2.25: . 147002:148002(1000) ack 256002 win 28000 
0:0:5.275081600 2001:0:1:3::2.25 > 2001:0:1:1::1.1024: . ack 133002 win 28000 
0:0:5.275081600 2001:0:1:1::1.1024 > 2001:0:1:3::2.25: . 148002:149002(1000) ack 256002 win 28000 
0:0:5.285961600 2001:0:1:3::2.25 > 2001:0:1:1::1.1024: . ack 134002 win 28000 
0:0:5.285961600 2001:0:1:1::1.1024 > 2001:0:1:3::2.25: . 149002:150002(1000) ack 256002 win 28000 
0:0:5.296841600 2001:0:1:3::2.25 > 2001:0:1:1::1.1024: . ack 135002 win 28000 
0:0:5.296841600 2001:0:1:1::1.1024 > 2001:0:1:3::2.25: . 150002:151002(1000) ack 256002 win 28000 
0:0:5.308721600 2001:0:1:3::2.25 > 2001:0:1:1::1.1024: . ack 136002 win 28000 
0:0:5.308721600 2001:0:1:1::1.1024 > 2001:0:1:3::2.25: . 151002:152002(1000) ack 256002 win 28000 
0:0:5.319601600 2001:0:1:3::2.25 > 2001:0:1:1::1.1024: . ack 137002 win 28000 
0:0:5.319601600 2001:0:1:1::1.1024 > 2001:0:1:3::2.25: . 152002:153002(1000) ack 256002 win 28000 
0:0:5.330481600 2001:0:1:3::2.25 > 2001:0:1:1::1.1024: . ack 138002 win 28000 
0:0:5.330481600 2001:0:1:1::1.1024 > 2001:0:1:3::2.25: . 153002:154002(1000) ack 256002 win 28000 
0:0:5.341361600 2001:0:1:3::2.25 > 2001:0:1:1::1.1024: . ack 139002 win 28000 
0:0:5.341361600 2001:0:1:1::1.1024 > 2001:0:1:3::2.25: . 154002:155002(1000) ack 256002 win 28000 
0:0:5.352241600 2001:0:1:3::2.25 > 2001:0:1:1::1.1024: . ack 140002 win 28000 
0:0:5.352241600 2001:0:1:1::1.1024 > 2001:0:1:3::2.25: . 155002:156002(1000) ack 256002 win 28000 
0:0:5.363121600 2001:0:1:3::2.25 > 2001:0:1:1::1.1024: . ack 141002 win 28000 
0:0:5.363121600 2001:0:1:1::1.1024 > 2001:0:1:3::2.25: . 156002:157002(1000) ack 256002 win 28000 
0:0:5.374001600 2001:0:1:3::2.25 > 2001:0:1:1::1.1024: . ack 142002 win 28000 
0:0:5.374001600 2001:0:1:1::1.1024 > 2001:0:1:3::2.25: . 157002:158002(1000) ack 256002 win 28000 
0:0:5.384881600 2001:0:1:3::2.25 > 2001:0:1:1::1.1024: . ack 143002 win 28000 
0:0:5.384881600 2001:0:1:1::1.1024 > 2001:0:1:3::2.25: . 158002:159002(1000) ack 256002 win 28000 
0:0:5.395761600 2001:0:1:3::2.25 > 2001:0:1:1::1.1024: . ack 144002 win 28000 
0:0:5.395761600 2001:0:1:1::1.1024 > 2001:0:1:3::2.25: . 159002:160002(1000) ack 256002 win 28000 
0:0:5.465142400 2001:0:1:3::2.25 > 2001:0:1:1::1.1024: . ack 145002 win 28000 
0:0:5.465142400 2001:0:1:1::1.1024 > 2001:0:1:3::2.25: . 160002:161002(1000) ack 256002 win 28000 
0:0:5.476022400 2001:0:1:3::2.25 > 2001:0:1:1::1.1024: . ack 146002 win 28000 
0:0:5.476022400 2001:0:1:1::1.1024 > 2001:0:1:3::2.25: . 161002:162002(1000) ack 256002 win 28000 
0:0:5.476022400 2001:0:1:1::1.1024 > 2001:0:1:3::2.25: . 162002:163002(1000) ack 256002 win 28000 
0:0:5.486902400 2001:0:1:3::2.25 > 2001:0:1:1::1.1024: . ack 147002 win 28000 
0:0:5.486902400 2001:0:1:1::1.1024 > 2001:0:1:3::2.25: . 163002:164002(1000) ack 256002 win 28000 
0:0:5.497782400 2001:0:1:3::2.25 > 2001:0:1:1::1.1024: . ack 148002 win 28000 
0:0:5.497782400 2001:0:1:1::1.1024 > 2001:0:1:3::2.25: . 164002:165002(1000) ack 256002 win 28000 
0:0:5.508662400 2001:0:1:3::2.25 > 2001:0:1:1::1.1024: . ack 149002 win 28000 
0:0:5.508662400 2001:0:1:1::1.1024 > 2001:0:1:3::2.25: . 165002:166002(1000) ack 256002 win 28000 
0:0:5.519542400 2001:0:1:3::2.25 > 2001:0:1:1::1.1024: . ack 150002 win 28000 
0:0:5.519542400 2001:0:1:1::1.1024 > 2001:0:1:3::2.25: . 166002:167002(1000) ack 256002 win 28000 
0:0:5.530422400 2001:0:1:3::2.25 > 2001:0:1:1::1.1024: . ack 151002 win 28000 
0:0:5.530422400 2001:0:1:1::1.1024 > 2001:0:1:3::2.25: . 167002:168002(1000) ack 256002 win 28000 
0:0:5.541302400 2001:0:1:3::2.25 > 2001:0:1:1::1.1024: . ack 152002 win 28000 
0:0:5.541302400 2001:0:1:1::1.1024 > 2001:0:1:3::2.25: . 168002:169002(1000) ack 256002 win 28000 
0:0:5.552182400 2001:0:1:3::2.25 > 2001:0:1:1::1.1024: . ack 153002 win 28000 
0:0:5.552182400 2001:0:1:1::1.1024 > 2001:0:1:3::2.25: . 169002:170002(1000) ack 256002 win 28000 
0:0:5.563062400 2001:0:1:3::2.25 > 2001:0:1:1::1.1024: . ack 154002 win 28000 
0:0:5.563062400 2001:0:1:1::1.1024 > 2001:0:1:3::2.25: . 170002:171002(1000) ack 256002 win 28000 
0:0:5.573942400 2001:0:1:3::2.25 > 2001:0:1:1::1.1024: . ack 155002 win 28000 
0:0:5.573942400 2001:0:1:1::1.1024 > 2001:0:1:3::2.25: . 171002:172002(1000) ack 256002 win 28000 
0:0:5.584822400 2001:0:1:3::2.25 > 2001:0:1:1::1.1024: . ack 156002 win 28000 
0:0:5.584822400 2001:0:1:1::1.1024 > 2001:0:1:3::2.25: . 172002:173002(1000) ack 256002 win 28000 
0:0:5.595702400 2001:0:1:3::2.25 > 2001:0:1:1::1.1024: . ack 157002 win 28000 
0:0:5.595702400 2001:0:1:1::1.1024 > 2001:0:1:3::2.25: . 173002:174002(1000) ack 256002 win 28000 
0:0:5.606582400 2001:0:1:3::2.25 > 2001:0:1:1::1.1024: . ack 158002 win 28000 
0:0:5.606582400 2001:0:1:1::1.1024 > 2001:0:1:3::2.25: . 174002:175002(1000) ack 256002 win 28000 
0:0:5.617462400 2001:0:1:3::2.25 > 2001:0:1:1::1.1024: . ack 159002 win 28000 
0:0:5.617462400 2001:0:1:1::1.1024 > 2001:0:1:3::2.25: . 175002:176002(1000) ack 256002 win 28000 
0:0:5.628342400 2001:0:1:3::2.25 > 2001:0:1:1::1.1024: . ack 160002 win 28000 
0:0:5.628342400 2001:0:1:1::1.1024 > 2001:0:1:3::2.25: . 176002:177002(1000) ack 256002 win 28000 
0:0:5.687843200 2001:0:1:3::2.25 > 2001:0:1:1::1.1024: . ack 161002 win 28000 
0:0:5.687843200 2001:0:1:1::1.1024 > 2001:0:1:3::2.25: . 177002:178002(1000) ack 256002 win 28000 
0:0:5.698723200 2001:0:1:3::2.25 > 2001:0:1:1::1.1024: . ack 162002 win 28000 
0:0:5.698723200 2001:0:1:1::1.1024 > 2001:0:1:3::2.25: . 178002:179002(1000) ack 256002 win 28000 
0:0:5.709603200 2001:0:1:3::2.25 > 2001:0:1:1::1.1024: . ack 163002 win 28000 
0:0:5.709603200 2001:0:1:1::1.1024 > 2001:0:1:3::2.25: . 179002:180002(1000) ack 256002 win 28000 
0:0:5.720483200 2001:0:1:3::2.25 > 2001:0:1:1::1.1024: . ack 164002 win 28000 
0:0:5.720483200 2001:0:1:1::1.1024 > 2001:0:1:3::2.25: . 180002:181002(1000) ack 256002 win 28000 
0:0:5.720483200 2001:0:1:1::1.1024 > 2001:0:1:3::2.25: . 181002:182002(1000) ack 256002 win 28000 
0:0:5.731363200 2001:0:1:3::2.25 > 2001:0:1:1::1.1024: . ack 165002 win 28000 
0:0:5.731363200 2001:0:1:1::1.1024 > 2001:0:1:3::2.25: . 182002:183002(1000) ack 256002 win 28000 
0:0:5.742243200 2001:0:1:3::2.25 > 2001:0:1:1::1.1024: . ack 166002 win 28000 
0:0:5.742243200 2001:0:1:1::1.1024 > 2001:0:1:3::2.25: . 183002:184002(1000) ack 256002 win 28000 
0:0:5.753123200 2001:0:1:3::2.25 > 2001:0:1:1::1.1024: . ack 167002 win 28000 
0:0:5.753123200 2001:0:1:1::1.1024 > 2001:0:1:3::2.25: . 184002:185002(1000) ack 256002 win 28000 
0:0:5.764003200 2001:0:1:3::2.25 > 2001:0:1:1::1.1024: . ack 168002 win 28000 
0:0:5.764003200 2001:0:1:1::1.1024 > 2001:0:1:3::2.25: . 185002:186002(1000) ack 256002 win 28000 
0:0:5.774883200 2001:0:1:3::2.25 > 2001:0:1:1::1.1024: . ack 169002 win 28000 
0:0:5.774883200 2001:0:1:1::1.1024 > 2001:0:1:3::2.25: . 186002:187002(1000) ack 256002 win 28000 
0:0:5.785763200 2001:0:1:3::2.25 > 2001:0:1:1::1.1024: . ack 170002 win 28000 
0:0:5.785763200 2001:0:1:1::1.1024 > 2001:0:1:3::2.25: . 187002:188002(1000) ack 256002 win 28000 
0:0:5.796643200 2001:0:1:3::2.25 > 2001:0:1:1::1.1024: . ack 171002 win 28000 
0:0:5.796643200 2001:0:1:1::1.1024 > 2001:0:1:3::2.25: . 188002:189002(1000) ack 256002 win 28000 
0:0:5.807523200 2001:0:1:3::2.25 > 2001:0:1:1::1.1024: . ack 172002 win 28000 
0:0:5.807523200 2001:0:1:1::1.1024 > 2001:0:1:3::2.25: . 189002:190002(1000) ack 256002 win 28000 
0:0:5.818403200 2001:0:1:3::2.25 > 2001:0:1:1::1.1024: . ack 173002 win 28000 
0:0:5.818403200 2001:0:1:1::1.1024 > 2001:0:1:3::2.25: . 190002:191002(1000) ack 256002 win 28000 
0:0:5.829283200 2001:0:1:3::2.25 > 2001:0:1:1::1.1024: . ack 174002 win 28000 
0:0:5.829283200 2001:0:1:1::1.1024 > 2001:0:1:3::2.25: . 191002:192002(1000) ack 256002 win 28000 
0:0:5.840163200 2001:0:1:3::2.25 > 2001:0:1:1::1.1024: . ack 175002 win 28000 
0:0:5.840163200 2001:0:1:1::1.1024 > 2001:0:1:3::2.25: . 192002:193002(1000) ack 256002 win 28000 
0:0:5.851043200 2001:0:1:3::2.25 > 2001:0:1:1::1.1024: . ack 176002 win 28000 
0:0:5.851043200 2001:0:1:1::1.1024 > 2001:0:1:3::2.25: . 193002:194002(1000) ack 256002 win 28000 
0:0:5.861923200 2001:0:1:3::2.25 > 2001:0:1:1::1.1024: . ack 177002 win 28000 
0:0:5.861923200 2001:0:1:1::1.1024 > 2001:0:1:3::2.25: . 194002:195002(1000) ack 256002 win 28000 
0:0:5.910544000 2001:0:1:3::2.25 > 2001:0:1:1::1.1024: . ack 178002 win 28000 
0:0:5.910544000 2001:0:1:1::1.1024 > 2001:0:1:3::2.25: . 195002:196002(1000) ack 256002 win 28000 
0:0:5.921424000 2001:0:1:3::2.25 > 2001:0:1:1::1.1024: . ack 179002 win 28000 
0:0:5.921424000 2001:0:1:1::1.1024 > 2001:0:1:3::2.25: . 196002:197002(1000) ack 256002 win 28000 
0:0:5.932304000 2001:0:1:3::2.25 > 2001:0:1:1::1.1024: . ack 180002 win 28000 
0:0:5.932304000 2001:0:1:1::1.1024 > 2001:0:1:3::2.25: . 197002:198002(1000) ack 256002 win 28000 
0:0:5.943184000 2001:0:1:3::2.25 > 2001:0:1:1::1.1024: . ack 181002 win 28000 
0:0:5.943184000 2001:0:1:1::1.1024 > 2001:0:1:3::2.25: . 198002:199002(1000) ack 256002 win 28000 
0:0:5.954064000 2001:0:1:3::2.25 > 2001:0:1:1::1.1024: . ack 182002 win 28000 
0:0:5.954064000 2001:0:1:1::1.1024 > 2001:0:1:3::2.25: . 199002:200002(1000) ack 256002 win 28000 
0:0:5.964944000 2001:0:1:3::2.25 > 2001:0:1:1::1.1024: . ack 183002 win 28000 
0:0:5.964944000 2001:0:1:1::1.1024 > 2001:0:1:3::2.25: . 200002:201002(1000) ack 256002 win 28000 
0:0:5.964944000 2001:0:1:1::1.1024 > 2001:0:1:3::2.25: . 201002:202002(1000) ack 256002 win 28000 
0:0:5.975824000 2001:0:1:3::2.25 > 2001:0:1:1::1.1024: . ack 184002 win 28000 
0:0:5.975824000 2001:0:1:1::1.1024 > 2001:0:1:3::2.25: . 202002:203002(1000) ack 256002 win 28000 
0:0:5.986704000 2001:0:1:3::2.25 > 2001:0:1:1::1.1024: . ack 185002 win 28000 
0:0:5.986704000 2001:0:1:1::1.1024 > 2001:0:1:3::2.25: . 203002:204002(1000) ack 256002 win 28000 
0:0:5.997584000 2001:0:1:3::2.25 > 2001:0:1:1::1.1024: . ack 186002 win 28000 
0:0:5.997584000 2001:0:1:1::1.1024 > 2001:0:1:3::2.25: . 204002:205002(1000) ack 256002 win 28000 
