0:0:1.000000000 2001:0:1:1::1.1024 > 2001:0:1:3::2.25: S win 28000 <mss 1000,sackOK,nop,nop>
0:0:1.212073600 2001:0:1:3::2.25 > 2001:0:1:1::1.1024: S ack 2 win 28000 <mss 1000,sackOK,nop,nop>
0:0:1.212073600 2001:0:1:1::1.1024 > 2001:0:1:3::2.25: . ack 256002 win 28000 
0:0:1.212074600 2001:0:1:1::1.1024 > 2001:0:1:3::2.25: P 2:1002(1000) ack 256002 win 28000 
0:0:1.434854400 2001:0:1:3::2.25 > 2001:0:1:1::1.1024: . ack 1002 win 28000 
0:0:1.434854400 2001:0:1:1::1.1024 > 2001:0:1:3::2.25: . 1002:2002(1000) ack 256002 win 28000 
0:0:1.434854400 2001:0:1:1::1.1024 > 2001:0:1:3::2.25: . 2002:3002(1000) ack 256002 win 28000 
0:0:1.657555200 2001:0:1:3::2.25 > 2001:0:1:1::1.1024: . ack 2002 win 28000 
0:0:1.657555200 2001:0:1:1::1.1024 > 2001:0:1:3::2.25: . 3002:4002(1000) ack 256002 win 28000 
0:0:1.657555200 2001:0:1:1::1.1024 > 2001:0:1:3::2.25: . 4002:5002(1000) ack 256002 win 28000 
0:0:1.668435200 2001:0:1:3::2.25 > 2001:0:1:1::1.1024: . ack 3002 win 28000 
0:0:1.668435200 2001:0:1:1::1.1024 > 2001:0:1:3::2.25: . 5002:6002(1000) ack 256002 win 28000 
0:0:1.668435200 2001:0:1:1::1.1024 > 2001:0:1:3::2.25: . 6002:7002(1000) ack 256002 win 28000 
0:0:1.880256000 2001:0:1:3::2.25 > 2001:0:1:1::1.1024: . ack 4002 win 28000 
0:0:1.880256000 2001:0:1:1::1.1024 > 2001:0:1:3::2.25: . 7002:8002(1000) ack 256002 win 28000 
0:0:1.880256000 2001:0:1:1::1.1024 > 2001:0:1:3::2.25: . 8002:9002(1000) ack 256002 win 28000 
0:0:1.891136000 2001:0:1:3::2.25 > 2001:0:1:1::1.1024: . ack 5002 win 28000 
0:0:1.891136000 2001:0:1:1::1.1024 > 2001:0:1:3::2.25: . 9002:10002(1000) ack 256002 win 28000 
0:0:1.891136000 2001:0:1:1::1.1024 > 2001:0:1:3::2.25: . 10002:11002(1000) ack 256002 win 28000 
0:0:1.902016000 2001:0:1:3::2.25 > 2001:0:1:1::1.1024: . ack 6002 win 28000 
0:0:1.902016000 2001:0:1:1::1.1024 > 2001:0:1:3::2.25: . 11002:12002(1000) ack 256002 win 28000 
0:0:1.902016000 2001:0:1:1::1.1024 > 2001:0:1:3::2.25: . 12002:13002(1000) ack 256002 win 28000 
0:0:1.912896000 2001:0:1:3::2.25 > 2001:0:1:1::1.1024: . ack 7002 win 28000 
0:0:1.912896000 2001:0:1:1::1.1024 > 2001:0:1:3::2.25: . 13002:14002(1000) ack 256002 win 28000 
0:0:1.912896000 2001:0:1:1::1.1024 > 2001:0:1:3::2.25: . 14002:15002(1000) ack 256002 win 28000 
0:0:2.102956800 2001:0:1:3::2.25 > 2001:0:1:1::1.1024: . ack 8002 win 28000 
0:0:2.102956800 2001:0:1:1::1.1024 > 2001:0:1:3::2.25: . 15002:16002(1000) ack 256002 win 28000 
0:0:2.102956800 2001:0:1:1::1.1024 > 2001:0:1:3::2.25: . 16002:17002(1000) ack 256002 win 28000 
0:0:2.113836800 2001:0:1:3::2.25 > 2001:0:1:1::1.1024: . ack 9002 win 28000 
0:0:2.113836800 2001:0:1:1::1.1024 > 2001:0:1:3::2.25: . 17002:18002(1000) ack 256002 win 28000 
0:0:2.113836800 2001:0:1:1::1.1024 > 2001:0:1:3::2.25: . 18002:19002(1000) ack 256002 win 28000 
0:0:2.124716800 2001:0:1:3::2.25 > 2001:0:1:1::1.1024: . ack 10002 win 28000 
0:0:2.124716800 2001:0:1:1::1.1024 > 2001:0:1:3::2.25: . 19002:20002(1000) ack 256002 win 28000 
0:0:2.124716800 2001:0:1:1::1.1024 > 2001:0:1:3::2.25: . 20002:21002(1000) ack 256002 win 28000 
0:0:2.135596800 2001:0:1:3::2.25 > 2001:0:1:1::1.1024: . ack 11002 win 28000 
0:0:2.135596800 2001:0:1:1::1.1024 > 2001:0:1:3::2.25: . 21002:22002(1000) ack 256002 win 28000 
0:0:2.135596800 2001:0:1:1::1.1024 > 2001:0:1:3::2.25: . 22002:23002(1000) ack 256002 win 28000 
0:0:2.146476800 2001:0:1:3::2.25 > 2001:0:1:1::1.1024: . ack 12002 win 28000 
0:0:2.146476800 2001:0:1:1::1.1024 > 2001:0:1:3::2.25: . 23002:24002(1000) ack 256002 win 28000 
0:0:2.146476800 2001:0:1:1::1.1024 > 2001:0:1:3::2.25: . 24002:25002(1000) ack 256002 win 28000 
0:0:2.157356800 2001:0:1:3::2.25 > 2001:0:1:1::1.1024: . ack 13002 win 28000 
0:0:2.157356800 2001:0:1:1::1.1024 > 2001:0:1:3::2.25: . 25002:26002(1000) ack 256002 win 28000 
0:0:2.157356800 2001:0:1:1::1.1024 > 2001:0:1:3::2.25: . 26002:27002(1000) ack 256002 win 28000 
0:0:2.168236800 2001:0:1:3::2.25 > 2001:0:1:1::1.1024: . ack 14002 win 28000 
0:0:2.168236800 2001:0:1:1::1.1024 > 2001:0:1:3::2.25: . 27002:28002(1000) ack 256002 win 28000 
0:0:2.168236800 2001:0:1:1::1.1024 > 2001:0:1:3::2.25: . 28002:29002(1000) ack 256002 win 28000 
0:0:2.179116800 2001:0:1:3::2.25 > 2001:0:1:1::1.1024: . ack 15002 win 28000 
0:0:2.179116800 2001:0:1:1::1.1024 > 2001:0:1:3::2.25: . 29002:30002(1000) ack 256002 win 28000 
0:0:2.179116800 2001:0:1:1::1.1024 > 2001:0:1:3::2.25: . 30002:31002(1000) ack 256002 win 28000 
0:0:2.325657600 2001:0:1:3::2.25 > 2001:0:1:1::1.1024: . ack 16002 win 28000 
0:0:2.325657600 2001:0:1:1::1.1024 > 2001:0:1:3::2.25: . 31002:32002(1000) ack 256002 win 28000 
0:0:2.325657600 2001:0:1:1::1.1024 > 2001:0:1:3::2.25: . 32002:33002(1000) ack 256002 win 28000 
0:0:2.336537600 2001:0:1:3::2.25 > 2001:0:1:1::1.1024: . ack 17002 win 28000 
0:0:2.336537600 2001:0:1:1::1.1024 > 2001:0:1:3::2.25: . 33002:34002(1000) ack 256002 win 28000 
0:0:2.336537600 2001:0:1:1::1.1024 > 2001:0:1:3::2.25: . 34002:35002(1000) ack 256002 win 28000 
0:0:2.347417600 2001:0:1:3::2.25 > 2001:0:1:1::1.1024: . ack 18002 win 28000 
0:0:2.347417600 2001:0:1:1::1.1024 > 2001:0:1:3::2.25: . 35002:36002(1000) ack 256002 win 28000 
0:0:2.347417600 2001:0:1:1::1.1024 > 2001:0:1:3::2.25: . 36002:37002(1000) ack 256002 win 28000 
0:0:2.358297600 2001:0:1:3::2.25 > 2001:0:1:1::1.1024: . ack 19002 win 28000 
0:0:2.358297600 2001:0:1:1::1.1024 > 2001:0:1:3::2.25: . 37002:38002(1000) ack 256002 win 28000 
0:0:2.358297600 2001:0:1:1::1.1024 > 2001:0:1:3::2.25: . 38002:39002(1000) ack 256002 win 28000 
0:0:2.369177600 2001:0:1:3::2.25 > 2001:0:1:1::1.1024: . ack 20002 win 28000 
0:0:2.369177600 2001:0:1:1::1.1024 > 2001:0:1:3::2.25: . 39002:40002(1000) ack 256002 win 28000 
0:0:2.369177600 2001:0:1:1::1.1024 > 2001:0:1:3::2.25: . 40002:41002(1000) ack 256002 win 28000 
0:0:2.380057600 2001:0:1:3::2.25 > 2001:0:1:1::1.1024: . ack 21002 win 28000 
0:0:2.380057600 2001:0:1:1::1.1024 > 2001:0:1:3::2.25: . 41002:42002(1000) ack 256002 win 28000 
0:0:2.380057600 2001:0:1:1::1.1024 > 2001:0:1:3::2.25: . 42002:43002(1000) ack 256002 win 28000 
0:0:2.390937600 2001:0:1:3::2.25 > 2001:0:1:1::1.1024: . ack 22002 win 28000 
0:0:2.390937600 2001:0:1:1::1.1024 > 2001:0:1:3::2.25: . 43002:44002(1000) ack 256002 win 28000 
0:0:2.390937600 2001:0:1:1::1.1024 > 2001:0:1:3::2.25: . 44002:45002(1000) ack 256002 win 28000 
0:0:2.401817600 2001:0:1:3::2.25 > 2001:0:1:1::1.1024: . ack 23002 win 28000 
0:0:2.401817600 2001:0:1:1::1.1024 > 2001:0:1:3::2.25: . 45002:46002(1000) ack 256002 win 28000 
0:0:2.401817600 2001:0:1:1::1.1024 > 2001:0:1:3::2.25: . 46002:47002(1000) ack 256002 win 28000 
0:0:2.412697600 2001:0:1:3::2.25 > 2001:0:1:1::1.1024: . ack 24002 win 28000 
0:0:2.412697600 2001:0:1:1::1.1024 > 2001:0:1:3::2.25: . 47002:48002(1000) ack 256002 win 28000 
0:0:2.412697600 2001:0:1:1::1.1024 > 2001:0:1:3::2.25: . 48002:49002(1000) ack 256002 win 28000 
0:0:2.423577600 2001:0:1:3::2.25 > 2001:0:1:1::1.1024: . ack 25002 win 28000 
0:0:2.423577600 2001:0:1:1::1.1024 > 2001:0:1:3::2.25: . 49002:50002(1000) ack 256002 win 28000 
0:0:2.423577600 2001:0:1:1::1.1024 > 2001:0:1:3::2.25: . 50002:51002(1000) ack 256002 win 28000 
0:0:2.434457600 2001:0:1:3::2.25 > 2001:0:1:1::1.1024: . ack 26002 win 28000 
0:0:2.434457600 2001:0:1:1::1.1024 > 2001:0:1:3::2.25: . 51002:52002(1000) ack 256002 win 28000 
0:0:2.434457600 2001:0:1:1::1.1024 > 2001:0:1:3::2.25: . 52002:53002(1000) ack 256002 win 28000 
0:0:2.445337600 2001:0:1:3::2.25 > 2001:0:1:1::1.1024: . ack 27002 win 28000 
0:0:2.445337600 2001:0:1:1::1.1024 > 2001:0:1:3::2.25: . 53002:54002(1000) ack 256002 win 28000 
0:0:2.445337600 2001:0:1:1::1.1024 > 2001:0:1:3::2.25: P 54002:55002(1000) ack 256002 win 28000 
0:0:2.456217600 2001:0:1:3::2.25 > 2001:0:1:1::1.1024: . ack 28002 win 28000 
0:0:2.456217600 2001:0:1:1::1.1024 > 2001:0:1:3::2.25: P 55002:56002(1000) ack 256002 win 28000 
0:0:2.467097600 2001:0:1:3::2.25 > 2001:0:1:1::1.1024: . ack 29002 win 28000 
0:0:2.467097600 2001:0:1:1::1.1024 > 2001:0:1:3::2.25: P 56002:57002(1000) ack 256002 win 28000 
0:0:2.477977600 2001:0:1:3::2.25 > 2001:0:1:1::1.1024: . ack 30002 win 28000 
0:0:2.477977600 2001:0:1:1::1.1024 > 2001:0:1:3::2.25: P 57002:58002(1000) ack 256002 win 28000 
0:0:2.488857600 2001:0:1:3::2.25 > 2001:0:1:1::1.1024: . ack 31002 win 28000 
0:0:2.488857600 2001:0:1:1::1.1024 > 2001:0:1:3::2.25: P 58002:59002(1000) ack 256002 win 28000 
0:0:2.548358400 2001:0:1:3::2.25 > 2001:0:1:1::1.1024: . ack 32002 win 28000 
0:0:2.548358400 2001:0:1:1::1.1024 > 2001:0:1:3::2.25: P 59002:60002(1000) ack 256002 win 28000 
0:0:2.559238400 2001:0:1:3::2.25 > 2001:0:1:1::1.1024: . ack 33002 win 28000 
0:0:2.559238400 2001:0:1:1::1.1024 > 2001:0:1:3::2.25: P 60002:61002(1000) ack 256002 win 28000 
0:0:2.570118400 2001:0:1:3::2.25 > 2001:0:1:1::1.1024: . ack 34002 win 28000 
0:0:2.570118400 2001:0:1:1::1.1024 > 2001:0:1:3::2.25: P 61002:62002(1000) ack 256002 win 28000 
0:0:2.580998400 2001:0:1:3::2.25 > 2001:0:1:1::1.1024: . ack 35002 win 28000 
0:0:2.580998400 2001:0:1:1::1.1024 > 2001:0:1:3::2.25: P 62002:63002(1000) ack 256002 win 28000 
0:0:2.591878400 2001:0:1:3::2.25 > 2001:0:1:1::1.1024: . ack 36002 win 28000 
0:0:2.591878400 2001:0:1:1::1.1024 > 2001:0:1:3::2.25: P 63002:64002(1000) ack 256002 win 28000 
0:0:2.602758400 2001:0:1:3::2.25 > 2001:0:1:1::1.1024: . ack 37002 win 28000 
0:0:2.602758400 2001:0:1:1::1.1024 > 2001:0:1:3::2.25: P 64002:65002(1000) ack 256002 win 28000 
0:0:2.613638400 2001:0:1:3::2.25 > 2001:0:1:1::1.1024: . ack 38002 win 28000 
0:0:2.613638400 2001:0:1:1::1.1024 > 2001:0:1:3::2.25: P 65002:66002(1000) ack 256002 win 28000 
0:0:2.624518400 2001:0:1:3::2.25 > 2001:0:1:1::1.1024: . ack 39002 win 28000 
0:0:2.624518400 2001:0:1:1::1.1024 > 2001:0:1:3::2.25: P 66002:67002(1000) ack 256002 win 28000 
0:0:2.635398400 2001:0:1:3::2.25 > 2001:0:1:1::1.1024: . ack 40002 win 28000 
0:0:2.635398400 2001:0:1:1::1.1024 > 2001:0:1:3::2.25: P 67002:68002(1000) ack 256002 win 28000 
0:0:2.646278400 2001:0:1:3::2.25 > 2001:0:1:1::1.1024: . ack 41002 win 28000 
0:0:2.646278400 2001:0:1:1::1.1024 > 2001:0:1:3::2.25: P 68002:69002(1000) ack 256002 win 28000 
0:0:2.657158400 2001:0:1:3::2.25 > 2001:0:1:1::1.1024: . ack 42002 win 28000 
0:0:2.657158400 2001:0:1:1::1.1024 > 2001:0:1:3::2.25: P 69002:70002(1000) ack 256002 win 28000 
0:0:2.668038400 2001:0:1:3::2.25 > 2001:0:1:1::1.1024: . ack 43002 win 28000 
0:0:2.668038400 2001:0:1:1::1.1024 > 2001:0:1:3::2.25: P 70002:71002(1000) ack 256002 win 28000 
0:0:2.678918400 2001:0:1:3::2.25 > 2001:0:1:1::1.1024: . ack 44002 win 28000 
0:0:2.678918400 2001:0:1:1::1.1024 > 2001:0:1:3::2.25: P 71002:72002(1000) ack 256002 win 28000 
0:0:2.689798400 2001:0:1:3::2.25 > 2001:0:1:1::1.1024: . ack 45002 win 28000 
0:0:2.689798400 2001:0:1:1::1.1024 > 2001:0:1:3::2.25: P 72002:73002(1000) ack 256002 win 28000 
0:0:2.700678400 2001:0:1:3::2.25 > 2001:0:1:1::1.1024: . ack 46002 win 28000 
0:0:2.700678400 2001:0:1:1::1.1024 > 2001:0:1:3::2.25: P 73002:74002(1000) ack 256002 win 28000 
0:0:2.711558400 2001:0:1:3::2.25 > 2001:0:1:1::1.1024: . ack 47002 win 28000 
0:0:2.711558400 2001:0:1:1::1.1024 > 2001:0:1:3::2.25: P 74002:75002(1000) ack 256002 win 28000 
0:0:2.722438400 2001:0:1:3::2.25 > 2001:0:1:1::1.1024: . ack 48002 win 28000 
0:0:2.722438400 2001:0:1:1::1.1024 > 2001:0:1:3::2.25: P 75002:76002(1000) ack 256002 win 28000 
0:0:2.733318400 2001:0:1:3::2.25 > 2001:0:1:1::1.1024: . ack 49002 win 28000 
0:0:2.733318400 2001:0:1:1::1.1024 > 2001:0:1:3::2.25: P 76002:77002(1000) ack 256002 win 28000 
0:0:2.744198400 2001:0:1:3::2.25 > 2001:0:1:1::1.1024: . ack 50002 win 28000 
0:0:2.744198400 2001:0:1:1::1.1024 > 2001:0:1:3::2.25: P 77002:78002(1000) ack 256002 win 28000 
0:0:2.755078400 2001:0:1:3::2.25 > 2001:0:1:1::1.1024: . ack 51002 win 28000 
0:0:2.755078400 2001:0:1:1::1.1024 > 2001:0:1:3::2.25: P 78002:79002(1000) ack 256002 win 28000 
0:0:2.765958400 2001:0:1:3::2.25 > 2001:0:1:1::1.1024: . ack 52002 win 28000 
0:0:2.765958400 2001:0:1:1::1.1024 > 2001:0:1:3::2.25: P 79002:80002(1000) ack 256002 win 28000 
0:0:2.776838400 2001:0:1:3::2.25 > 2001:0:1:1::1.1024: . ack 53002 win 28000 
0:0:2.776838400 2001:0:1:1::1.1024 > 2001:0:1:3::2.25: P 80002:81002(1000) ack 256002 win 28000 
0:0:2.787718400 2001:0:1:3::2.25 > 2001:0:1:1::1.1024: . ack 54002 win 28000 
0:0:2.787718400 2001:0:1:1::1.1024 > 2001:0:1:3::2.25: P 81002:82002(1000) ack 256002 win 28000 
0:0:2.798598400 2001:0:1:3::2.25 > 2001:0:1:1::1.1024: . ack 55002 win 28000 
0:0:2.798598400 2001:0:1:1::1.1024 > 2001:0:1:3::2.25: P 82002:83002(1000) ack 256002 win 28000 
0:0:2.809478400 2001:0:1:3::2.25 > 2001:0:1:1::1.1024: . ack 56002 win 28000 
0:0:2.809478400 2001:0:1:1::1.1024 > 2001:0:1:3::2.25: P 83002:84002(1000) ack 256002 win 28000 
0:0:2.820358400 2001:0:1:3::2.25 > 2001:0:1:1::1.1024: . ack 57002 win 28000 
0:0:2.820358400 2001:0:1:1::1.1024 > 2001:0:1:3::2.25: P 84002:85002(1000) ack 256002 win 28000 
0:0:2.831238400 2001:0:1:3::2.25 > 2001:0:1:1::1.1024: . ack 58002 win 28000 
0:0:2.831238400 2001:0:1:1::1.1024 > 2001:0:1:3::2.25: P 85002:86002(1000) ack 256002 win 28000 
0:0:2.842118400 2001:0:1:3::2.25 > 2001:0:1:1::1.1024: . ack 59002 win 28000 
0:0:2.842118400 2001:0:1:1::1.1024 > 2001:0:1:3::2.25: P 86002:87002(1000) ack 256002 win 28000 
0:0:2.852998400 2001:0:1:3::2.25 > 2001:0:1:1::1.1024: . ack 60002 win 28000 
0:0:2.852998400 2001:0:1:1::1.1024 > 2001:0:1:3::2.25: P 87002:88002(1000) ack 256002 win 28000 
0:0:2.863878400 2001:0:1:3::2.25 > 2001:0:1:1::1.1024: . ack 61002 win 28000 
0:0:2.863878400 2001:0:1:1::1.1024 > 2001:0:1:3::2.25: P 88002:89002(1000) ack 256002 win 28000 
0:0:2.874758400 2001:0:1:3::2.25 > 2001:0:1:1::1.1024: . ack 62002 win 28000 
0:0:2.874758400 2001:0:1:1::1.1024 > 2001:0:1:3::2.25: P 89002:90002(1000) ack 256002 win 28000 
0:0:2.885638400 2001:0:1:3::2.25 > 2001:0:1:1::1.1024: . ack 63002 win 28000 
0:0:2.885638400 2001:0:1:1::1.1024 > 2001:0:1:3::2.25: P 90002:91002(1000) ack 256002 win 28000 
0:0:2.896518400 2001:0:1:3::2.25 > 2001:0:1:1::1.1024: . ack 64002 win 28000 
0:0:2.896518400 2001:0:1:1::1.1024 > 2001:0:1:3::2.25: P 91002:92002(1000) ack 256002 win 28000 
0:0:2.907398400 2001:0:1:3::2.25 > 2001:0:1:1::1.1024: . ack 65002 win 28000 
0:0:2.907398400 2001:0:1:1::1.1024 > 2001:0:1:3::2.25: P 92002:93002(1000) ack 256002 win 28000 
0:0:2.918278400 2001:0:1:3::2.25 > 2001:0:1:1::1.1024: . ack 66002 win 28000 
0:0:2.918278400 2001:0:1:1::1.1024 > 2001:0:1:3::2.25: P 93002:94002(1000) ack 256002 win 28000 
0:0:2.929158400 2001:0:1:3::2.25 > 2001:0:1:1::1.1024: . ack 67002 win 28000 
0:0:2.929158400 2001:0:1:1::1.1024 > 2001:0:1:3::2.25: P 94002:95002(1000) ack 256002 win 28000 
0:0:2.940038400 2001:0:1:3::2.25 > 2001:0:1:1::1.1024: . ack 68002 win 28000 
0:0:2.940038400 2001:0:1:1::1.1024 > 2001:0:1:3::2.25: P 95002:96002(1000) ack 256002 win 28000 
0:0:2.950918400 2001:0:1:3::2.25 > 2001:0:1:1::1.1024: . ack 69002 win 28000 
0:0:2.950918400 2001:0:1:1::1.1024 > 2001:0:1:3::2.25: P 96002:97002(1000) ack 256002 win 28000 
0:0:2.961798400 2001:0:1:3::2.25 > 2001:0:1:1::1.1024: . ack 70002 win 28000 
0:0:2.961798400 2001:0:1:1::1.1024 > 2001:0:1:3::2.25: P 97002:98002(1000) ack 256002 win 28000 
0:0:2.972678400 2001:0:1:3::2.25 > 2001:0:1:1::1.1024: . ack 71002 win 28000 
0:0:2.972678400 2001:0:1:1::1.1024 > 2001:0:1:3::2.25: P 98002:99002(1000) ack 256002 win 28000 
0:0:2.983558400 2001:0:1:3::2.25 > 2001:0:1:1::1.1024: . ack 72002 win 28000 
0:0:2.983558400 2001:0:1:1::1.1024 > 2001:0:1:3::2.25: P 99002:100002(1000) ack 256002 win 28000 
0:0:2.994438400 2001:0:1:3::2.25 > 2001:0:1:1::1.1024: . ack 73002 win 28000 
0:0:2.994438400 2001:0:1:1::1.1024 > 2001:0:1:3::2.25: P 100002:101002(1000) ack 256002 win 28000 
0:0:3.005318400 2001:0:1:3::2.25 > 2001:0:1:1::1.1024: . ack 74002 win 28000 
0:0:3.005318400 2001:0:1:1::1.1024 > 2001:0:1:3::2.25: P 101002:102002(1000) ack 256002 win 28000 
0:0:3.016198400 2001:0:1:3::2.25 > 2001:0:1:1::1.1024: . ack 75002 win 28000 
0:0:3.016198400 2001:0:1:1::1.1024 > 2001:0:1:3::2.25: P 102002:103002(1000) ack 256002 win 28000 
0:0:3.027078400 2001:0:1:3::2.25 > 2001:0:1:1::1.1024: . ack 76002 win 28000 
0:0:3.027078400 2001:0:1:1::1.1024 > 2001:0:1:3::2.25: P 103002:104002(1000) ack 256002 win 28000 
0:0:3.037958400 2001:0:1:3::2.25 > 2001:0:1:1::1.1024: . ack 77002 win 28000 
0:0:3.037958400 2001:0:1:1::1.1024 > 2001:0:1:3::2.25: P 104002:105002(1000) ack 256002 win 28000 
0:0:3.048838400 2001:0:1:3::2.25 > 2001:0:1:1::1.1024: . ack 78002 win 28000 
0:0:3.048838400 2001:0:1:1::1.1024 > 2001:0:1:3::2.25: P 105002:106002(1000) ack 256002 win 28000 
0:0:3.059718400 2001:0:1:3::2.25 > 2001:0:1:1::1.1024: . ack 79002 win 28000 
0:0:3.059718400 2001:0:1:1::1.1024 > 2001:0:1:3::2.25: P 106002:107002(1000) ack 256002 win 28000 
0:0:3.070598400 2001:0:1:3::2.25 > 2001:0:1:1::1.1024: . ack 80002 win 28000 
0:0:3.070598400 2001:0:1:1::1.1024 > 2001:0:1:3::2.25: P 107002:108002(1000) ack 256002 win 28000 
0:0:3.082478400 2001:0:1:3::2.25 > 2001:0:1:1::1.1024: . ack 81002 win 28000 
0:0:3.082478400 2001:0:1:1::1.1024 > 2001:0:1:3::2.25: P 108002:109002(1000) ack 256002 win 28000 
0:0:3.093358400 2001:0:1:3::2.25 > 2001:0:1:1::1.1024: . ack 82002 win 28000 
0:0:3.093358400 2001:0:1:1::1.1024 > 2001:0:1:3::2.25: P 109002:110002(1000) ack 256002 win 28000 
0:0:3.104238400 2001:0:1:3::2.25 > 2001:0:1:1::1.1024: . ack 83002 win 28000 
0:0:3.104238400 2001:0:1:1::1.1024 > 2001:0:1:3::2.25: P 110002:111002(1000) ack 256002 win 28000 
0:0:3.115118400 2001:0:1:3::2.25 > 2001:0:1:1::1.1024: . ack 84002 win 28000 
0:0:3.115118400 2001:0:1:1::1.1024 > 2001:0:1:3::2.25: P 111002:112002(1000) ack 256002 win 28000 
0:0:3.125998400 2001:0:1:3::2.25 > 2001:0:1:1::1.1024: . ack 85002 win 28000 
0:0:3.125998400 2001:0:1:1::1.1024 > 2001:0:1:3::2.25: P 112002:113002(1000) ack 256002 win 28000 
0:0:3.136878400 2001:0:1:3::2.25 > 2001:0:1:1::1.1024: . ack 86002 win 28000 
0:0:3.136878400 2001:0:1:1::1.1024 > 2001:0:1:3::2.25: P 113002:114002(1000) ack 256002 win 28000 
0:0:3.147758400 2001:0:1:3::2.25 > 2001:0:1:1::1.1024: . ack 87002 win 28000 
0:0:3.147758400 2001:0:1:1::1.1024 > 2001:0:1:3::2.25: P 114002:115002(1000) ack 256002 win 28000 
0:0:3.158638400 2001:0:1:3::2.25 > 2001:0:1:1::1.1024: . ack 88002 win 28000 
0:0:3.158638400 2001:0:1:1::1.1024 > 2001:0:1:3::2.25: P 115002:116002(1000) ack 256002 win 28000 
0:0:3.169518400 2001:0:1:3::2.25 > 2001:0:1:1::1.1024: . ack 89002 win 28000 
0:0:3.169518400 2001:0:1:1::1.1024 > 2001:0:1:3::2.25: P 116002:117002(1000) ack 256002 win 28000 
0:0:3.180398400 2001:0:1:3::2.25 > 2001:0:1:1::1.1024: . ack 90002 win 28000 
0:0:3.180398400 2001:0:1:1::1.1024 > 2001:0:1:3::2.25: P 117002:118002(1000) ack 256002 win 28000 
0:0:3.191278400 2001:0:1:3::2.25 > 2001:0:1:1::1.1024: . ack 91002 win 28000 
0:0:3.191278400 2001:0:1:1::1.1024 > 2001:0:1:3::2.25: P 118002:119002(1000) ack 256002 win 28000 
0:0:3.202158400 2001:0:1:3::2.25 > 2001:0:1:1::1.1024: . ack 92002 win 28000 
0:0:3.202158400 2001:0:1:1::1.1024 > 2001:0:1:3::2.25: P 119002:120002(1000) ack 256002 win 28000 
0:0:3.213038400 2001:0:1:3::2.25 > 2001:0:1:1::1.1024: . ack 93002 win 28000 
0:0:3.213038400 2001:0:1:1::1.1024 > 2001:0:1:3::2.25: P 120002:121002(1000) ack 256002 win 28000 
0:0:3.223918400 2001:0:1:3::2.25 > 2001:0:1:1::1.1024: . ack 94002 win 28000 
0:0:3.223918400 2001:0:1:1::1.1024 > 2001:0:1:3::2.25: P 121002:122002(1000) ack 256002 win 28000 
0:0:3.234798400 2001:0:1:3::2.25 > 2001:0:1:1::1.1024: . ack 95002 win 28000 
0:0:3.234798400 2001:0:1:1::1.1024 > 2001:0:1:3::2.25: P 122002:123002(1000) ack 256002 win 28000 
0:0:3.245678400 2001:0:1:3::2.25 > 2001:0:1:1::1.1024: . ack 96002 win 28000 
0:0:3.245678400 2001:0:1:1::1.1024 > 2001:0:1:3::2.25: P 123002:124002(1000) ack 256002 win 28000 
0:0:3.256558400 2001:0:1:3::2.25 > 2001:0:1:1::1.1024: . ack 97002 win 28000 
0:0:3.256558400 2001:0:1:1::1.1024 > 2001:0:1:3::2.25: P 124002:125002(1000) ack 256002 win 28000 
0:0:3.267438400 2001:0:1:3::2.25 > 2001:0:1:1::1.1024: . ack 98002 win 28000 
0:0:3.267438400 2001:0:1:1::1.1024 > 2001:0:1:3::2.25: P 125002:126002(1000) ack 256002 win 28000 
0:0:3.278318400 2001:0:1:3::2.25 > 2001:0:1:1::1.1024: . ack 99002 win 28000 
0:0:3.278318400 2001:0:1:1::1.1024 > 2001:0:1:3::2.25: P 126002:127002(1000) ack 256002 win 28000 
0:0:3.289198400 2001:0:1:3::2.25 > 2001:0:1:1::1.1024: . ack 100002 win 28000 
0:0:3.289198400 2001:0:1:1::1.1024 > 2001:0:1:3::2.25: P 127002:128002(1000) ack 256002 win 28000 
0:0:3.300078400 2001:0:1:3::2.25 > 2001:0:1:1::1.1024: . ack 101002 win 28000 
0:0:3.300078400 2001:0:1:1::1.1024 > 2001:0:1:3::2.25: P 128002:129002(1000) ack 256002 win 28000 
0:0:3.310958400 2001:0:1:3::2.25 > 2001:0:1:1::1.1024: . ack 102002 win 28000 
0:0:3.310958400 2001:0:1:1::1.1024 > 2001:0:1:3::2.25: P 129002:130002(1000) ack 256002 win 28000 
0:0:3.321838400 2001:0:1:3::2.25 > 2001:0:1:1::1.1024: . ack 103002 win 28000 
0:0:3.321838400 2001:0:1:1::1.1024 > 2001:0:1:3::2.25: P 130002:131002(1000) ack 256002 win 28000 
0:0:3.332718400 2001:0:1:3::2.25 > 2001:0:1:1::1.1024: . ack 104002 win 28000 
0:0:3.332718400 2001:0:1:1::1.1024 > 2001:0:1:3::2.25: P 131002:132002(1000) ack 256002 win 28000 
0:0:3.343598400 2001:0:1:3::2.25 > 2001:0:1:1::1.1024: . ack 105002 win 28000 
0:0:3.343598400 2001:0:1:1::1.1024 > 2001:0:1:3::2.25: P 132002:133002(1000) ack 256002 win 28000 
0:0:3.354478400 2001:0:1:3::2.25 > 2001:0:1:1::1.1024: . ack 106002 win 28000 
0:0:3.354478400 2001:0:1:1::1.1024 > 2001:0:1:3::2.25: P 133002:134002(1000) ack 256002 win 28000 
0:0:3.365358400 2001:0:1:3::2.25 > 2001:0:1:1::1.1024: . ack 107002 win 28000 
0:0:3.365358400 2001:0:1:1::1.1024 > 2001:0:1:3::2.25: P 134002:135002(1000) ack 256002 win 28000 
0:0:3.376238400 2001:0:1:3::2.25 > 2001:0:1:1::1.1024: . ack 108002 win 28000 
0:0:3.376238400 2001:0:1:1::1.1024 > 2001:0:1:3::2.25: P 135002:136002(1000) ack 256002 win 28000 
0:0:3.387118400 2001:0:1:3::2.25 > 2001:0:1:1::1.1024: . ack 109002 win 28000 
0:0:3.387118400 2001:0:1:1::1.1024 > 2001:0:1:3::2.25: P 136002:137002(1000) ack 256002 win 28000 
0:0:3.397998400 2001:0:1:3::2.25 > 2001:0:1:1::1.1024: . ack 110002 win 28000 
0:0:3.397998400 2001:0:1:1::1.1024 > 2001:0:1:3::2.25: P 137002:138002(1000) ack 256002 win 28000 
0:0:3.408878400 2001:0:1:3::2.25 > 2001:0:1:1::1.1024: . ack 111002 win 28000 
0:0:3.408878400 2001:0:1:1::1.1024 > 2001:0:1:3::2.25: P 138002:139002(1000) ack 256002 win 28000 
0:0:3.419758400 2001:0:1:3::2.25 > 2001:0:1:1::1.1024: . ack 112002 win 28000 
0:0:3.419758400 2001:0:1:1::1.1024 > 2001:0:1:3::2.25: P 139002:140002(1000) ack 256002 win 28000 
0:0:3.430638400 2001:0:1:3::2.25 > 2001:0:1:1::1.1024: . ack 113002 win 28000 
0:0:3.430638400 2001:0:1:1::1.1024 > 2001:0:1:3::2.25: P 140002:141002(1000) ack 256002 win 28000 
0:0:3.441518400 2001:0:1:3::2.25 > 2001:0:1:1::1.1024: . ack 114002 win 28000 
0:0:3.441518400 2001:0:1:1::1.1024 > 2001:0:1:3::2.25: P 141002:142002(1000) ack 256002 win 28000 
0:0:3.452398400 2001:0:1:3::2.25 > 2001:0:1:1::1.1024: . ack 115002 win 28000 
0:0:3.452398400 2001:0:1:1::1.1024 > 2001:0:1:3::2.25: P 142002:143002(1000) ack 256002 win 28000 
0:0:3.463278400 2001:0:1:3::2.25 > 2001:0:1:1::1.1024: . ack 116002 win 28000 
0:0:3.463278400 2001:0:1:1::1.1024 > 2001:0:1:3::2.25: P 143002:144002(1000) ack 256002 win 28000 
0:0:3.474158400 2001:0:1:3::2.25 > 2001:0:1:1::1.1024: . ack 117002 win 28000 
0:0:3.474158400 2001:0:1:1::1.1024 > 2001:0:1:3::2.25: P 144002:145002(1000) ack 256002 win 28000 
0:0:3.485038400 2001:0:1:3::2.25 > 2001:0:1:1::1.1024: . ack 118002 win 28000 
0:0:3.485038400 2001:0:1:1::1.1024 > 2001:0:1:3::2.25: P 145002:146002(1000) ack 256002 win 28000 
0:0:3.495918400 2001:0:1:3::2.25 > 2001:0:1:1::1.1024: . ack 119002 win 28000 
0:0:3.495918400 2001:0:1:1::1.1024 > 2001:0:1:3::2.25: P 146002:147002(1000) ack 256002 win 28000 
0:0:3.506798400 2001:0:1:3::2.25 > 2001:0:1:1::1.1024: . ack 120002 win 28000 
0:0:3.506798400 2001:0:1:1::1.1024 > 2001:0:1:3::2.25: P 147002:148002(1000) ack 256002 win 28000 
0:0:3.517678400 2001:0:1:3::2.25 > 2001:0:1:1::1.1024: . ack 121002 win 28000 
0:0:3.517678400 2001:0:1:1::1.1024 > 2001:0:1:3::2.25: P 148002:149002(1000) ack 256002 win 28000 
0:0:3.528558400 2001:0:1:3::2.25 > 2001:0:1:1::1.1024: . ack 122002 win 28000 
0:0:3.528558400 2001:0:1:1::1.1024 > 2001:0:1:3::2.25: P 149002:150002(1000) ack 256002 win 28000 
0:0:3.539438400 2001:0:1:3::2.25 > 2001:0:1:1::1.1024: . ack 123002 win 28000 
0:0:3.539438400 2001:0:1:1::1.1024 > 2001:0:1:3::2.25: P 150002:151002(1000) ack 256002 win 28000 
0:0:3.550318400 2001:0:1:3::2.25 > 2001:0:1:1::1.1024: . ack 124002 win 28000 
0:0:3.550318400 2001:0:1:1::1.1024 > 2001:0:1:3::2.25: P 151002:152002(1000) ack 256002 win 28000 
0:0:3.561198400 2001:0:1:3::2.25 > 2001:0:1:1::1.1024: . ack 125002 win 28000 
0:0:3.561198400 2001:0:1:1::1.1024 > 2001:0:1:3::2.25: P 152002:153002(1000) ack 256002 win 28000 
0:0:3.572078400 2001:0:1:3::2.25 > 2001:0:1:1::1.1024: . ack 126002 win 28000 
0:0:3.572078400 2001:0:1:1::1.1024 > 2001:0:1:3::2.25: P 153002:154002(1000) ack 256002 win 28000 
0:0:3.582958400 2001:0:1:3::2.25 > 2001:0:1:1::1.1024: . ack 127002 win 28000 
0:0:3.582958400 2001:0:1:1::1.1024 > 2001:0:1:3::2.25: P 154002:155002(1000) ack 256002 win 28000 
0:0:3.593838400 2001:0:1:3::2.25 > 2001:0:1:1::1.1024: . ack 128002 win 28000 
0:0:3.593838400 2001:0:1:1::1.1024 > 2001:0:1:3::2.25: P 155002:156002(1000) ack 256002 win 28000 
0:0:3.604718400 2001:0:1:3::2.25 > 2001:0:1:1::1.1024: . ack 129002 win 28000 
0:0:3.604718400 2001:0:1:1::1.1024 > 2001:0:1:3::2.25: P 156002:157002(1000) ack 256002 win 28000 
0:0:3.615598400 2001:0:1:3::2.25 > 2001:0:1:1::1.1024: . ack 130002 win 28000 
0:0:3.615598400 2001:0:1:1::1.1024 > 2001:0:1:3::2.25: P 157002:158002(1000) ack 256002 win 28000 
0:0:3.626478400 2001:0:1:3::2.25 > 2001:0:1:1::1.1024: . ack 131002 win 28000 
0:0:3.626478400 2001:0:1:1::1.1024 > 2001:0:1:3::2.25: P 158002:159002(1000) ack 256002 win 28000 
0:0:3.637358400 2001:0:1:3::2.25 > 2001:0:1:1::1.1024: . ack 132002 win 28000 
0:0:3.637358400 2001:0:1:1::1.1024 > 2001:0:1:3::2.25: P 159002:160002(1000) ack 256002 win 28000 
0:0:3.648238400 2001:0:1:3::2.25 > 2001:0:1:1::1.1024: . ack 133002 win 28000 
0:0:3.648238400 2001:0:1:1::1.1024 > 2001:0:1:3::2.25: P 160002:161002(1000) ack 256002 win 28000 
0:0:3.659118400 2001:0:1:3::2.25 > 2001:0:1:1::1.1024: . ack 134002 win 28000 
0:0:3.659118400 2001:0:1:1::1.1024 > 2001:0:1:3::2.25: P 161002:162002(1000) ack 256002 win 28000 
0:0:3.669998400 2001:0:1:3::2.25 > 2001:0:1:1::1.1024: . ack 135002 win 28000 
0:0:3.669998400 2001:0:1:1::1.1024 > 2001:0:1:3::2.25: P 162002:163002(1000) ack 256002 win 28000 
0:0:3.680878400 2001:0:1:3::2.25 > 2001:0:1:1::1.1024: . ack 136002 win 28000 
0:0:3.680878400 2001:0:1:1::1.1024 > 2001:0:1:3::2.25: P 163002:164002(1000) ack 256002 win 28000 
0:0:3.691758400 2001:0:1:3::2.25 > 2001:0:1:1::1.1024: . ack 137002 win 28000 
0:0:3.691758400 2001:0:1:1::1.1024 > 2001:0:1:3::2.25: P 164002:165002(1000) ack 256002 win 28000 
0:0:3.702638400 2001:0:1:3::2.25 > 2001:0:1:1::1.1024: . ack 138002 win 28000 
0:0:3.702638400 2001:0:1:1::1.1024 > 2001:0:1:3::2.25: P 165002:166002(1000) ack 256002 win 28000 
0:0:3.713518400 2001:0:1:3::2.25 > 2001:0:1:1::1.1024: . ack 139002 win 28000 
0:0:3.713518400 2001:0:1:1::1.1024 > 2001:0:1:3::2.25: P 166002:167002(1000) ack 256002 win 28000 
0:0:3.724398400 2001:0:1:3::2.25 > 2001:0:1:1::1.1024: . ack 140002 win 28000 
0:0:3.724398400 2001:0:1:1::1.1024 > 2001:0:1:3::2.25: P 167002:168002(1000) ack 256002 win 28000 
0:0:3.735278400 2001:0:1:3::2.25 > 2001:0:1:1::1.1024: . ack 141002 win 28000 
0:0:3.735278400 2001:0:1:1::1.1024 > 2001:0:1:3::2.25: P 168002:169002(1000) ack 256002 win 28000 
0:0:3.746158400 2001:0:1:3::2.25 > 2001:0:1:1::1.1024: . ack 142002 win 28000 
0:0:3.746158400 2001:0:1:1::1.1024 > 2001:0:1:3::2.25: P 169002:170002(1000) ack 256002 win 28000 
0:0:3.757038400 2001:0:1:3::2.25 > 2001:0:1:1::1.1024: . ack 143002 win 28000 
0:0:3.757038400 2001:0:1:1::1.1024 > 2001:0:1:3::2.25: P 170002:171002(1000) ack 256002 win 28000 
0:0:3.767918400 2001:0:1:3::2.25 > 2001:0:1:1::1.1024: . ack 144002 win 28000 
0:0:3.767918400 2001:0:1:1::1.1024 > 2001:0:1:3::2.25: P 171002:172002(1000) ack 256002 win 28000 
0:0:3.778798400 2001:0:1:3::2.25 > 2001:0:1:1::1.1024: . ack 145002 win 28000 
0:0:3.778798400 2001:0:1:1::1.1024 > 2001:0:1:3::2.25: P 172002:173002(1000) ack 256002 win 28000 
0:0:3.789678400 2001:0:1:3::2.25 > 2001:0:1:1::1.1024: . ack 146002 win 28000 
0:0:3.789678400 2001:0:1:1::1.1024 > 2001:0:1:3::2.25: P 173002:174002(1000) ack 256002 win 28000 
0:0:3.800558400 2001:0:1:3::2.25 > 2001:0:1:1::1.1024: . ack 147002 win 28000 
0:0:3.800558400 2001:0:1:1::1.1024 > 2001:0:1:3::2.25: P 174002:175002(1000) ack 256002 win 28000 
0:0:3.811438400 2001:0:1:3::2.25 > 2001:0:1:1::1.1024: . ack 148002 win 28000 
0:0:3.811438400 2001:0:1:1::1.1024 > 2001:0:1:3::2.25: P 175002:176002(1000) ack 256002 win 28000 
0:0:3.822318400 2001:0:1:3::2.25 > 2001:0:1:1::1.1024: . ack 149002 win 28000 
0:0:3.822318400 2001:0:1:1::1.1024 > 2001:0:1:3::2.25: P 176002:177002(1000) ack 256002 win 28000 
0:0:3.833198400 2001:0:1:3::2.25 > 2001:0:1:1::1.1024: . ack 150002 win 28000 
0:0:3.833198400 2001:0:1:1::1.1024 > 2001:0:1:3::2.25: P 177002:178002(1000) ack 256002 win 28000 
0:0:3.844078400 2001:0:1:3::2.25 > 2001:0:1:1::1.1024: . ack 151002 win 28000 
0:0:3.844078400 2001:0:1:1::1.1024 > 2001:0:1:3::2.25: P 178002:179002(1000) ack 256002 win 28000 
0:0:3.854958400 2001:0:1:3::2.25 > 2001:0:1:1::1.1024: . ack 152002 win 28000 
0:0:3.854958400 2001:0:1:1::1.1024 > 2001:0:1:3::2.25: P 179002:180002(1000) ack 256002 win 28000 
0:0:3.865838400 2001:0:1:3::2.25 > 2001:0:1:1::1.1024: . ack 153002 win 28000 
0:0:3.865838400 2001:0:1:1::1.1024 > 2001:0:1:3::2.25: P 180002:181002(1000) ack 256002 win 28000 
0:0:3.876718400 2001:0:1:3::2.25 > 2001:0:1:1::1.1024: . ack 154002 win 28000 
0:0:3.876718400 2001:0:1:1::1.1024 > 2001:0:1:3::2.25: P 181002:182002(1000) ack 256002 win 28000 
0:0:3.887598400 2001:0:1:3::2.25 > 2001:0:1:1::1.1024: . ack 155002 win 28000 
0:0:3.887598400 2001:0:1:1::1.1024 > 2001:0:1:3::2.25: P 182002:183002(1000) ack 256002 win 28000 
0:0:3.898478400 2001:0:1:3::2.25 > 2001:0:1:1::1.1024: . ack 156002 win 28000 
0:0:3.898478400 2001:0:1:1::1.1024 > 2001:0:1:3::2.25: P 183002:184002(1000) ack 256002 win 28000 
0:0:3.909358400 2001:0:1:3::2.25 > 2001:0:1:1::1.1024: . ack 157002 win 28000 
0:0:3.909358400 2001:0:1:1::1.1024 > 2001:0:1:3::2.25: P 184002:185002(1000) ack 256002 win 28000 
0:0:3.920238400 2001:0:1:3::2.25 > 2001:0:1:1::1.1024: . ack 158002 win 28000 
0:0:3.920238400 2001:0:1:1::1.1024 > 2001:0:1:3::2.25: P 185002:186002(1000) ack 256002 win 28000 
0:0:3.931118400 2001:0:1:3::2.25 > 2001:0:1:1::1.1024: . ack 159002 win 28000 
0:0:3.931118400 2001:0:1:1::1.1024 > 2001:0:1:3::2.25: P 186002:187002(1000) ack 256002 win 28000 
0:0:3.941998400 2001:0:1:3::2.25 > 2001:0:1:1::1.1024: . ack 160002 win 28000 
0:0:3.941998400 2001:0:1:1::1.1024 > 2001:0:1:3::2.25: P 187002:188002(1000) ack 256002 win 28000 
0:0:3.952878400 2001:0:1:3::2.25 > 2001:0:1:1::1.1024: . ack 161002 win 28000 
0:0:3.952878400 2001:0:1:1::1.1024 > 2001:0:1:3::2.25: P 188002:189002(1000) ack 256002 win 28000 
0:0:3.963758400 2001:0:1:3::2.25 > 2001:0:1:1::1.1024: . ack 162002 win 28000 
0:0:3.963758400 2001:0:1:1::1.1024 > 2001:0:1:3::2.25: P 189002:190002(1000) ack 256002 win 28000 
0:0:3.974638400 2001:0:1:3::2.25 > 2001:0:1:1::1.1024: . ack 163002 win 28000 
0:0:3.974638400 2001:0:1:1::1.1024 > 2001:0:1:3::2.25: P 190002:191002(1000) ack 256002 win 28000 
0:0:3.985518400 2001:0:1:3::2.25 > 2001:0:1:1::1.1024: . ack 164002 win 28000 
0:0:3.985518400 2001:0:1:1::1.1024 > 2001:0:1:3::2.25: P 191002:192002(1000) ack 256002 win 28000 
0:0:3.996398400 2001:0:1:3::2.25 > 2001:0:1:1::1.1024: . ack 165002 win 28000 
0:0:3.996398400 2001:0:1:1::1.1024 > 2001:0:1:3::2.25: P 192002:193002(1000) ack 256002 win 28000 
0:0:4.007278400 2001:0:1:3::2.25 > 2001:0:1:1::1.1024: . ack 166002 win 28000 
0:0:4.007278400 2001:0:1:1::1.1024 > 2001:0:1:3::2.25: P 193002:194002(1000) ack 256002 win 28000 
0:0:4.018158400 2001:0:1:3::2.25 > 2001:0:1:1::1.1024: . ack 167002 win 28000 
0:0:4.018158400 2001:0:1:1::1.1024 > 2001:0:1:3::2.25: P 194002:195002(1000) ack 256002 win 28000 
0:0:4.029038400 2001:0:1:3::2.25 > 2001:0:1:1::1.1024: . ack 168002 win 28000 
0:0:4.029038400 2001:0:1:1::1.1024 > 2001:0:1:3::2.25: P 195002:196002(1000) ack 256002 win 28000 
0:0:4.039918400 2001:0:1:3::2.25 > 2001:0:1:1::1.1024: . ack 169002 win 28000 
0:0:4.039918400 2001:0:1:1::1.1024 > 2001:0:1:3::2.25: P 196002:197002(1000) ack 256002 win 28000 
0:0:4.050798400 2001:0:1:3::2.25 > 2001:0:1:1::1.1024: . ack 170002 win 28000 
0:0:4.050798400 2001:0:1:1::1.1024 > 2001:0:1:3::2.25: P 197002:198002(1000) ack 256002 win 28000 
0:0:4.061678400 2001:0:1:3::2.25 > 2001:0:1:1::1.1024: . ack 171002 win 28000 
0:0:4.061678400 2001:0:1:1::1.1024 > 2001:0:1:3::2.25: P 198002:199002(1000) ack 256002 win 28000 
0:0:4.072558400 2001:0:1:3::2.25 > 2001:0:1:1::1.1024: . ack 172002 win 28000 
0:0:4.072558400 2001:0:1:1::1.1024 > 2001:0:1:3::2.25: P 199002:200002(1000) ack 256002 win 28000 
0:0:4.083438400 2001:0:1:3::2.25 > 2001:0:1:1::1.1024: . ack 173002 win 28000 
0:0:4.083438400 2001:0:1:1::1.1024 > 2001:0:1:3::2.25: P 200002:201002(1000) ack 256002 win 28000 
0:0:4.094318400 2001:0:1:3::2.25 > 2001:0:1:1::1.1024: . ack 174002 win 28000 
0:0:4.094318400 2001:0:1:1::1.1024 > 2001:0:1:3::2.25: P 201002:202002(1000) ack 256002 win 28000 
0:0:4.105198400 2001:0:1:3::2.25 > 2001:0:1:1::1.1024: . ack 175002 win 28000 
0:0:4.105198400 2001:0:1:1::1.1024 > 2001:0:1:3::2.25: P 202002:203002(1000) ack 256002 win 28000 
0:0:4.116078400 2001:0:1:3::2.25 > 2001:0:1:1::1.1024: . ack 176002 win 28000 
0:0:4.116078400 2001:0:1:1::1.1024 > 2001:0:1:3::2.25: P 203002:204002(1000) ack 256002 win 28000 
0:0:4.126958400 2001:0:1:3::2.25 > 2001:0:1:1::1.1024: . ack 177002 win 28000 
0:0:4.126958400 2001:0:1:1::1.1024 > 2001:0:1:3::2.25: P 204002:205002(1000) ack 256002 win 28000 
0:0:4.137838400 2001:0:1:3::2.25 > 2001:0:1:1::1.1024: . ack 178002 win 28000 
0:0:4.137838400 2001:0:1:1::1.1024 > 2001:0:1:3::2.25: P 205002:206002(1000) ack 256002 win 28000 
0:0:4.148718400 2001:0:1:3::2.25 > 2001:0:1:1::1.1024: . ack 179002 win 28000 
0:0:4.148718400 2001:0:1:1::1.1024 > 2001:0:1:3::2.25: P 206002:207002(1000) ack 256002 win 28000 
0:0:4.159598400 2001:0:1:3::2.25 > 2001:0:1:1::1.1024: . ack 180002 win 28000 
0:0:4.159598400 2001:0:1:1::1.1024 > 2001:0:1:3::2.25: P 207002:208002(1000) ack 256002 win 28000 
0:0:4.170478400 2001:0:1:3::2.25 > 2001:0:1:1::1.1024: . ack 181002 win 28000 
0:0:4.170478400 2001:0:1:1::1.1024 > 2001:0:1:3::2.25: P 208002:209002(1000) ack 256002 win 28000 
0:0:4.181358400 2001:0:1:3::2.25 > 2001:0:1:1::1.1024: . ack 182002 win 28000 
0:0:4.181358400 2001:0:1:1::1.1024 > 2001:0:1:3::2.25: P 209002:210002(1000) ack 256002 win 28000 
0:0:4.192238400 2001:0:1:3::2.25 > 2001:0:1:1::1.1024: . ack 183002 win 28000 
0:0:4.192238400 2001:0:1:1::1.1024 > 2001:0:1:3::2.25: P 210002:211002(1000) ack 256002 win 28000 
0:0:4.203118400 2001:0:1:3::2.25 > 2001:0:1:1::1.1024: . ack 184002 win 28000 
0:0:4.203118400 2001:0:1:1::1.1024 > 2001:0:1:3::2.25: P 211002:212002(1000) ack 256002 win 28000 
0:0:4.213998400 2001:0:1:3::2.25 > 2001:0:1:1::1.1024: . ack 185002 win 28000 
0:0:4.213998400 2001:0:1:1::1.1024 > 2001:0:1:3::2.25: P 212002:213002(1000) ack 256002 win 28000 
0:0:4.224878400 2001:0:1:3::2.25 > 2001:0:1:1::1.1024: . ack 186002 win 28000 
0:0:4.224878400 2001:0:1:1::1.1024 > 2001:0:1:3::2.25: P 213002:214002(1000) ack 256002 win 28000 
0:0:4.235758400 2001:0:1:3::2.25 > 2001:0:1:1::1.1024: . ack 187002 win 28000 
0:0:4.235758400 2001:0:1:1::1.1024 > 2001:0:1:3::2.25: P 214002:215002(1000) ack 256002 win 28000 
0:0:4.246638400 2001:0:1:3::2.25 > 2001:0:1:1::1.1024: . ack 188002 win 28000 
0:0:4.246638400 2001:0:1:1::1.1024 > 2001:0:1:3::2.25: P 215002:216002(1000) ack 256002 win 28000 
0:0:4.257518400 2001:0:1:3::2.25 > 2001:0:1:1::1.1024: . ack 189002 win 28000 
0:0:4.257518400 2001:0:1:1::1.1024 > 2001:0:1:3::2.25: P 216002:217002(1000) ack 256002 win 28000 
0:0:4.268398400 2001:0:1:3::2.25 > 2001:0:1:1::1.1024: . ack 190002 win 28000 
0:0:4.268398400 2001:0:1:1::1.1024 > 2001:0:1:3::2.25: P 217002:218002(1000) ack 256002 win 28000 
0:0:4.279278400 2001:0:1:3::2.25 > 2001:0:1:1::1.1024: . ack 191002 win 28000 
0:0:4.279278400 2001:0:1:1::1.1024 > 2001:0:1:3::2.25: P 218002:219002(1000) ack 256002 win 28000 
0:0:4.290158400 2001:0:1:3::2.25 > 2001:0:1:1::1.1024: . ack 192002 win 28000 
0:0:4.290158400 2001:0:1:1::1.1024 > 2001:0:1:3::2.25: P 219002:220002(1000) ack 256002 win 28000 
0:0:4.301038400 2001:0:1:3::2.25 > 2001:0:1:1::1.1024: . ack 193002 win 28000 
0:0:4.301038400 2001:0:1:1::1.1024 > 2001:0:1:3::2.25: P 220002:221002(1000) ack 256002 win 28000 
0:0:4.311918400 2001:0:1:3::2.25 > 2001:0:1:1::1.1024: . ack 194002 win 28000 
0:0:4.311918400 2001:0:1:1::1.1024 > 2001:0:1:3::2.25: P 221002:222002(1000) ack 256002 win 28000 
0:0:4.322798400 2001:0:1:3::2.25 > 2001:0:1:1::1.1024: . ack 195002 win 28000 
0:0:4.322798400 2001:0:1:1::1.1024 > 2001:0:1:3::2.25: P 222002:223002(1000) ack 256002 win 28000 
0:0:4.333678400 2001:0:1:3::2.25 > 2001:0:1:1::1.1024: . ack 196002 win 28000 
0:0:4.333678400 2001:0:1:1::1.1024 > 2001:0:1:3::2.25: P 223002:224002(1000) ack 256002 win 28000 
0:0:4.344558400 2001:0:1:3::2.25 > 2001:0:1:1::1.1024: . ack 197002 win 28000 
0:0:4.344558400 2001:0:1:1::1.1024 > 2001:0:1:3::2.25: P 224002:225002(1000) ack 256002 win 28000 
0:0:4.355438400 2001:0:1:3::2.25 > 2001:0:1:1::1.1024: . ack 198002 win 28000 
0:0:4.355438400 2001:0:1:1::1.1024 > 2001:0:1:3::2.25: P 225002:226002(1000) ack 256002 win 28000 
0:0:4.366318400 2001:0:1:3::2.25 > 2001:0:1:1::1.1024: . ack 199002 win 28000 
0:0:4.366318400 2001:0:1:1::1.1024 > 2001:0:1:3::2.25: P 226002:227002(1000) ack 256002 win 28000 
0:0:4.377198400 2001:0:1:3::2.25 > 2001:0:1:1::1.1024: . ack 200002 win 28000 
0:0:4.377198400 2001:0:1:1::1.1024 > 2001:0:1:3::2.25: P 227002:228002(1000) ack 256002 win 28000 
0:0:4.388078400 2001:0:1:3::2.25 > 2001:0:1:1::1.1024: . ack 201002 win 28000 
0:0:4.388078400 2001:0:1:1::1.1024 > 2001:0:1:3::2.25: P 228002:229002(1000) ack 256002 win 28000 
0:0:4.398958400 2001:0:1:3::2.25 > 2001:0:1:1::1.1024: . ack 202002 win 28000 
0:0:4.398958400 2001:0:1:1::1.1024 > 2001:0:1:3::2.25: P 229002:230002(1000) ack 256002 win 28000 
0:0:4.409838400 2001:0:1:3::2.25 > 2001:0:1:1::1.1024: . ack 203002 win 28000 
0:0:4.409838400 2001:0:1:1::1.1024 > 2001:0:1:3::2.25: P 230002:231002(1000) ack 256002 win 28000 
0:0:4.420718400 2001:0:1:3::2.25 > 2001:0:1:1::1.1024: . ack 204002 win 28000 
0:0:4.420718400 2001:0:1:1::1.1024 > 2001:0:1:3::2.25: P 231002:232002(1000) ack 256002 win 28000 
0:0:4.431598400 2001:0:1:3::2.25 > 2001:0:1:1::1.1024: . ack 205002 win 28000 
0:0:4.431598400 2001:0:1:1::1.1024 > 2001:0:1:3::2.25: P 232002:233002(1000) ack 256002 win 28000 
0:0:4.442478400 2001:0:1:3::2.25 > 2001:0:1:1::1.1024: . ack 206002 win 28000 
0:0:4.442478400 2001:0:1:1::1.1024 > 2001:0:1:3::2.25: P 233002:234002(1000) ack 256002 win 28000 
0:0:4.453358400 2001:0:1:3::2.25 > 2001:0:1:1::1.1024: . ack 207002 win 28000 
0:0:4.453358400 2001:0:1:1::1.1024 > 2001:0:1:3::2.25: P 234002:235002(1000) ack 256002 win 28000 
0:0:4.464238400 2001:0:1:3::2.25 > 2001:0:1:1::1.1024: . ack 208002 win 28000 
0:0:4.464238400 2001:0:1:1::1.1024 > 2001:0:1:3::2.25: P 235002:236002(1000) ack 256002 win 28000 
0:0:4.475118400 2001:0:1:3::2.25 > 2001:0:1:1::1.1024: . ack 209002 win 28000 
0:0:4.475118400 2001:0:1:1::1.1024 > 2001:0:1:3::2.25: P 236002:237002(1000) ack 256002 win 28000 
0:0:4.485998400 2001:0:1:3::2.25 > 2001:0:1:1::1.1024: . ack 210002 win 28000 
0:0:4.485998400 2001:0:1:1::1.1024 > 2001:0:1:3::2.25: P 237002:238002(1000) ack 256002 win 28000 
0:0:4.496878400 2001:0:1:3::2.25 > 2001:0:1:1::1.1024: . ack 211002 win 28000 
0:0:4.496878400 2001:0:1:1::1.1024 > 2001:0:1:3::2.25: P 238002:239002(1000) ack 256002 win 28000 
0:0:4.507758400 2001:0:1:3::2.25 > 2001:0:1:1::1.1024: . ack 212002 win 28000 
0:0:4.507758400 2001:0:1:1::1.1024 > 2001:0:1:3::2.25: P 239002:240002(1000) ack 256002 win 28000 
0:0:4.518638400 2001:0:1:3::2.25 > 2001:0:1:1::1.1024: . ack 213002 win 28000 
0:0:4.518638400 2001:0:1:1::1.1024 > 2001:0:1:3::2.25: P 240002:241002(1000) ack 256002 win 28000 
0:0:4.529518400 2001:0:1:3::2.25 > 2001:0:1:1::1.1024: . ack 214002 win 28000 
0:0:4.529518400 2001:0:1:1::1.1024 > 2001:0:1:3::2.25: P 241002:242002(1000) ack 256002 win 28000 
0:0:4.540398400 2001:0:1:3::2.25 > 2001:0:1:1::1.1024: . ack 215002 win 28000 
0:0:4.540398400 2001:0:1:1::1.1024 > 2001:0:1:3::2.25: P 242002:243002(1000) ack 256002 win 28000 
0:0:4.551278400 2001:0:1:3::2.25 > 2001:0:1:1::1.1024: . ack 216002 win 28000 
0:0:4.551278400 2001:0:1:1::1.1024 > 2001:0:1:3::2.25: P 243002:244002(1000) ack 256002 win 28000 
0:0:4.562158400 2001:0:1:3::2.25 > 2001:0:1:1::1.1024: . ack 217002 win 28000 
0:0:4.562158400 2001:0:1:1::1.1024 > 2001:0:1:3::2.25: P 244002:245002(1000) ack 256002 win 28000 
0:0:4.573038400 2001:0:1:3::2.25 > 2001:0:1:1::1.1024: . ack 218002 win 28000 
0:0:4.573038400 2001:0:1:1::1.1024 > 2001:0:1:3::2.25: P 245002:246002(1000) ack 256002 win 28000 
0:0:4.583918400 2001:0:1:3::2.25 > 2001:0:1:1::1.1024: . ack 219002 win 28000 
0:0:4.583918400 2001:0:1:1::1.1024 > 2001:0:1:3::2.25: P 246002:247002(1000) ack 256002 win 28000 
0:0:4.594798400 2001:0:1:3::2.25 > 2001:0:1:1::1.1024: . ack 220002 win 28000 
0:0:4.594798400 2001:0:1:1::1.1024 > 2001:0:1:3::2.25: P 247002:248002(1000) ack 256002 win 28000 
0:0:4.605678400 2001:0:1:3::2.25 > 2001:0:1:1::1.1024: . ack 221002 win 28000 
0:0:4.605678400 2001:0:1:1::1.1024 > 2001:0:1:3::2.25: P 248002:249002(1000) ack 256002 win 28000 
0:0:4.616558400 2001:0:1:3::2.25 > 2001:0:1:1::1.1024: . ack 222002 win 28000 
0:0:4.616558400 2001:0:1:1::1.1024 > 2001:0:1:3::2.25: P 249002:250002(1000) ack 256002 win 28000 
0:0:4.627438400 2001:0:1:3::2.25 > 2001:0:1:1::1.1024: . ack 223002 win 28000 
0:0:4.627438400 2001:0:1:1::1.1024 > 2001:0:1:3::2.25: P 250002:251002(1000) ack 256002 win 28000 
0:0:4.638318400 2001:0:1:3::2.25 > 2001:0:1:1::1.1024: . ack 224002 win 28000 
0:0:4.638318400 2001:0:1:1::1.1024 > 2001:0:1:3::2.25: P 251002:252002(1000) ack 256002 win 28000 
0:0:4.649198400 2001:0:1:3::2.25 > 2001:0:1:1::1.1024: . ack 225002 win 28000 
0:0:4.649198400 2001:0:1:1::1.1024 > 2001:0:1:3::2.25: P 252002:253002(1000) ack 256002 win 28000 
0:0:4.660078400 2001:0:1:3::2.25 > 2001:0:1:1::1.1024: . ack 226002 win 28000 
0:0:4.660078400 2001:0:1:1::1.1024 > 2001:0:1:3::2.25: P 253002:254002(1000) ack 256002 win 28000 
0:0:4.670958400 2001:0:1:3::2.25 > 2001:0:1:1::1.1024: . ack 227002 win 28000 
0:0:4.670958400 2001:0:1:1::1.1024 > 2001:0:1:3::2.25: P 254002:255002(1000) ack 256002 win 28000 
0:0:4.681838400 2001:0:1:3::2.25 > 2001:0:1:1::1.1024: . ack 228002 win 28000 
0:0:4.681838400 2001:0:1:1::1.1024 > 2001:0:1:3::2.25: P 255002:256002(1000) ack 256002 win 28000 
0:0:4.692718400 2001:0:1:3::2.25 > 2001:0:1:1::1.1024: . ack 229002 win 28000 
0:0:4.692718400 2001:0:1:1::1.1024 > 2001:0:1:3::2.25: P 256002:257002(1000) ack 256002 win 28000 
0:0:4.703598400 2001:0:1:3::2.25 > 2001:0:1:1::1.1024: . ack 230002 win 28000 
0:0:4.703598400 2001:0:1:1::1.1024 > 2001:0:1:3::2.25: P 257002:258002(1000) ack 256002 win 28000 
0:0:4.714478400 2001:0:1:3::2.25 > 2001:0:1:1::1.1024: . ack 231002 win 28000 
0:0:4.714478400 2001:0:1:1::1.1024 > 2001:0:1:3::2.25: P 258002:259002(1000) ack 256002 win 28000 
0:0:4.725358400 2001:0:1:3::2.25 > 2001:0:1:1::1.1024: . ack 232002 win 28000 
0:0:4.725358400 2001:0:1:1::1.1024 > 2001:0:1:3::2.25: P 259002:260002(1000) ack 256002 win 28000 
0:0:4.736238400 2001:0:1:3::2.25 > 2001:0:1:1::1.1024: . ack 233002 win 28000 
0:0:4.736238400 2001:0:1:1::1.1024 > 2001:0:1:3::2.25: P 260002:261002(1000) ack 256002 win 28000 
0:0:4.747118400 2001:0:1:3::2.25 > 2001:0:1:1::1.1024: . ack 234002 win 28000 
0:0:4.747118400 2001:0:1:1::1.1024 > 2001:0:1:3::2.25: P 261002:262002(1000) ack 256002 win 28000 
0:0:4.757998400 2001:0:1:3::2.25 > 2001:0:1:1::1.1024: . ack 235002 win 28000 
0:0:4.757998400 2001:0:1:1::1.1024 > 2001:0:1:3::2.25: P 262002:263002(1000) ack 256002 win 28000 
0:0:4.768878400 2001:0:1:3::2.25 > 2001:0:1:1::1.1024: . ack 236002 win 28000 
0:0:4.768878400 2001:0:1:1::1.1024 > 2001:0:1:3::2.25: P 263002:264002(1000) ack 256002 win 28000 
0:0:4.779758400 2001:0:1:3::2.25 > 2001:0:1:1::1.1024: . ack 237002 win 28000 
0:0:4.779758400 2001:0:1:1::1.1024 > 2001:0:1:3::2.25: P 264002:265002(1000) ack 256002 win 28000 
0:0:4.790638400 2001:0:1:3::2.25 > 2001:0:1:1::1.1024: . ack 238002 win 28000 
0:0:4.790638400 2001:0:1:1::1.1024 > 2001:0:1:3::2.25: P 265002:266002(1000) ack 256002 win 28000 
0:0:4.801518400 2001:0:1:3::2.25 > 2001:0:1:1::1.1024: . ack 239002 win 28000 
0:0:4.801518400 2001:0:1:1::1.1024 > 2001:0:1:3::2.25: P 266002:267002(1000) ack 256002 win 28000 
0:0:4.812398400 2001:0:1:3::2.25 > 2001:0:1:1::1.1024: . ack 240002 win 28000 
0:0:4.812398400 2001:0:1:1::1.1024 > 2001:0:1:3::2.25: P 267002:268002(1000) ack 256002 win 28000 
0:0:4.823278400 2001:0:1:3::2.25 > 2001:0:1:1::1.1024: . ack 241002 win 28000 
0:0:4.823278400 2001:0:1:1::1.1024 > 2001:0:1:3::2.25: P 268002:269002(1000) ack 256002 win 28000 
0:0:4.834158400 2001:0:1:3::2.25 > 2001:0:1:1::1.1024: . ack 242002 win 28000 
0:0:4.834158400 2001:0:1:1::1.1024 > 2001:0:1:3::2.25: P 269002:270002(1000) ack 256002 win 28000 
0:0:4.845038400 2001:0:1:3::2.25 > 2001:0:1:1::1.1024: . ack 243002 win 28000 
0:0:4.845038400 2001:0:1:1::1.1024 > 2001:0:1:3::2.25: P 270002:271002(1000) ack 256002 win 28000 
0:0:4.855918400 2001:0:1:3::2.25 > 2001:0:1:1::1.1024: . ack 244002 win 28000 
0:0:4.855918400 2001:0:1:1::1.1024 > 2001:0:1:3::2.25: P 271002:272002(1000) ack 256002 win 28000 
0:0:4.866798400 2001:0:1:3::2.25 > 2001:0:1:1::1.1024: . ack 245002 win 28000 
0:0:4.866798400 2001:0:1:1::1.1024 > 2001:0:1:3::2.25: P 272002:273002(1000) ack 256002 win 28000 
0:0:4.877678400 2001:0:1:3::2.25 > 2001:0:1:1::1.1024: . ack 246002 win 28000 
0:0:4.877678400 2001:0:1:1::1.1024 > 2001:0:1:3::2.25: P 273002:274002(1000) ack 256002 win 28000 
0:0:4.888558400 2001:0:1:3::2.25 > 2001:0:1:1::1.1024: . ack 247002 win 28000 
0:0:4.888558400 2001:0:1:1::1.1024 > 2001:0:1:3::2.25: P 274002:275002(1000) ack 256002 win 28000 
0:0:4.899438400 2001:0:1:3::2.25 > 2001:0:1:1::1.1024: . ack 248002 win 28000 
0:0:4.899438400 2001:0:1:1::1.1024 > 2001:0:1:3::2.25: P 275002:276002(1000) ack 256002 win 28000 
0:0:4.910318400 2001:0:1:3::2.25 > 2001:0:1:1::1.1024: . ack 249002 win 28000 
0:0:4.910318400 2001:0:1:1::1.1024 > 2001:0:1:3::2.25: P 276002:277002(1000) ack 256002 win 28000 
0:0:4.921198400 2001:0:1:3::2.25 > 2001:0:1:1::1.1024: . ack 250002 win 28000 
0:0:4.921198400 2001:0:1:1::1.1024 > 2001:0:1:3::2.25: P 277002:278002(1000) ack 256002 win 28000 
0:0:4.932078400 2001:0:1:3::2.25 > 2001:0:1:1::1.1024: . ack 251002 win 28000 
0:0:4.932078400 2001:0:1:1::1.1024 > 2001:0:1:3::2.25: P 278002:279002(1000) ack 256002 win 28000 
0:0:4.943051419 2001:0:1:3::2.25 > 2001:0:1:1::1.1024: . ack 252002 win 28000 
0:0:4.943051419 2001:0:1:1::1.1024 > 2001:0:1:3::2.25: P 279002:280002(1000) ack 256002 win 28000 
0:0:4.953838400 2001:0:1:3::2.25 > 2001:0:1:1::1.1024: . ack 253002 win 28000 
0:0:4.953838400 2001:0:1:1::1.1024 > 2001:0:1:3::2.25: P 280002:281002(1000) ack 256002 win 28000 
0:0:4.964718400 2001:0:1:3::2.25 > 2001:0:1:1::1.1024: . ack 254002 win 28000 
0:0:4.964718400 2001:0:1:1::1.1024 > 2001:0:1:3::2.25: P 281002:282002(1000) ack 256002 win 28000 
0:0:4.975598400 2001:0:1:3::2.25 > 2001:0:1:1::1.1024: . ack 255002 win 28000 
0:0:4.975598400 2001:0:1:1::1.1024 > 2001:0:1:3::2.25: P 282002:283002(1000) ack 256002 win 28000 
0:0:4.986478400 2001:0:1:3::2.25 > 2001:0:1:1::1.1024: . ack 256002 win 28000 
0:0:4.986478400 2001:0:1:1::1.1024 > 2001:0:1:3::2.25: P 283002:284002(1000) ack 256002 win 28000 
0:0:4.997358400 2001:0:1:3::2.25 > 2001:0:1:1::1.1024: . ack 257002 win 28000 
0:0:4.997358400 2001:0:1:1::1.1024 > 2001:0:1:3::2.25: P 284002:285002(1000) ack 256002 win 28000 
0:0:5.008238400 2001:0:1:3::2.25 > 2001:0:1:1::1.1024: . ack 258002 win 28000 
0:0:5.008238400 2001:0:1:1::1.1024 > 2001:0:1:3::2.25: P 285002:286002(1000) ack 256002 win 28000 
0:0:5.019118400 2001:0:1:3::2.25 > 2001:0:1:1::1.1024: . ack 259002 win 28000 
0:0:5.019118400 2001:0:1:1::1.1024 > 2001:0:1:3::2.25: P 286002:287002(1000) ack 256002 win 28000 
0:0:5.029998400 2001:0:1:3::2.25 > 2001:0:1:1::1.1024: . ack 260002 win 28000 
0:0:5.029998400 2001:0:1:1::1.1024 > 2001:0:1:3::2.25: P 287002:288002(1000) ack 256002 win 28000 
0:0:5.040878400 2001:0:1:3::2.25 > 2001:0:1:1::1.1024: . ack 261002 win 28000 
0:0:5.040878400 2001:0:1:1::1.1024 > 2001:0:1:3::2.25: P 288002:289002(1000) ack 256002 win 28000 
0:0:5.051758400 2001:0:1:3::2.25 > 2001:0:1:1::1.1024: . ack 262002 win 28000 
0:0:5.051758400 2001:0:1:1::1.1024 > 2001:0:1:3::2.25: P 289002:290002(1000) ack 256002 win 28000 
0:0:5.062638400 2001:0:1:3::2.25 > 2001:0:1:1::1.1024: . ack 263002 win 28000 
0:0:5.062638400 2001:0:1:1::1.1024 > 2001:0:1:3::2.25: P 290002:291002(1000) ack 256002 win 28000 
0:0:5.073518400 2001:0:1:3::2.25 > 2001:0:1:1::1.1024: . ack 264002 win 28000 
0:0:5.073518400 2001:0:1:1::1.1024 > 2001:0:1:3::2.25: P 291002:292002(1000) ack 256002 win 28000 
0:0:5.085398400 2001:0:1:3::2.25 > 2001:0:1:1::1.1024: . ack 265002 win 28000 
0:0:5.085398400 2001:0:1:1::1.1024 > 2001:0:1:3::2.25: P 292002:293002(1000) ack 256002 win 28000 
0:0:5.096278400 2001:0:1:3::2.25 > 2001:0:1:1::1.1024: . ack 266002 win 28000 
0:0:5.096278400 2001:0:1:1::1.1024 > 2001:0:1:3::2.25: P 293002:294002(1000) ack 256002 win 28000 
0:0:5.107158400 2001:0:1:3::2.25 > 2001:0:1:1::1.1024: . ack 267002 win 28000 
0:0:5.107158400 2001:0:1:1::1.1024 > 2001:0:1:3::2.25: P 294002:295002(1000) ack 256002 win 28000 
0:0:5.118038400 2001:0:1:3::2.25 > 2001:0:1:1::1.1024: . ack 268002 win 28000 
0:0:5.118038400 2001:0:1:1::1.1024 > 2001:0:1:3::2.25: P 295002:296002(1000) ack 256002 win 28000 
0:0:5.128918400 2001:0:1:3::2.25 > 2001:0:1:1::1.1024: . ack 269002 win 28000 
0:0:5.128918400 2001:0:1:1::1.1024 > 2001:0:1:3::2.25: P 296002:297002(1000) ack 256002 win 28000 
0:0:5.139798400 2001:0:1:3::2.25 > 2001:0:1:1::1.1024: . ack 270002 win 28000 
0:0:5.139798400 2001:0:1:1::1.1024 > 2001:0:1:3::2.25: P 297002:298002(1000) ack 256002 win 28000 
0:0:5.150678400 2001:0:1:3::2.25 > 2001:0:1:1::1.1024: . ack 271002 win 28000 
0:0:5.150678400 2001:0:1:1::1.1024 > 2001:0:1:3::2.25: P 298002:299002(1000) ack 256002 win 28000 
0:0:5.161558400 2001:0:1:3::2.25 > 2001:0:1:1::1.1024: . ack 272002 win 28000 
0:0:5.161558400 2001:0:1:1::1.1024 > 2001:0:1:3::2.25: P 299002:300002(1000) ack 256002 win 28000 
0:0:5.172438400 2001:0:1:3::2.25 > 2001:0:1:1::1.1024: . ack 273002 win 28000 
0:0:5.172438400 2001:0:1:1::1.1024 > 2001:0:1:3::2.25: P 300002:301002(1000) ack 256002 win 28000 
0:0:5.183318400 2001:0:1:3::2.25 > 2001:0:1:1::1.1024: . ack 274002 win 28000 
0:0:5.183318400 2001:0:1:1::1.1024 > 2001:0:1:3::2.25: P 301002:302002(1000) ack 256002 win 28000 
0:0:5.194198400 2001:0:1:3::2.25 > 2001:0:1:1::1.1024: . ack 275002 win 28000 
0:0:5.194198400 2001:0:1:1::1.1024 > 2001:0:1:3::2.25: P 302002:303002(1000) ack 256002 win 28000 
0:0:5.205078400 2001:0:1:3::2.25 > 2001:0:1:1::1.1024: . ack 276002 win 28000 
0:0:5.205078400 2001:0:1:1::1.1024 > 2001:0:1:3::2.25: P 303002:304002(1000) ack 256002 win 28000 
0:0:5.215958400 2001:0:1:3::2.25 > 2001:0:1:1::1.1024: . ack 277002 win 28000 
0:0:5.215958400 2001:0:1:1::1.1024 > 2001:0:1:3::2.25: P 304002:305002(1000) ack 256002 win 28000 
0:0:5.226838400 2001:0:1:3::2.25 > 2001:0:1:1::1.1024: . ack 278002 win 28000 
0:0:5.226838400 2001:0:1:1::1.1024 > 2001:0:1:3::2.25: P 305002:306002(1000) ack 256002 win 28000 
0:0:5.237718400 2001:0:1:3::2.25 > 2001:0:1:1::1.1024: . ack 279002 win 28000 
0:0:5.237718400 2001:0:1:1::1.1024 > 2001:0:1:3::2.25: P 306002:307002(1000) ack 256002 win 28000 
0:0:5.248598400 2001:0:1:3::2.25 > 2001:0:1:1::1.1024: . ack 280002 win 28000 
0:0:5.248598400 2001:0:1:1::1.1024 > 2001:0:1:3::2.25: P 307002:308002(1000) ack 256002 win 28000 
0:0:5.259478400 2001:0:1:3::2.25 > 2001:0:1:1::1.1024: . ack 281002 win 28000 
0:0:5.259478400 2001:0:1:1::1.1024 > 2001:0:1:3::2.25: P 308002:309002(1000) ack 256002 win 28000 
0:0:5.270358400 2001:0:1:3::2.25 > 2001:0:1:1::1.1024: . ack 282002 win 28000 
0:0:5.270358400 2001:0:1:1::1.1024 > 2001:0:1:3::2.25: P 309002:310002(1000) ack 256002 win 28000 
0:0:5.281238400 2001:0:1:3::2.25 > 2001:0:1:1::1.1024: . ack 283002 win 28000 
0:0:5.281238400 2001:0:1:1::1.1024 > 2001:0:1:3::2.25: P 310002:311002(1000) ack 256002 win 28000 
0:0:5.292118400 2001:0:1:3::2.25 > 2001:0:1:1::1.1024: . ack 284002 win 28000 
0:0:5.292118400 2001:0:1:1::1.1024 > 2001:0:1:3::2.25: P 311002:312002(1000) ack 256002 win 28000 
0:0:5.302998400 2001:0:1:3::2.25 > 2001:0:1:1::1.1024: . ack 285002 win 28000 
0:0:5.302998400 2001:0:1:1::1.1024 > 2001:0:1:3::2.25: P 312002:313002(1000) ack 256002 win 28000 
0:0:5.313878400 2001:0:1:3::2.25 > 2001:0:1:1::1.1024: . ack 286002 win 28000 
0:0:5.313878400 2001:0:1:1::1.1024 > 2001:0:1:3::2.25: P 313002:314002(1000) ack 256002 win 28000 
0:0:5.324758400 2001:0:1:3::2.25 > 2001:0:1:1::1.1024: . ack 287002 win 28000 
0:0:5.324758400 2001:0:1:1::1.1024 > 2001:0:1:3::2.25: P 314002:315002(1000) ack 256002 win 28000 
0:0:5.335638400 2001:0:1:3::2.25 > 2001:0:1:1::1.1024: . ack 288002 win 28000 
0:0:5.335638400 2001:0:1:1::1.1024 > 2001:0:1:3::2.25: P 315002:316002(1000) ack 256002 win 28000 
0:0:5.346518400 2001:0:1:3::2.25 > 2001:0:1:1::1.1024: . ack 289002 win 28000 
0:0:5.346518400 2001:0:1:1::1.1024 > 2001:0:1:3::2.25: P 316002:317002(1000) ack 256002 win 28000 
0:0:5.357398400 2001:0:1:3::2.25 > 2001:0:1:1::1.1024: . ack 290002 win 28000 
0:0:5.357398400 2001:0:1:1::1.1024 > 2001:0:1:3::2.25: P 317002:318002(1000) ack 256002 win 28000 
0:0:5.368278400 2001:0:1:3::2.25 > 2001:0:1:1::1.1024: . ack 291002 win 28000 
0:0:5.368278400 2001:0:1:1::1.1024 > 2001:0:1:3::2.25: P 318002:319002(1000) ack 256002 win 28000 
0:0:5.379158400 2001:0:1:3::2.25 > 2001:0:1:1::1.1024: . ack 292002 win 28000 
0:0:5.379158400 2001:0:1:1::1.1024 > 2001:0:1:3::2.25: P 319002:320002(1000) ack 256002 win 28000 
0:0:5.390038400 2001:0:1:3::2.25 > 2001:0:1:1::1.1024: . ack 293002 win 28000 
0:0:5.390038400 2001:0:1:1::1.1024 > 2001:0:1:3::2.25: P 320002:321002(1000) ack 256002 win 28000 
0:0:5.400918400 2001:0:1:3::2.25 > 2001:0:1:1::1.1024: . ack 294002 win 28000 
0:0:5.400918400 2001:0:1:1::1.1024 > 2001:0:1:3::2.25: P 321002:322002(1000) ack 256002 win 28000 
0:0:5.411798400 2001:0:1:3::2.25 > 2001:0:1:1::1.1024: . ack 295002 win 28000 
0:0:5.411798400 2001:0:1:1::1.1024 > 2001:0:1:3::2.25: P 322002:323002(1000) ack 256002 win 28000 
0:0:5.422678400 2001:0:1:3::2.25 > 2001:0:1:1::1.1024: . ack 296002 win 28000 
0:0:5.422678400 2001:0:1:1::1.1024 > 2001:0:1:3::2.25: P 323002:324002(1000) ack 256002 win 28000 
0:0:5.433558400 2001:0:1:3::2.25 > 2001:0:1:1::1.1024: . ack 297002 win 28000 
0:0:5.433558400 2001:0:1:1::1.1024 > 2001:0:1:3::2.25: P 324002:325002(1000) ack 256002 win 28000 
0:0:5.444438400 2001:0:1:3::2.25 > 2001:0:1:1::1.1024: . ack 298002 win 28000 
0:0:5.444438400 2001:0:1:1::1.1024 > 2001:0:1:3::2.25: P 325002:326002(1000) ack 256002 win 28000 
0:0:5.455318400 2001:0:1:3::2.25 > 2001:0:1:1::1.1024: . ack 299002 win 28000 
0:0:5.455318400 2001:0:1:1::1.1024 > 2001:0:1:3::2.25: P 326002:327002(1000) ack 256002 win 28000 
0:0:5.466198400 2001:0:1:3::2.25 > 2001:0:1:1::1.1024: . ack 300002 win 28000 
0:0:5.466198400 2001:0:1:1::1.1024 > 2001:0:1:3::2.25: P 327002:328002(1000) ack 256002 win 28000 
0:0:5.477078400 2001:0:1:3::2.25 > 2001:0:1:1::1.1024: . ack 301002 win 28000 
0:0:5.477078400 2001:0:1:1::1.1024 > 2001:0:1:3::2.25: P 328002:329002(1000) ack 256002 win 28000 
0:0:5.487958400 2001:0:1:3::2.25 > 2001:0:1:1::1.1024: . ack 302002 win 28000 
0:0:5.487958400 2001:0:1:1::1.1024 > 2001:0:1:3::2.25: P 329002:330002(1000) ack 256002 win 28000 
0:0:5.498838400 2001:0:1:3::2.25 > 2001:0:1:1::1.1024: . ack 303002 win 28000 
0:0:5.498838400 2001:0:1:1::1.1024 > 2001:0:1:3::2.25: P 330002:331002(1000) ack 256002 win 28000 
0:0:5.509718400 2001:0:1:3::2.25 > 2001:0:1:1::1.1024: . ack 304002 win 28000 
0:0:5.509718400 2001:0:1:1::1.1024 > 2001:0:1:3::2.25: P 331002:332002(1000) ack 256002 win 28000 
0:0:5.520598400 2001:0:1:3::2.25 > 2001:0:1:1::1.1024: . ack 305002 win 28000 
0:0:5.520598400 2001:0:1:1::1.1024 > 2001:0:1:3::2.25: P 332002:333002(1000) ack 256002 win 28000 
0:0:5.531478400 2001:0:1:3::2.25 > 2001:0:1:1::1.1024: . ack 306002 win 28000 
0:0:5.531478400 2001:0:1:1::1.1024 > 2001:0:1:3::2.25: P 333002:334002(1000) ack 256002 win 28000 
0:0:5.542358400 2001:0:1:3::2.25 > 2001:0:1:1::1.1024: . ack 307002 win 28000 
0:0:5.542358400 2001:0:1:1::1.1024 > 2001:0:1:3::2.25: P 334002:335002(1000) ack 256002 win 28000 
0:0:5.553238400 2001:0:1:3::2.25 > 2001:0:1:1::1.1024: . ack 308002 win 28000 
0:0:5.553238400 2001:0:1:1::1.1024 > 2001:0:1:3::2.25: P 335002:336002(1000) ack 256002 win 28000 
0:0:5.564118400 2001:0:1:3::2.25 > 2001:0:1:1::1.1024: . ack 309002 win 28000 
0:0:5.564118400 2001:0:1:1::1.1024 > 2001:0:1:3::2.25: P 336002:337002(1000) ack 256002 win 28000 
0:0:5.574998400 2001:0:1:3::2.25 > 2001:0:1:1::1.1024: . ack 310002 win 28000 
0:0:5.574998400 2001:0:1:1::1.1024 > 2001:0:1:3::2.25: P 337002:338002(1000) ack 256002 win 28000 
0:0:5.585878400 2001:0:1:3::2.25 > 2001:0:1:1::1.1024: . ack 311002 win 28000 
0:0:5.585878400 2001:0:1:1::1.1024 > 2001:0:1:3::2.25: P 338002:339002(1000) ack 256002 win 28000 
0:0:5.596758400 2001:0:1:3::2.25 > 2001:0:1:1::1.1024: . ack 312002 win 28000 
0:0:5.596758400 2001:0:1:1::1.1024 > 2001:0:1:3::2.25: P 339002:340002(1000) ack 256002 win 28000 
0:0:5.607638400 2001:0:1:3::2.25 > 2001:0:1:1::1.1024: . ack 313002 win 28000 
0:0:5.607638400 2001:0:1:1::1.1024 > 2001:0:1:3::2.25: P 340002:341002(1000) ack 256002 win 28000 
0:0:5.618518400 2001:0:1:3::2.25 > 2001:0:1:1::1.1024: . ack 314002 win 28000 
0:0:5.618518400 2001:0:1:1::1.1024 > 2001:0:1:3::2.25: P 341002:342002(1000) ack 256002 win 28000 
0:0:5.629398400 2001:0:1:3::2.25 > 2001:0:1:1::1.1024: . ack 315002 win 28000 
0:0:5.629398400 2001:0:1:1::1.1024 > 2001:0:1:3::2.25: P 342002:343002(1000) ack 256002 win 28000 
0:0:5.640278400 2001:0:1:3::2.25 > 2001:0:1:1::1.1024: . ack 316002 win 28000 
0:0:5.640278400 2001:0:1:1::1.1024 > 2001:0:1:3::2.25: P 343002:344002(1000) ack 256002 win 28000 
0:0:5.651158400 2001:0:1:3::2.25 > 2001:0:1:1::1.1024: . ack 317002 win 28000 
0:0:5.651158400 2001:0:1:1::1.1024 > 2001:0:1:3::2.25: P 344002:345002(1000) ack 256002 win 28000 
0:0:5.662038400 2001:0:1:3::2.25 > 2001:0:1:1::1.1024: . ack 318002 win 28000 
0:0:5.662038400 2001:0:1:1::1.1024 > 2001:0:1:3::2.25: P 345002:346002(1000) ack 256002 win 28000 
0:0:5.672918400 2001:0:1:3::2.25 > 2001:0:1:1::1.1024: . ack 319002 win 28000 
0:0:5.672918400 2001:0:1:1::1.1024 > 2001:0:1:3::2.25: P 346002:347002(1000) ack 256002 win 28000 
0:0:5.683798400 2001:0:1:3::2.25 > 2001:0:1:1::1.1024: . ack 320002 win 28000 
0:0:5.683798400 2001:0:1:1::1.1024 > 2001:0:1:3::2.25: P 347002:348002(1000) ack 256002 win 28000 
0:0:5.694678400 2001:0:1:3::2.25 > 2001:0:1:1::1.1024: . ack 321002 win 28000 
0:0:5.694678400 2001:0:1:1::1.1024 > 2001:0:1:3::2.25: P 348002:349002(1000) ack 256002 win 28000 
0:0:5.705558400 2001:0:1:3::2.25 > 2001:0:1:1::1.1024: . ack 322002 win 28000 
0:0:5.705558400 2001:0:1:1::1.1024 > 2001:0:1:3::2.25: P 349002:350002(1000) ack 256002 win 28000 
0:0:5.716438400 2001:0:1:3::2.25 > 2001:0:1:1::1.1024: . ack 323002 win 28000 
0:0:5.716438400 2001:0:1:1::1.1024 > 2001:0:1:3::2.25: P 350002:351002(1000) ack 256002 win 28000 
0:0:5.727318400 2001:0:1:3::2.25 > 2001:0:1:1::1.1024: . ack 324002 win 28000 
0:0:5.727318400 2001:0:1:1::1.1024 > 2001:0:1:3::2.25: P 351002:352002(1000) ack 256002 win 28000 
0:0:5.738198400 2001:0:1:3::2.25 > 2001:0:1:1::1.1024: . ack 325002 win 28000 
0:0:5.738198400 2001:0:1:1::1.1024 > 2001:0:1:3::2.25: P 352002:353002(1000) ack 256002 win 28000 
0:0:5.749078400 2001:0:1:3::2.25 > 2001:0:1:1::1.1024: . ack 326002 win 28000 
0:0:5.749078400 2001:0:1:1::1.1024 > 2001:0:1:3::2.25: P 353002:354002(1000) ack 256002 win 28000 
0:0:5.759958400 2001:0:1:3::2.25 > 2001:0:1:1::1.1024: . ack 327002 win 28000 
0:0:5.759958400 2001:0:1:1::1.1024 > 2001:0:1:3::2.25: P 354002:355002(1000) ack 256002 win 28000 
0:0:5.770838400 2001:0:1:3::2.25 > 2001:0:1:1::1.1024: . ack 328002 win 28000 
0:0:5.770838400 2001:0:1:1::1.1024 > 2001:0:1:3::2.25: P 355002:356002(1000) ack 256002 win 28000 
0:0:5.781718400 2001:0:1:3::2.25 > 2001:0:1:1::1.1024: . ack 329002 win 28000 
0:0:5.781718400 2001:0:1:1::1.1024 > 2001:0:1:3::2.25: P 356002:357002(1000) ack 256002 win 28000 
0:0:5.792598400 2001:0:1:3::2.25 > 2001:0:1:1::1.1024: . ack 330002 win 28000 
0:0:5.792598400 2001:0:1:1::1.1024 > 2001:0:1:3::2.25: P 357002:358002(1000) ack 256002 win 28000 
0:0:5.803478400 2001:0:1:3::2.25 > 2001:0:1:1::1.1024: . ack 331002 win 28000 
0:0:5.803478400 2001:0:1:1::1.1024 > 2001:0:1:3::2.25: P 358002:359002(1000) ack 256002 win 28000 
0:0:5.814358400 2001:0:1:3::2.25 > 2001:0:1:1::1.1024: . ack 332002 win 28000 
0:0:5.814358400 2001:0:1:1::1.1024 > 2001:0:1:3::2.25: P 359002:360002(1000) ack 256002 win 28000 
0:0:5.825238400 2001:0:1:3::2.25 > 2001:0:1:1::1.1024: . ack 333002 win 28000 
0:0:5.825238400 2001:0:1:1::1.1024 > 2001:0:1:3::2.25: P 360002:361002(1000) ack 256002 win 28000 
0:0:5.836118400 2001:0:1:3::2.25 > 2001:0:1:1::1.1024: . ack 334002 win 28000 
0:0:5.836118400 2001:0:1:1::1.1024 > 2001:0:1:3::2.25: P 361002:362002(1000) ack 256002 win 28000 
0:0:5.846998400 2001:0:1:3::2.25 > 2001:0:1:1::1.1024: . ack 335002 win 28000 
0:0:5.846998400 2001:0:1:1::1.1024 > 2001:0:1:3::2.25: P 362002:363002(1000) ack 256002 win 28000 
0:0:5.857878400 2001:0:1:3::2.25 > 2001:0:1:1::1.1024: . ack 336002 win 28000 
0:0:5.857878400 2001:0:1:1::1.1024 > 2001:0:1:3::2.25: P 363002:364002(1000) ack 256002 win 28000 
0:0:5.868758400 2001:0:1:3::2.25 > 2001:0:1:1::1.1024: . ack 337002 win 28000 
0:0:5.868758400 2001:0:1:1::1.1024 > 2001:0:1:3::2.25: P 364002:365002(1000) ack 256002 win 28000 
0:0:5.879638400 2001:0:1:3::2.25 > 2001:0:1:1::1.1024: . ack 338002 win 28000 
0:0:5.879638400 2001:0:1:1::1.1024 > 2001:0:1:3::2.25: P 365002:366002(1000) ack 256002 win 28000 
0:0:5.890518400 2001:0:1:3::2.25 > 2001:0:1:1::1.1024: . ack 339002 win 28000 
0:0:5.890518400 2001:0:1:1::1.1024 > 2001:0:1:3::2.25: P 366002:367002(1000) ack 256002 win 28000 
0:0:5.901398400 2001:0:1:3::2.25 > 2001:0:1:1::1.1024: . ack 340002 win 28000 
0:0:5.901398400 2001:0:1:1::1.1024 > 2001:0:1:3::2.25: P 367002:368002(1000) ack 256002 win 28000 
0:0:5.912278400 2001:0:1:3::2.25 > 2001:0:1:1::1.1024: . ack 341002 win 28000 
0:0:5.912278400 2001:0:1:1::1.1024 > 2001:0:1:3::2.25: P 368002:369002(1000) ack 256002 win 28000 
0:0:5.923158400 2001:0:1:3::2.25 > 2001:0:1:1::1.1024: . ack 342002 win 28000 
0:0:5.923158400 2001:0:1:1::1.1024 > 2001:0:1:3::2.25: P 369002:370002(1000) ack 256002 win 28000 
0:0:5.934038400 2001:0:1:3::2.25 > 2001:0:1:1::1.1024: . ack 343002 win 28000 
0:0:5.934038400 2001:0:1:1::1.1024 > 2001:0:1:3::2.25: P 370002:371002(1000) ack 256002 win 28000 
0:0:5.944918400 2001:0:1:3::2.25 > 2001:0:1:1::1.1024: . ack 344002 win 28000 
0:0:5.944918400 2001:0:1:1::1.1024 > 2001:0:1:3::2.25: P 371002:372002(1000) ack 256002 win 28000 
0:0:5.955798400 2001:0:1:3::2.25 > 2001:0:1:1::1.1024: . ack 345002 win 28000 
0:0:5.955798400 2001:0:1:1::1.1024 > 2001:0:1:3::2.25: P 372002:373002(1000) ack 256002 win 28000 
0:0:5.966678400 2001:0:1:3::2.25 > 2001:0:1:1::1.1024: . ack 346002 win 28000 
0:0:5.966678400 2001:0:1:1::1.1024 > 2001:0:1:3::2.25: P 373002:374002(1000) ack 256002 win 28000 
0:0:5.977558400 2001:0:1:3::2.25 > 2001:0:1:1::1.1024: . ack 347002 win 28000 
0:0:5.977558400 2001:0:1:1::1.1024 > 2001:0:1:3::2.25: P 374002:375002(1000) ack 256002 win 28000 
0:0:5.988438400 2001:0:1:3::2.25 > 2001:0:1:1::1.1024: . ack 348002 win 28000 
0:0:5.988438400 2001:0:1:1::1.1024 > 2001:0:1:3::2.25: P 375002:376002(1000) ack 256002 win 28000 
0:0:5.999318400 2001:0:1:3::2.25 > 2001:0:1:1::1.1024: . ack 349002 win 28000 
0:0:5.999318400 2001:0:1:1::1.1024 > 2001:0:1:3::2.25: P 376002:377002(1000) ack 256002 win 28000 
