0:0:1.000000000 0.0.1.1.1024 > 0.0.3.2.25: S win 28000 <mss 1000>
0:0:1.211555200 0.0.3.2.25 > 0.0.1.1.1024: S ack 2 win 28000 <mss 1000>
0:0:1.211555200 0.0.1.1.1024 > 0.0.3.2.25: . ack 256002 win 28000 
0:0:1.211556200 0.0.1.1.1024 > 0.0.3.2.25: P 2:1002(1000) ack 256002 win 28000 
0:0:1.433878400 0.0.3.2.25 > 0.0.1.1.1024: . ack 1002 win 28000 
0:0:1.433878400 0.0.1.1.1024 > 0.0.3.2.25: . 1002:2002(1000) ack 256002 win 28000 
0:0:1.433878400 0.0.1.1.1024 > 0.0.3.2.25: . 2002:3002(1000) ack 256002 win 28000 
0:0:1.656147200 0.0.3.2.25 > 0.0.1.1.1024: . ack 2002 win 28000 
0:0:1.656147200 0.0.1.1.1024 > 0.0.3.2.25: . 3002:4002(1000) ack 256002 win 28000 
0:0:1.656147200 0.0.1.1.1024 > 0.0.3.2.25: . 4002:5002(1000) ack 256002 win 28000 
0:0:1.666827200 0.0.3.2.25 > 0.0.1.1.1024: . ack 3002 win 28000 
0:0:1.666827200 0.0.1.1.1024 > 0.0.3.2.25: . 5002:6002(1000) ack 256002 win 28000 
0:0:1.666827200 0.0.1.1.1024 > 0.0.3.2.25: . 6002:7002(1000) ack 256002 win 28000 
0:0:1.878416000 0.0.3.2.25 > 0.0.1.1.1024: . ack 4002 win 28000 
0:0:1.878416000 0.0.1.1.1024 > 0.0.3.2.25: . 7002:8002(1000) ack 256002 win 28000 
0:0:1.878416000 0.0.1.1.1024 > 0.0.3.2.25: . 8002:9002(1000) ack 256002 win 28000 
0:0:1.889096000 0.0.3.2.25 > 0.0.1.1.1024: . ack 5002 win 28000 
0:0:1.889096000 0.0.1.1.1024 > 0.0.3.2.25: . 9002:10002(1000) ack 256002 win 28000 
0:0:1.889096000 0.0.1.1.1024 > 0.0.3.2.25: . 10002:11002(1000) ack 256002 win 28000 
0:0:1.899776000 0.0.3.2.25 > 0.0.1.1.1024: . ack 6002 win 28000 
0:0:1.899776000 0.0.1.1.1024 > 0.0.3.2.25: . 11002:12002(1000) ack 256002 win 28000 
0:0:1.899776000 0.0.1.1.1024 > 0.0.3.2.25: . 12002:13002(1000) ack 256002 win 28000 
0:0:1.910456000 0.0.3.2.25 > 0.0.1.1.1024: . ack 7002 win 28000 
0:0:1.910456000 0.0.1.1.1024 > 0.0.3.2.25: . 13002:14002(1000) ack 256002 win 28000 
0:0:1.910456000 0.0.1.1.1024 > 0.0.3.2.25: . 14002:15002(1000) ack 256002 win 28000 
0:0:2.100684800 0.0.3.2.25 > 0.0.1.1.1024: . ack 8002 win 28000 
0:0:2.100684800 0.0.1.1.1024 > 0.0.3.2.25: . 15002:16002(1000) ack 256002 win 28000 
0:0:2.100684800 0.0.1.1.1024 > 0.0.3.2.25: . 16002:17002(1000) ack 256002 win 28000 
0:0:2.111364800 0.0.3.2.25 > 0.0.1.1.1024: . ack 9002 win 28000 
0:0:2.111364800 0.0.1.1.1024 > 0.0.3.2.25: . 17002:18002(1000) ack 256002 win 28000 
0:0:2.111364800 0.0.1.1.1024 > 0.0.3.2.25: . 18002:19002(1000) ack 256002 win 28000 
0:0:2.122044800 0.0.3.2.25 > 0.0.1.1.1024: . ack 10002 win 28000 
0:0:2.122044800 0.0.1.1.1024 > 0.0.3.2.25: . 19002:20002(1000) ack 256002 win 28000 
0:0:2.122044800 0.0.1.1.1024 > 0.0.3.2.25: . 20002:21002(1000) ack 256002 win 28000 
0:0:2.132724800 0.0.3.2.25 > 0.0.1.1.1024: . ack 11002 win 28000 
0:0:2.132724800 0.0.1.1.1024 > 0.0.3.2.25: . 21002:22002(1000) ack 256002 win 28000 
0:0:2.132724800 0.0.1.1.1024 > 0.0.3.2.25: . 22002:23002(1000) ack 256002 win 28000 
0:0:2.143404800 0.0.3.2.25 > 0.0.1.1.1024: . ack 12002 win 28000 
0:0:2.143404800 0.0.1.1.1024 > 0.0.3.2.25: . 23002:24002(1000) ack 256002 win 28000 
0:0:2.143404800 0.0.1.1.1024 > 0.0.3.2.25: . 24002:25002(1000) ack 256002 win 28000 
0:0:2.154084800 0.0.3.2.25 > 0.0.1.1.1024: . ack 13002 win 28000 
0:0:2.154084800 0.0.1.1.1024 > 0.0.3.2.25: . 25002:26002(1000) ack 256002 win 28000 
0:0:2.154084800 0.0.1.1.1024 > 0.0.3.2.25: . 26002:27002(1000) ack 256002 win 28000 
0:0:2.164764800 0.0.3.2.25 > 0.0.1.1.1024: . ack 14002 win 28000 
0:0:2.164764800 0.0.1.1.1024 > 0.0.3.2.25: . 27002:28002(1000) ack 256002 win 28000 
0:0:2.164764800 0.0.1.1.1024 > 0.0.3.2.25: . 28002:29002(1000) ack 256002 win 28000 
0:0:2.322953600 0.0.3.2.25 > 0.0.1.1.1024: . ack 14002 win 28000 
0:0:2.333633600 0.0.3.2.25 > 0.0.1.1.1024: . ack 14002 win 28000 
0:0:2.344313600 0.0.3.2.25 > 0.0.1.1.1024: . ack 14002 win 28000 
0:0:2.344313600 0.0.1.1.1024 > 0.0.3.2.25: . 14002:15002(1000) ack 256002 win 28000 
0:0:2.354993600 0.0.3.2.25 > 0.0.1.1.1024: . ack 14002 win 28000 
0:0:2.365673600 0.0.3.2.25 > 0.0.1.1.1024: . ack 14002 win 28000 
0:0:2.376353600 0.0.3.2.25 > 0.0.1.1.1024: . ack 14002 win 28000 
0:0:2.387033600 0.0.3.2.25 > 0.0.1.1.1024: . ack 14002 win 28000 
0:0:2.397713600 0.0.3.2.25 > 0.0.1.1.1024: . ack 14002 win 28000 
0:0:2.408393600 0.0.3.2.25 > 0.0.1.1.1024: . ack 14002 win 28000 
0:0:2.429753600 0.0.3.2.25 > 0.0.1.1.1024: . ack 14002 win 28000 
0:0:2.451113600 0.0.3.2.25 > 0.0.1.1.1024: . ack 14002 win 28000 
0:0:2.566582400 0.0.3.2.25 > 0.0.1.1.1024: . ack 24002 win 28000 
0:0:2.566582400 0.0.1.1.1024 > 0.0.3.2.25: . 24002:25002(1000) ack 256002 win 28000 
0:0:2.566582400 0.0.1.1.1024 > 0.0.3.2.25: . 25002:26002(1000) ack 256002 win 28000 
0:0:2.788851200 0.0.3.2.25 > 0.0.1.1.1024: . ack 26002 win 28000 
0:0:2.788851200 0.0.1.1.1024 > 0.0.3.2.25: . 26002:27002(1000) ack 256002 win 28000 
0:0:2.788851200 0.0.1.1.1024 > 0.0.3.2.25: . 27002:28002(1000) ack 256002 win 28000 
0:0:2.788851200 0.0.1.1.1024 > 0.0.3.2.25: . 28002:29002(1000) ack 256002 win 28000 
0:0:2.799531200 0.0.3.2.25 > 0.0.1.1.1024: . ack 26002 win 28000 
0:0:3.011120000 0.0.3.2.25 > 0.0.1.1.1024: . ack 28002 win 28000 
0:0:3.011120000 0.0.1.1.1024 > 0.0.3.2.25: . 29002:30002(1000) ack 256002 win 28000 
0:0:3.011120000 0.0.1.1.1024 > 0.0.3.2.25: . 30002:31002(1000) ack 256002 win 28000 
0:0:3.011120000 0.0.1.1.1024 > 0.0.3.2.25: . 31002:32002(1000) ack 256002 win 28000 
0:0:3.021800000 0.0.3.2.25 > 0.0.1.1.1024: . ack 28002 win 28000 
0:0:3.032480000 0.0.3.2.25 > 0.0.1.1.1024: . ack 29002 win 28000 
0:0:3.032480000 0.0.1.1.1024 > 0.0.3.2.25: . 32002:33002(1000) ack 256002 win 28000 
0:0:3.032480000 0.0.1.1.1024 > 0.0.3.2.25: . 33002:34002(1000) ack 256002 win 28000 
0:0:3.233388800 0.0.3.2.25 > 0.0.1.1.1024: . ack 30002 win 28000 
0:0:3.233388800 0.0.1.1.1024 > 0.0.3.2.25: . 34002:35002(1000) ack 256002 win 28000 
0:0:3.233388800 0.0.1.1.1024 > 0.0.3.2.25: . 35002:36002(1000) ack 256002 win 28000 
0:0:3.244068800 0.0.3.2.25 > 0.0.1.1.1024: . ack 31002 win 28000 
0:0:3.244068800 0.0.1.1.1024 > 0.0.3.2.25: . 36002:37002(1000) ack 256002 win 28000 
0:0:3.244068800 0.0.1.1.1024 > 0.0.3.2.25: . 37002:38002(1000) ack 256002 win 28000 
0:0:3.254748800 0.0.3.2.25 > 0.0.1.1.1024: . ack 32002 win 28000 
0:0:3.254748800 0.0.1.1.1024 > 0.0.3.2.25: . 38002:39002(1000) ack 256002 win 28000 
0:0:3.254748800 0.0.1.1.1024 > 0.0.3.2.25: . 39002:40002(1000) ack 256002 win 28000 
0:0:3.265428800 0.0.3.2.25 > 0.0.1.1.1024: . ack 33002 win 28000 
0:0:3.265428800 0.0.1.1.1024 > 0.0.3.2.25: . 40002:41002(1000) ack 256002 win 28000 
0:0:3.276108800 0.0.3.2.25 > 0.0.1.1.1024: . ack 34002 win 28000 
0:0:3.276108800 0.0.1.1.1024 > 0.0.3.2.25: . 41002:42002(1000) ack 256002 win 28000 
0:0:3.455657600 0.0.3.2.25 > 0.0.1.1.1024: . ack 35002 win 28000 
0:0:3.455657600 0.0.1.1.1024 > 0.0.3.2.25: . 42002:43002(1000) ack 256002 win 28000 
0:0:3.466337600 0.0.3.2.25 > 0.0.1.1.1024: . ack 36002 win 28000 
0:0:3.466337600 0.0.1.1.1024 > 0.0.3.2.25: . 43002:44002(1000) ack 256002 win 28000 
0:0:3.477017600 0.0.3.2.25 > 0.0.1.1.1024: . ack 37002 win 28000 
0:0:3.477017600 0.0.1.1.1024 > 0.0.3.2.25: . 44002:45002(1000) ack 256002 win 28000 
0:0:3.487697600 0.0.3.2.25 > 0.0.1.1.1024: . ack 38002 win 28000 
0:0:3.487697600 0.0.1.1.1024 > 0.0.3.2.25: . 45002:46002(1000) ack 256002 win 28000 
0:0:3.498377600 0.0.3.2.25 > 0.0.1.1.1024: . ack 39002 win 28000 
0:0:3.498377600 0.0.1.1.1024 > 0.0.3.2.25: . 46002:47002(1000) ack 256002 win 28000 
0:0:3.509057600 0.0.3.2.25 > 0.0.1.1.1024: . ack 40002 win 28000 
0:0:3.509057600 0.0.1.1.1024 > 0.0.3.2.25: . 47002:48002(1000) ack 256002 win 28000 
0:0:3.519737600 0.0.3.2.25 > 0.0.1.1.1024: . ack 41002 win 28000 
0:0:3.519737600 0.0.1.1.1024 > 0.0.3.2.25: . 48002:49002(1000) ack 256002 win 28000 
0:0:3.519737600 0.0.1.1.1024 > 0.0.3.2.25: . 49002:50002(1000) ack 256002 win 28000 
0:0:3.530417600 0.0.3.2.25 > 0.0.1.1.1024: . ack 42002 win 28000 
0:0:3.530417600 0.0.1.1.1024 > 0.0.3.2.25: . 50002:51002(1000) ack 256002 win 28000 
0:0:3.677926400 0.0.3.2.25 > 0.0.1.1.1024: . ack 43002 win 28000 
0:0:3.677926400 0.0.1.1.1024 > 0.0.3.2.25: . 51002:52002(1000) ack 256002 win 28000 
0:0:3.688606400 0.0.3.2.25 > 0.0.1.1.1024: . ack 44002 win 28000 
0:0:3.688606400 0.0.1.1.1024 > 0.0.3.2.25: . 52002:53002(1000) ack 256002 win 28000 
0:0:3.699286400 0.0.3.2.25 > 0.0.1.1.1024: . ack 45002 win 28000 
0:0:3.699286400 0.0.1.1.1024 > 0.0.3.2.25: . 53002:54002(1000) ack 256002 win 28000 
0:0:3.709966400 0.0.3.2.25 > 0.0.1.1.1024: . ack 46002 win 28000 
0:0:3.709966400 0.0.1.1.1024 > 0.0.3.2.25: . 54002:55002(1000) ack 256002 win 28000 
0:0:3.720646400 0.0.3.2.25 > 0.0.1.1.1024: . ack 47002 win 28000 
0:0:3.720646400 0.0.1.1.1024 > 0.0.3.2.25: . 55002:56002(1000) ack 256002 win 28000 
0:0:3.731326400 0.0.3.2.25 > 0.0.1.1.1024: . ack 48002 win 28000 
0:0:3.731326400 0.0.1.1.1024 > 0.0.3.2.25: . 56002:57002(1000) ack 256002 win 28000 
0:0:3.742006400 0.0.3.2.25 > 0.0.1.1.1024: . ack 49002 win 28000 
0:0:3.742006400 0.0.1.1.1024 > 0.0.3.2.25: . 57002:58002(1000) ack 256002 win 28000 
0:0:3.752686400 0.0.3.2.25 > 0.0.1.1.1024: . ack 50002 win 28000 
0:0:3.752686400 0.0.1.1.1024 > 0.0.3.2.25: . 58002:59002(1000) ack 256002 win 28000 
0:0:3.752686400 0.0.1.1.1024 > 0.0.3.2.25: . 59002:60002(1000) ack 256002 win 28000 
0:0:3.763366400 0.0.3.2.25 > 0.0.1.1.1024: . ack 51002 win 28000 
0:0:3.763366400 0.0.1.1.1024 > 0.0.3.2.25: . 60002:61002(1000) ack 256002 win 28000 
0:0:3.900195200 0.0.3.2.25 > 0.0.1.1.1024: . ack 52002 win 28000 
0:0:3.900195200 0.0.1.1.1024 > 0.0.3.2.25: . 61002:62002(1000) ack 256002 win 28000 
0:0:3.910875200 0.0.3.2.25 > 0.0.1.1.1024: . ack 53002 win 28000 
0:0:3.910875200 0.0.1.1.1024 > 0.0.3.2.25: . 62002:63002(1000) ack 256002 win 28000 
0:0:3.921555200 0.0.3.2.25 > 0.0.1.1.1024: . ack 54002 win 28000 
0:0:3.921555200 0.0.1.1.1024 > 0.0.3.2.25: . 63002:64002(1000) ack 256002 win 28000 
0:0:3.932235200 0.0.3.2.25 > 0.0.1.1.1024: . ack 55002 win 28000 
0:0:3.932235200 0.0.1.1.1024 > 0.0.3.2.25: . 64002:65002(1000) ack 256002 win 28000 
0:0:3.942915200 0.0.3.2.25 > 0.0.1.1.1024: . ack 56002 win 28000 
0:0:3.942915200 0.0.1.1.1024 > 0.0.3.2.25: . 65002:66002(1000) ack 256002 win 28000 
0:0:3.953595200 0.0.3.2.25 > 0.0.1.1.1024: . ack 57002 win 28000 
0:0:3.953595200 0.0.1.1.1024 > 0.0.3.2.25: . 66002:67002(1000) ack 256002 win 28000 
0:0:3.964275200 0.0.3.2.25 > 0.0.1.1.1024: . ack 58002 win 28000 
0:0:3.964275200 0.0.1.1.1024 > 0.0.3.2.25: . 67002:68002(1000) ack 256002 win 28000 
0:0:3.974955200 0.0.3.2.25 > 0.0.1.1.1024: . ack 59002 win 28000 
0:0:3.974955200 0.0.1.1.1024 > 0.0.3.2.25: . 68002:69002(1000) ack 256002 win 28000 
0:0:3.985635200 0.0.3.2.25 > 0.0.1.1.1024: . ack 60002 win 28000 
0:0:3.985635200 0.0.1.1.1024 > 0.0.3.2.25: . 69002:70002(1000) ack 256002 win 28000 
0:0:3.996315200 0.0.3.2.25 > 0.0.1.1.1024: . ack 61002 win 28000 
0:0:3.996315200 0.0.1.1.1024 > 0.0.3.2.25: . 70002:71002(1000) ack 256002 win 28000 
0:0:3.996315200 0.0.1.1.1024 > 0.0.3.2.25: . 71002:72002(1000) ack 256002 win 28000 
0:0:4.122464000 0.0.3.2.25 > 0.0.1.1.1024: . ack 62002 win 28000 
0:0:4.122464000 0.0.1.1.1024 > 0.0.3.2.25: . 72002:73002(1000) ack 256002 win 28000 
0:0:4.133144000 0.0.3.2.25 > 0.0.1.1.1024: . ack 63002 win 28000 
0:0:4.133144000 0.0.1.1.1024 > 0.0.3.2.25: . 73002:74002(1000) ack 256002 win 28000 
0:0:4.143824000 0.0.3.2.25 > 0.0.1.1.1024: . ack 64002 win 28000 
0:0:4.143824000 0.0.1.1.1024 > 0.0.3.2.25: . 74002:75002(1000) ack 256002 win 28000 
0:0:4.154504000 0.0.3.2.25 > 0.0.1.1.1024: . ack 65002 win 28000 
0:0:4.154504000 0.0.1.1.1024 > 0.0.3.2.25: . 75002:76002(1000) ack 256002 win 28000 
0:0:4.165184000 0.0.3.2.25 > 0.0.1.1.1024: . ack 66002 win 28000 
0:0:4.165184000 0.0.1.1.1024 > 0.0.3.2.25: . 76002:77002(1000) ack 256002 win 28000 
0:0:4.175864000 0.0.3.2.25 > 0.0.1.1.1024: . ack 67002 win 28000 
0:0:4.175864000 0.0.1.1.1024 > 0.0.3.2.25: . 77002:78002(1000) ack 256002 win 28000 
0:0:4.186544000 0.0.3.2.25 > 0.0.1.1.1024: . ack 68002 win 28000 
0:0:4.186544000 0.0.1.1.1024 > 0.0.3.2.25: . 78002:79002(1000) ack 256002 win 28000 
0:0:4.197224000 0.0.3.2.25 > 0.0.1.1.1024: . ack 69002 win 28000 
0:0:4.197224000 0.0.1.1.1024 > 0.0.3.2.25: . 79002:80002(1000) ack 256002 win 28000 
0:0:4.207904000 0.0.3.2.25 > 0.0.1.1.1024: . ack 70002 win 28000 
0:0:4.207904000 0.0.1.1.1024 > 0.0.3.2.25: . 80002:81002(1000) ack 256002 win 28000 
0:0:4.218584000 0.0.3.2.25 > 0.0.1.1.1024: . ack 71002 win 28000 
0:0:4.218584000 0.0.1.1.1024 > 0.0.3.2.25: . 81002:82002(1000) ack 256002 win 28000 
0:0:4.229264000 0.0.3.2.25 > 0.0.1.1.1024: . ack 72002 win 28000 
0:0:4.229264000 0.0.1.1.1024 > 0.0.3.2.25: . 82002:83002(1000) ack 256002 win 28000 
0:0:4.229264000 0.0.1.1.1024 > 0.0.3.2.25: . 83002:84002(1000) ack 256002 win 28000 
0:0:4.344732800 0.0.3.2.25 > 0.0.1.1.1024: . ack 73002 win 28000 
0:0:4.344732800 0.0.1.1.1024 > 0.0.3.2.25: . 84002:85002(1000) ack 256002 win 28000 
0:0:4.355412800 0.0.3.2.25 > 0.0.1.1.1024: . ack 74002 win 28000 
0:0:4.355412800 0.0.1.1.1024 > 0.0.3.2.25: . 85002:86002(1000) ack 256002 win 28000 
0:0:4.366092800 0.0.3.2.25 > 0.0.1.1.1024: . ack 75002 win 28000 
0:0:4.366092800 0.0.1.1.1024 > 0.0.3.2.25: . 86002:87002(1000) ack 256002 win 28000 
0:0:4.376772800 0.0.3.2.25 > 0.0.1.1.1024: . ack 76002 win 28000 
0:0:4.376772800 0.0.1.1.1024 > 0.0.3.2.25: . 87002:88002(1000) ack 256002 win 28000 
0:0:4.387452800 0.0.3.2.25 > 0.0.1.1.1024: . ack 77002 win 28000 
0:0:4.387452800 0.0.1.1.1024 > 0.0.3.2.25: . 88002:89002(1000) ack 256002 win 28000 
0:0:4.398132800 0.0.3.2.25 > 0.0.1.1.1024: . ack 78002 win 28000 
0:0:4.398132800 0.0.1.1.1024 > 0.0.3.2.25: . 89002:90002(1000) ack 256002 win 28000 
0:0:4.408812800 0.0.3.2.25 > 0.0.1.1.1024: . ack 79002 win 28000 
0:0:4.408812800 0.0.1.1.1024 > 0.0.3.2.25: . 90002:91002(1000) ack 256002 win 28000 
0:0:4.419492800 0.0.3.2.25 > 0.0.1.1.1024: . ack 80002 win 28000 
0:0:4.419492800 0.0.1.1.1024 > 0.0.3.2.25: . 91002:92002(1000) ack 256002 win 28000 
0:0:4.430172800 0.0.3.2.25 > 0.0.1.1.1024: . ack 81002 win 28000 
0:0:4.430172800 0.0.1.1.1024 > 0.0.3.2.25: . 92002:93002(1000) ack 256002 win 28000 
0:0:4.440852800 0.0.3.2.25 > 0.0.1.1.1024: . ack 82002 win 28000 
0:0:4.440852800 0.0.1.1.1024 > 0.0.3.2.25: . 93002:94002(1000) ack 256002 win 28000 
0:0:4.451532800 0.0.3.2.25 > 0.0.1.1.1024: . ack 83002 win 28000 
0:0:4.451532800 0.0.1.1.1024 > 0.0.3.2.25: . 94002:95002(1000) ack 256002 win 28000 
0:0:4.462212800 0.0.3.2.25 > 0.0.1.1.1024: . ack 84002 win 28000 
0:0:4.462212800 0.0.1.1.1024 > 0.0.3.2.25: . 95002:96002(1000) ack 256002 win 28000 
0:0:4.567001600 0.0.3.2.25 > 0.0.1.1.1024: . ack 85002 win 28000 
0:0:4.567001600 0.0.1.1.1024 > 0.0.3.2.25: . 96002:97002(1000) ack 256002 win 28000 
0:0:4.567001600 0.0.1.1.1024 > 0.0.3.2.25: . 97002:98002(1000) ack 256002 win 28000 
0:0:4.577681600 0.0.3.2.25 > 0.0.1.1.1024: . ack 86002 win 28000 
0:0:4.577681600 0.0.1.1.1024 > 0.0.3.2.25: . 98002:99002(1000) ack 256002 win 28000 
0:0:4.588361600 0.0.3.2.25 > 0.0.1.1.1024: . ack 87002 win 28000 
0:0:4.588361600 0.0.1.1.1024 > 0.0.3.2.25: . 99002:100002(1000) ack 256002 win 28000 
0:0:4.599041600 0.0.3.2.25 > 0.0.1.1.1024: . ack 88002 win 28000 
0:0:4.599041600 0.0.1.1.1024 > 0.0.3.2.25: . 100002:101002(1000) ack 256002 win 28000 
0:0:4.609721600 0.0.3.2.25 > 0.0.1.1.1024: . ack 89002 win 28000 
0:0:4.609721600 0.0.1.1.1024 > 0.0.3.2.25: . 101002:102002(1000) ack 256002 win 28000 
0:0:4.620401600 0.0.3.2.25 > 0.0.1.1.1024: . ack 90002 win 28000 
0:0:4.620401600 0.0.1.1.1024 > 0.0.3.2.25: . 102002:103002(1000) ack 256002 win 28000 
0:0:4.631081600 0.0.3.2.25 > 0.0.1.1.1024: . ack 91002 win 28000 
0:0:4.631081600 0.0.1.1.1024 > 0.0.3.2.25: . 103002:104002(1000) ack 256002 win 28000 
0:0:4.641761600 0.0.3.2.25 > 0.0.1.1.1024: . ack 92002 win 28000 
0:0:4.641761600 0.0.1.1.1024 > 0.0.3.2.25: . 104002:105002(1000) ack 256002 win 28000 
0:0:4.652441600 0.0.3.2.25 > 0.0.1.1.1024: . ack 93002 win 28000 
0:0:4.652441600 0.0.1.1.1024 > 0.0.3.2.25: . 105002:106002(1000) ack 256002 win 28000 
0:0:4.663121600 0.0.3.2.25 > 0.0.1.1.1024: . ack 94002 win 28000 
0:0:4.663121600 0.0.1.1.1024 > 0.0.3.2.25: . 106002:107002(1000) ack 256002 win 28000 
0:0:4.673801600 0.0.3.2.25 > 0.0.1.1.1024: . ack 95002 win 28000 
0:0:4.673801600 0.0.1.1.1024 > 0.0.3.2.25: . 107002:108002(1000) ack 256002 win 28000 
0:0:4.684481600 0.0.3.2.25 > 0.0.1.1.1024: . ack 96002 win 28000 
0:0:4.684481600 0.0.1.1.1024 > 0.0.3.2.25: . 108002:109002(1000) ack 256002 win 28000 
0:0:4.789270400 0.0.3.2.25 > 0.0.1.1.1024: . ack 97002 win 28000 
0:0:4.789270400 0.0.1.1.1024 > 0.0.3.2.25: . 109002:110002(1000) ack 256002 win 28000 
0:0:4.799950400 0.0.3.2.25 > 0.0.1.1.1024: . ack 98002 win 28000 
0:0:4.799950400 0.0.1.1.1024 > 0.0.3.2.25: . 110002:111002(1000) ack 256002 win 28000 
0:0:4.810630400 0.0.3.2.25 > 0.0.1.1.1024: . ack 99002 win 28000 
0:0:4.810630400 0.0.1.1.1024 > 0.0.3.2.25: . 111002:112002(1000) ack 256002 win 28000 
0:0:4.810630400 0.0.1.1.1024 > 0.0.3.2.25: . 112002:113002(1000) ack 256002 win 28000 
0:0:4.821310400 0.0.3.2.25 > 0.0.1.1.1024: . ack 100002 win 28000 
0:0:4.821310400 0.0.1.1.1024 > 0.0.3.2.25: . 113002:114002(1000) ack 256002 win 28000 
0:0:4.831990400 0.0.3.2.25 > 0.0.1.1.1024: . ack 101002 win 28000 
0:0:4.831990400 0.0.1.1.1024 > 0.0.3.2.25: . 114002:115002(1000) ack 256002 win 28000 
0:0:4.842670400 0.0.3.2.25 > 0.0.1.1.1024: . ack 102002 win 28000 
0:0:4.842670400 0.0.1.1.1024 > 0.0.3.2.25: . 115002:116002(1000) ack 256002 win 28000 
0:0:4.853350400 0.0.3.2.25 > 0.0.1.1.1024: . ack 103002 win 28000 
0:0:4.853350400 0.0.1.1.1024 > 0.0.3.2.25: . 116002:117002(1000) ack 256002 win 28000 
0:0:4.864030400 0.0.3.2.25 > 0.0.1.1.1024: . ack 104002 win 28000 
0:0:4.864030400 0.0.1.1.1024 > 0.0.3.2.25: . 117002:118002(1000) ack 256002 win 28000 
0:0:4.874710400 0.0.3.2.25 > 0.0.1.1.1024: . ack 105002 win 28000 
0:0:4.874710400 0.0.1.1.1024 > 0.0.3.2.25: . 118002:119002(1000) ack 256002 win 28000 
0:0:4.885390400 0.0.3.2.25 > 0.0.1.1.1024: . ack 106002 win 28000 
0:0:4.885390400 0.0.1.1.1024 > 0.0.3.2.25: . 119002:120002(1000) ack 256002 win 28000 
0:0:4.896070400 0.0.3.2.25 > 0.0.1.1.1024: . ack 107002 win 28000 
0:0:4.896070400 0.0.1.1.1024 > 0.0.3.2.25: . 120002:121002(1000) ack 256002 win 28000 
0:0:4.906750400 0.0.3.2.25 > 0.0.1.1.1024: . ack 108002 win 28000 
0:0:4.906750400 0.0.1.1.1024 > 0.0.3.2.25: . 121002:122002(1000) ack 256002 win 28000 
0:0:4.917430400 0.0.3.2.25 > 0.0.1.1.1024: . ack 109002 win 28000 
0:0:4.917430400 0.0.1.1.1024 > 0.0.3.2.25: . 122002:123002(1000) ack 256002 win 28000 
0:0:5.011539200 0.0.3.2.25 > 0.0.1.1.1024: . ack 110002 win 28000 
0:0:5.011539200 0.0.1.1.1024 > 0.0.3.2.25: . 123002:124002(1000) ack 256002 win 28000 
0:0:5.022219200 0.0.3.2.25 > 0.0.1.1.1024: . ack 111002 win 28000 
0:0:5.022219200 0.0.1.1.1024 > 0.0.3.2.25: . 124002:125002(1000) ack 256002 win 28000 
0:0:5.032899200 0.0.3.2.25 > 0.0.1.1.1024: . ack 112002 win 28000 
0:0:5.032899200 0.0.1.1.1024 > 0.0.3.2.25: . 125002:126002(1000) ack 256002 win 28000 
0:0:5.043579200 0.0.3.2.25 > 0.0.1.1.1024: . ack 113002 win 28000 
0:0:5.043579200 0.0.1.1.1024 > 0.0.3.2.25: . 126002:127002(1000) ack 256002 win 28000 
0:0:5.043579200 0.0.1.1.1024 > 0.0.3.2.25: . 127002:128002(1000) ack 256002 win 28000 
0:0:5.054259200 0.0.3.2.25 > 0.0.1.1.1024: . ack 114002 win 28000 
0:0:5.054259200 0.0.1.1.1024 > 0.0.3.2.25: . 128002:129002(1000) ack 256002 win 28000 
0:0:5.064939200 0.0.3.2.25 > 0.0.1.1.1024: . ack 115002 win 28000 
0:0:5.064939200 0.0.1.1.1024 > 0.0.3.2.25: . 129002:130002(1000) ack 256002 win 28000 
0:0:5.075619200 0.0.3.2.25 > 0.0.1.1.1024: . ack 116002 win 28000 
0:0:5.075619200 0.0.1.1.1024 > 0.0.3.2.25: . 130002:131002(1000) ack 256002 win 28000 
0:0:5.086299200 0.0.3.2.25 > 0.0.1.1.1024: . ack 117002 win 28000 
0:0:5.086299200 0.0.1.1.1024 > 0.0.3.2.25: . 131002:132002(1000) ack 256002 win 28000 
0:0:5.096979200 0.0.3.2.25 > 0.0.1.1.1024: . ack 118002 win 28000 
0:0:5.096979200 0.0.1.1.1024 > 0.0.3.2.25: . 132002:133002(1000) ack 256002 win 28000 
0:0:5.107659200 0.0.3.2.25 > 0.0.1.1.1024: . ack 119002 win 28000 
0:0:5.107659200 0.0.1.1.1024 > 0.0.3.2.25: . 133002:134002(1000) ack 256002 win 28000 
0:0:5.118339200 0.0.3.2.25 > 0.0.1.1.1024: . ack 120002 win 28000 
0:0:5.118339200 0.0.1.1.1024 > 0.0.3.2.25: . 134002:135002(1000) ack 256002 win 28000 
0:0:5.129019200 0.0.3.2.25 > 0.0.1.1.1024: . ack 121002 win 28000 
0:0:5.129019200 0.0.1.1.1024 > 0.0.3.2.25: . 135002:136002(1000) ack 256002 win 28000 
0:0:5.139699200 0.0.3.2.25 > 0.0.1.1.1024: . ack 122002 win 28000 
0:0:5.139699200 0.0.1.1.1024 > 0.0.3.2.25: . 136002:137002(1000) ack 256002 win 28000 
0:0:5.150379200 0.0.3.2.25 > 0.0.1.1.1024: . ack 123002 win 28000 
0:0:5.150379200 0.0.1.1.1024 > 0.0.3.2.25: . 137002:138002(1000) ack 256002 win 28000 
0:0:5.233808000 0.0.3.2.25 > 0.0.1.1.1024: . ack 124002 win 28000 
0:0:5.233808000 0.0.1.1.1024 > 0.0.3.2.25: . 138002:139002(1000) ack 256002 win 28000 
0:0:5.244488000 0.0.3.2.25 > 0.0.1.1.1024: . ack 125002 win 28000 
0:0:5.244488000 0.0.1.1.1024 > 0.0.3.2.25: . 139002:140002(1000) ack 256002 win 28000 
0:0:5.255168000 0.0.3.2.25 > 0.0.1.1.1024: . ack 126002 win 28000 
0:0:5.255168000 0.0.1.1.1024 > 0.0.3.2.25: . 140002:141002(1000) ack 256002 win 28000 
0:0:5.265848000 0.0.3.2.25 > 0.0.1.1.1024: . ack 127002 win 28000 
0:0:5.265848000 0.0.1.1.1024 > 0.0.3.2.25: . 141002:142002(1000) ack 256002 win 28000 
0:0:5.276528000 0.0.3.2.25 > 0.0.1.1.1024: . ack 128002 win 28000 
0:0:5.276528000 0.0.1.1.1024 > 0.0.3.2.25: . 142002:143002(1000) ack 256002 win 28000 
0:0:5.287208000 0.0.3.2.25 > 0.0.1.1.1024: . ack 129002 win 28000 
0:0:5.287208000 0.0.1.1.1024 > 0.0.3.2.25: . 143002:144002(1000) ack 256002 win 28000 
0:0:5.287208000 0.0.1.1.1024 > 0.0.3.2.25: . 144002:145002(1000) ack 256002 win 28000 
0:0:5.297888000 0.0.3.2.25 > 0.0.1.1.1024: . ack 130002 win 28000 
0:0:5.297888000 0.0.1.1.1024 > 0.0.3.2.25: . 145002:146002(1000) ack 256002 win 28000 
0:0:5.308568000 0.0.3.2.25 > 0.0.1.1.1024: . ack 131002 win 28000 
0:0:5.308568000 0.0.1.1.1024 > 0.0.3.2.25: . 146002:147002(1000) ack 256002 win 28000 
0:0:5.319248000 0.0.3.2.25 > 0.0.1.1.1024: . ack 132002 win 28000 
0:0:5.319248000 0.0.1.1.1024 > 0.0.3.2.25: . 147002:148002(1000) ack 256002 win 28000 
0:0:5.329928000 0.0.3.2.25 > 0.0.1.1.1024: . ack 133002 win 28000 
0:0:5.329928000 0.0.1.1.1024 > 0.0.3.2.25: . 148002:149002(1000) ack 256002 win 28000 
0:0:5.340608000 0.0.3.2.25 > 0.0.1.1.1024: . ack 134002 win 28000 
0:0:5.340608000 0.0.1.1.1024 > 0.0.3.2.25: . 149002:150002(1000) ack 256002 win 28000 
0:0:5.351288000 0.0.3.2.25 > 0.0.1.1.1024: . ack 135002 win 28000 
0:0:5.351288000 0.0.1.1.1024 > 0.0.3.2.25: . 150002:151002(1000) ack 256002 win 28000 
0:0:5.361968000 0.0.3.2.25 > 0.0.1.1.1024: . ack 136002 win 28000 
0:0:5.361968000 0.0.1.1.1024 > 0.0.3.2.25: . 151002:152002(1000) ack 256002 win 28000 
0:0:5.372648000 0.0.3.2.25 > 0.0.1.1.1024: . ack 137002 win 28000 
0:0:5.372648000 0.0.1.1.1024 > 0.0.3.2.25: . 152002:153002(1000) ack 256002 win 28000 
0:0:5.383328000 0.0.3.2.25 > 0.0.1.1.1024: . ack 138002 win 28000 
0:0:5.383328000 0.0.1.1.1024 > 0.0.3.2.25: . 153002:154002(1000) ack 256002 win 28000 
0:0:5.456076800 0.0.3.2.25 > 0.0.1.1.1024: . ack 139002 win 28000 
0:0:5.456076800 0.0.1.1.1024 > 0.0.3.2.25: . 154002:155002(1000) ack 256002 win 28000 
0:0:5.466756800 0.0.3.2.25 > 0.0.1.1.1024: . ack 140002 win 28000 
0:0:5.466756800 0.0.1.1.1024 > 0.0.3.2.25: . 155002:156002(1000) ack 256002 win 28000 
0:0:5.477436800 0.0.3.2.25 > 0.0.1.1.1024: . ack 141002 win 28000 
0:0:5.477436800 0.0.1.1.1024 > 0.0.3.2.25: . 156002:157002(1000) ack 256002 win 28000 
0:0:5.488116800 0.0.3.2.25 > 0.0.1.1.1024: . ack 142002 win 28000 
0:0:5.488116800 0.0.1.1.1024 > 0.0.3.2.25: . 157002:158002(1000) ack 256002 win 28000 
0:0:5.498796800 0.0.3.2.25 > 0.0.1.1.1024: . ack 143002 win 28000 
0:0:5.498796800 0.0.1.1.1024 > 0.0.3.2.25: . 158002:159002(1000) ack 256002 win 28000 
0:0:5.509476800 0.0.3.2.25 > 0.0.1.1.1024: . ack 144002 win 28000 
0:0:5.509476800 0.0.1.1.1024 > 0.0.3.2.25: . 159002:160002(1000) ack 256002 win 28000 
0:0:5.520156800 0.0.3.2.25 > 0.0.1.1.1024: . ack 145002 win 28000 
0:0:5.520156800 0.0.1.1.1024 > 0.0.3.2.25: . 160002:161002(1000) ack 256002 win 28000 
0:0:5.520156800 0.0.1.1.1024 > 0.0.3.2.25: . 161002:162002(1000) ack 256002 win 28000 
0:0:5.530836800 0.0.3.2.25 > 0.0.1.1.1024: . ack 146002 win 28000 
0:0:5.530836800 0.0.1.1.1024 > 0.0.3.2.25: . 162002:163002(1000) ack 256002 win 28000 
0:0:5.541516800 0.0.3.2.25 > 0.0.1.1.1024: . ack 147002 win 28000 
0:0:5.541516800 0.0.1.1.1024 > 0.0.3.2.25: . 163002:164002(1000) ack 256002 win 28000 
0:0:5.552196800 0.0.3.2.25 > 0.0.1.1.1024: . ack 148002 win 28000 
0:0:5.552196800 0.0.1.1.1024 > 0.0.3.2.25: . 164002:165002(1000) ack 256002 win 28000 
0:0:5.562876800 0.0.3.2.25 > 0.0.1.1.1024: . ack 149002 win 28000 
0:0:5.562876800 0.0.1.1.1024 > 0.0.3.2.25: . 165002:166002(1000) ack 256002 win 28000 
0:0:5.573556800 0.0.3.2.25 > 0.0.1.1.1024: . ack 150002 win 28000 
0:0:5.573556800 0.0.1.1.1024 > 0.0.3.2.25: . 166002:167002(1000) ack 256002 win 28000 
0:0:5.584236800 0.0.3.2.25 > 0.0.1.1.1024: . ack 151002 win 28000 
0:0:5.584236800 0.0.1.1.1024 > 0.0.3.2.25: . 167002:168002(1000) ack 256002 win 28000 
0:0:5.594916800 0.0.3.2.25 > 0.0.1.1.1024: . ack 152002 win 28000 
0:0:5.594916800 0.0.1.1.1024 > 0.0.3.2.25: . 168002:169002(1000) ack 256002 win 28000 
0:0:5.605596800 0.0.3.2.25 > 0.0.1.1.1024: . ack 153002 win 28000 
0:0:5.605596800 0.0.1.1.1024 > 0.0.3.2.25: . 169002:170002(1000) ack 256002 win 28000 
0:0:5.616276800 0.0.3.2.25 > 0.0.1.1.1024: . ack 154002 win 28000 
0:0:5.616276800 0.0.1.1.1024 > 0.0.3.2.25: . 170002:171002(1000) ack 256002 win 28000 
0:0:5.678345600 0.0.3.2.25 > 0.0.1.1.1024: . ack 155002 win 28000 
0:0:5.678345600 0.0.1.1.1024 > 0.0.3.2.25: . 171002:172002(1000) ack 256002 win 28000 
0:0:5.689025600 0.0.3.2.25 > 0.0.1.1.1024: . ack 156002 win 28000 
0:0:5.689025600 0.0.1.1.1024 > 0.0.3.2.25: . 172002:173002(1000) ack 256002 win 28000 
0:0:5.699705600 0.0.3.2.25 > 0.0.1.1.1024: . ack 157002 win 28000 
0:0:5.699705600 0.0.1.1.1024 > 0.0.3.2.25: . 173002:174002(1000) ack 256002 win 28000 
0:0:5.710385600 0.0.3.2.25 > 0.0.1.1.1024: . ack 158002 win 28000 
0:0:5.710385600 0.0.1.1.1024 > 0.0.3.2.25: . 174002:175002(1000) ack 256002 win 28000 
0:0:5.721065600 0.0.3.2.25 > 0.0.1.1.1024: . ack 159002 win 28000 
0:0:5.721065600 0.0.1.1.1024 > 0.0.3.2.25: . 175002:176002(1000) ack 256002 win 28000 
0:0:5.731745600 0.0.3.2.25 > 0.0.1.1.1024: . ack 160002 win 28000 
0:0:5.731745600 0.0.1.1.1024 > 0.0.3.2.25: . 176002:177002(1000) ack 256002 win 28000 
0:0:5.742425600 0.0.3.2.25 > 0.0.1.1.1024: . ack 161002 win 28000 
0:0:5.742425600 0.0.1.1.1024 > 0.0.3.2.25: . 177002:178002(1000) ack 256002 win 28000 
0:0:5.753105600 0.0.3.2.25 > 0.0.1.1.1024: . ack 162002 win 28000 
0:0:5.753105600 0.0.1.1.1024 > 0.0.3.2.25: . 178002:179002(1000) ack 256002 win 28000 
0:0:5.763785600 0.0.3.2.25 > 0.0.1.1.1024: . ack 163002 win 28000 
0:0:5.763785600 0.0.1.1.1024 > 0.0.3.2.25: . 179002:180002(1000) ack 256002 win 28000 
0:0:5.763785600 0.0.1.1.1024 > 0.0.3.2.25: . 180002:181002(1000) ack 256002 win 28000 
0:0:5.774465600 0.0.3.2.25 > 0.0.1.1.1024: . ack 164002 win 28000 
0:0:5.774465600 0.0.1.1.1024 > 0.0.3.2.25: . 181002:182002(1000) ack 256002 win 28000 
0:0:5.785145600 0.0.3.2.25 > 0.0.1.1.1024: . ack 165002 win 28000 
0:0:5.785145600 0.0.1.1.1024 > 0.0.3.2.25: . 182002:183002(1000) ack 256002 win 28000 
0:0:5.795825600 0.0.3.2.25 > 0.0.1.1.1024: . ack 166002 win 28000 
0:0:5.795825600 0.0.1.1.1024 > 0.0.3.2.25: . 183002:184002(1000) ack 256002 win 28000 
0:0:5.806505600 0.0.3.2.25 > 0.0.1.1.1024: . ack 167002 win 28000 
0:0:5.806505600 0.0.1.1.1024 > 0.0.3.2.25: . 184002:185002(1000) ack 256002 win 28000 
0:0:5.817185600 0.0.3.2.25 > 0.0.1.1.1024: . ack 168002 win 28000 
0:0:5.817185600 0.0.1.1.1024 > 0.0.3.2.25: . 185002:186002(1000) ack 256002 win 28000 
0:0:5.827865600 0.0.3.2.25 > 0.0.1.1.1024: . ack 169002 win 28000 
0:0:5.827865600 0.0.1.1.1024 > 0.0.3.2.25: . 186002:187002(1000) ack 256002 win 28000 
0:0:5.838545600 0.0.3.2.25 > 0.0.1.1.1024: . ack 170002 win 28000 
0:0:5.838545600 0.0.1.1.1024 > 0.0.3.2.25: . 187002:188002(1000) ack 256002 win 28000 
0:0:5.849225600 0.0.3.2.25 > 0.0.1.1.1024: . ack 171002 win 28000 
0:0:5.849225600 0.0.1.1.1024 > 0.0.3.2.25: . 188002:189002(1000) ack 256002 win 28000 
0:0:5.900614400 0.0.3.2.25 > 0.0.1.1.1024: . ack 172002 win 28000 
0:0:5.900614400 0.0.1.1.1024 > 0.0.3.2.25: . 189002:190002(1000) ack 256002 win 28000 
0:0:5.911294400 0.0.3.2.25 > 0.0.1.1.1024: . ack 173002 win 28000 
0:0:5.911294400 0.0.1.1.1024 > 0.0.3.2.25: . 190002:191002(1000) ack 256002 win 28000 
0:0:5.921974400 0.0.3.2.25 > 0.0.1.1.1024: . ack 174002 win 28000 
0:0:5.921974400 0.0.1.1.1024 > 0.0.3.2.25: . 191002:192002(1000) ack 256002 win 28000 
0:0:5.932654400 0.0.3.2.25 > 0.0.1.1.1024: . ack 175002 win 28000 
0:0:5.932654400 0.0.1.1.1024 > 0.0.3.2.25: . 192002:193002(1000) ack 256002 win 28000 
0:0:5.943334400 0.0.3.2.25 > 0.0.1.1.1024: . ack 176002 win 28000 
0:0:5.943334400 0.0.1.1.1024 > 0.0.3.2.25: . 193002:194002(1000) ack 256002 win 28000 
0:0:5.954014400 0.0.3.2.25 > 0.0.1.1.1024: . ack 177002 win 28000 
0:0:5.954014400 0.0.1.1.1024 > 0.0.3.2.25: . 194002:195002(1000) ack 256002 win 28000 
0:0:5.964694400 0.0.3.2.25 > 0.0.1.1.1024: . ack 178002 win 28000 
0:0:5.964694400 0.0.1.1.1024 > 0.0.3.2.25: . 195002:196002(1000) ack 256002 win 28000 
0:0:5.975374400 0.0.3.2.25 > 0.0.1.1.1024: . ack 179002 win 28000 
0:0:5.975374400 0.0.1.1.1024 > 0.0.3.2.25: . 196002:197002(1000) ack 256002 win 28000 
0:0:5.986054400 0.0.3.2.25 > 0.0.1.1.1024: . ack 180002 win 28000 
0:0:5.986054400 0.0.1.1.1024 > 0.0.3.2.25: . 197002:198002(1000) ack 256002 win 28000 
0:0:5.996734400 0.0.3.2.25 > 0.0.1.1.1024: . ack 181002 win 28000 
0:0:5.996734400 0.0.1.1.1024 > 0.0.3.2.25: . 198002:199002(1000) ack 256002 win 28000 
