0:0:1.000000000 0.0.1.1.1024 > 0.0.3.2.25: S win 28000 <mss 1000,sackOK,nop,nop>
0:0:1.211641600 0.0.3.2.25 > 0.0.1.1.1024: S ack 2 win 28000 <mss 1000,sackOK,nop,nop>
0:0:1.211641600 0.0.1.1.1024 > 0.0.3.2.25: . ack 256002 win 28000 
0:0:1.211642600 0.0.1.1.1024 > 0.0.3.2.25: P 2:1002(1000) ack 256002 win 28000 
0:0:1.433964800 0.0.3.2.25 > 0.0.1.1.1024: . ack 1002 win 28000 
0:0:1.433964800 0.0.1.1.1024 > 0.0.3.2.25: . 1002:2002(1000) ack 256002 win 28000 
0:0:1.433964800 0.0.1.1.1024 > 0.0.3.2.25: . 2002:3002(1000) ack 256002 win 28000 
0:0:1.656233600 0.0.3.2.25 > 0.0.1.1.1024: . ack 2002 win 28000 
0:0:1.656233600 0.0.1.1.1024 > 0.0.3.2.25: . 3002:4002(1000) ack 256002 win 28000 
0:0:1.656233600 0.0.1.1.1024 > 0.0.3.2.25: . 4002:5002(1000) ack 256002 win 28000 
0:0:1.666913600 0.0.3.2.25 > 0.0.1.1.1024: . ack 3002 win 28000 
0:0:1.666913600 0.0.1.1.1024 > 0.0.3.2.25: . 5002:6002(1000) ack 256002 win 28000 
0:0:1.666913600 0.0.1.1.1024 > 0.0.3.2.25: . 6002:7002(1000) ack 256002 win 28000 
0:0:1.878502400 0.0.3.2.25 > 0.0.1.1.1024: . ack 4002 win 28000 
0:0:1.878502400 0.0.1.1.1024 > 0.0.3.2.25: . 7002:8002(1000) ack 256002 win 28000 
0:0:1.878502400 0.0.1.1.1024 > 0.0.3.2.25: . 8002:9002(1000) ack 256002 win 28000 
0:0:1.889182400 0.0.3.2.25 > 0.0.1.1.1024: . ack 5002 win 28000 
0:0:1.889182400 0.0.1.1.1024 > 0.0.3.2.25: . 9002:10002(1000) ack 256002 win 28000 
0:0:1.889182400 0.0.1.1.1024 > 0.0.3.2.25: . 10002:11002(1000) ack 256002 win 28000 
0:0:1.899862400 0.0.3.2.25 > 0.0.1.1.1024: . ack 6002 win 28000 
0:0:1.899862400 0.0.1.1.1024 > 0.0.3.2.25: . 11002:12002(1000) ack 256002 win 28000 
0:0:1.899862400 0.0.1.1.1024 > 0.0.3.2.25: . 12002:13002(1000) ack 256002 win 28000 
0:0:1.910542400 0.0.3.2.25 > 0.0.1.1.1024: . ack 7002 win 28000 
0:0:1.910542400 0.0.1.1.1024 > 0.0.3.2.25: . 13002:14002(1000) ack 256002 win 28000 
0:0:1.910542400 0.0.1.1.1024 > 0.0.3.2.25: . 14002:15002(1000) ack 256002 win 28000 
0:0:2.100771200 0.0.3.2.25 > 0.0.1.1.1024: . ack 8002 win 28000 
0:0:2.100771200 0.0.1.1.1024 > 0.0.3.2.25: . 15002:16002(1000) ack 256002 win 28000 
0:0:2.100771200 0.0.1.1.1024 > 0.0.3.2.25: . 16002:17002(1000) ack 256002 win 28000 
0:0:2.111451200 0.0.3.2.25 > 0.0.1.1.1024: . ack 9002 win 28000 
0:0:2.111451200 0.0.1.1.1024 > 0.0.3.2.25: . 17002:18002(1000) ack 256002 win 28000 
0:0:2.111451200 0.0.1.1.1024 > 0.0.3.2.25: . 18002:19002(1000) ack 256002 win 28000 
0:0:2.122131200 0.0.3.2.25 > 0.0.1.1.1024: . ack 10002 win 28000 
0:0:2.122131200 0.0.1.1.1024 > 0.0.3.2.25: . 19002:20002(1000) ack 256002 win 28000 
0:0:2.122131200 0.0.1.1.1024 > 0.0.3.2.25: . 20002:21002(1000) ack 256002 win 28000 
0:0:2.132811200 0.0.3.2.25 > 0.0.1.1.1024: . ack 11002 win 28000 
0:0:2.132811200 0.0.1.1.1024 > 0.0.3.2.25: . 21002:22002(1000) ack 256002 win 28000 
0:0:2.132811200 0.0.1.1.1024 > 0.0.3.2.25: . 22002:23002(1000) ack 256002 win 28000 
0:0:2.143491200 0.0.3.2.25 > 0.0.1.1.1024: . ack 12002 win 28000 
0:0:2.143491200 0.0.1.1.1024 > 0.0.3.2.25: . 23002:24002(1000) ack 256002 win 28000 
0:0:2.143491200 0.0.1.1.1024 > 0.0.3.2.25: . 24002:25002(1000) ack 256002 win 28000 
0:0:2.154171200 0.0.3.2.25 > 0.0.1.1.1024: . ack 13002 win 28000 
0:0:2.154171200 0.0.1.1.1024 > 0.0.3.2.25: . 25002:26002(1000) ack 256002 win 28000 
0:0:2.154171200 0.0.1.1.1024 > 0.0.3.2.25: . 26002:27002(1000) ack 256002 win 28000 
0:0:2.164851200 0.0.3.2.25 > 0.0.1.1.1024: . ack 14002 win 28000 
0:0:2.164851200 0.0.1.1.1024 > 0.0.3.2.25: . 27002:28002(1000) ack 256002 win 28000 
0:0:2.164851200 0.0.1.1.1024 > 0.0.3.2.25: . 28002:29002(1000) ack 256002 win 28000 
0:0:2.323169600 0.0.3.2.25 > 0.0.1.1.1024: . ack 14002 win 28000 <nop,nop,sack 15002 16002>
0:0:2.333849600 0.0.3.2.25 > 0.0.1.1.1024: . ack 14002 win 28000 <nop,nop,sack 15002 17002>
0:0:2.344529600 0.0.3.2.25 > 0.0.1.1.1024: . ack 14002 win 28000 <nop,nop,sack 15002 18002>
0:0:2.344529600 0.0.1.1.1024 > 0.0.3.2.25: . 14002:15002(1000) ack 256002 win 28000 
0:0:2.355209600 0.0.3.2.25 > 0.0.1.1.1024: . ack 14002 win 28000 <nop,nop,sack 15002 19002>
0:0:2.365889600 0.0.3.2.25 > 0.0.1.1.1024: . ack 14002 win 28000 <nop,nop,sack 15002 20002>
0:0:2.376569600 0.0.3.2.25 > 0.0.1.1.1024: . ack 14002 win 28000 <nop,nop,sack 15002 21002>
0:0:2.387249600 0.0.3.2.25 > 0.0.1.1.1024: . ack 14002 win 28000 <nop,nop,sack 15002 22002>
0:0:2.397929600 0.0.3.2.25 > 0.0.1.1.1024: . ack 14002 win 28000 <nop,nop,sack 15002 23002>
0:0:2.408609600 0.0.3.2.25 > 0.0.1.1.1024: . ack 14002 win 28000 <nop,nop,sack 15002 24002>
0:0:2.408609600 0.0.1.1.1024 > 0.0.3.2.25: . 29002:30002(1000) ack 256002 win 28000 
0:0:2.419289600 0.0.3.2.25 > 0.0.1.1.1024: . ack 14002 win 28000 <nop,nop,sack 15002 25002>
0:0:2.419289600 0.0.1.1.1024 > 0.0.3.2.25: . 30002:31002(1000) ack 256002 win 28000 
0:0:2.429969600 0.0.3.2.25 > 0.0.1.1.1024: . ack 14002 win 28000 <nop,nop,sack 15002 26002>
0:0:2.429969600 0.0.1.1.1024 > 0.0.3.2.25: . 31002:32002(1000) ack 256002 win 28000 
0:0:2.440649600 0.0.3.2.25 > 0.0.1.1.1024: . ack 14002 win 28000 <nop,nop,sack 15002 27002>
0:0:2.440649600 0.0.1.1.1024 > 0.0.3.2.25: . 32002:33002(1000) ack 256002 win 28000 
0:0:2.451329600 0.0.3.2.25 > 0.0.1.1.1024: . ack 14002 win 28000 <nop,nop,sack 15002 28002>
0:0:2.451329600 0.0.1.1.1024 > 0.0.3.2.25: . 33002:34002(1000) ack 256002 win 28000 
0:0:2.462009600 0.0.3.2.25 > 0.0.1.1.1024: . ack 14002 win 28000 <nop,nop,sack 15002 29002>
0:0:2.462009600 0.0.1.1.1024 > 0.0.3.2.25: . 34002:35002(1000) ack 256002 win 28000 
0:0:2.566798400 0.0.3.2.25 > 0.0.1.1.1024: . ack 29002 win 28000 
0:0:2.566798400 0.0.1.1.1024 > 0.0.3.2.25: . 35002:36002(1000) ack 256002 win 28000 
0:0:2.566798400 0.0.1.1.1024 > 0.0.3.2.25: . 36002:37002(1000) ack 256002 win 28000 
0:0:2.630878400 0.0.3.2.25 > 0.0.1.1.1024: . ack 30002 win 28000 
0:0:2.630878400 0.0.1.1.1024 > 0.0.3.2.25: . 37002:38002(1000) ack 256002 win 28000 
0:0:2.641558400 0.0.3.2.25 > 0.0.1.1.1024: . ack 31002 win 28000 
0:0:2.641558400 0.0.1.1.1024 > 0.0.3.2.25: . 38002:39002(1000) ack 256002 win 28000 
0:0:2.652238400 0.0.3.2.25 > 0.0.1.1.1024: . ack 32002 win 28000 
0:0:2.652238400 0.0.1.1.1024 > 0.0.3.2.25: . 39002:40002(1000) ack 256002 win 28000 
0:0:2.662918400 0.0.3.2.25 > 0.0.1.1.1024: . ack 33002 win 28000 
0:0:2.662918400 0.0.1.1.1024 > 0.0.3.2.25: . 40002:41002(1000) ack 256002 win 28000 
0:0:2.673598400 0.0.3.2.25 > 0.0.1.1.1024: . ack 34002 win 28000 
0:0:2.673598400 0.0.1.1.1024 > 0.0.3.2.25: . 41002:42002(1000) ack 256002 win 28000 
0:0:2.684278400 0.0.3.2.25 > 0.0.1.1.1024: . ack 35002 win 28000 
0:0:2.684278400 0.0.1.1.1024 > 0.0.3.2.25: . 42002:43002(1000) ack 256002 win 28000 
0:0:2.789067200 0.0.3.2.25 > 0.0.1.1.1024: . ack 36002 win 28000 
0:0:2.789067200 0.0.1.1.1024 > 0.0.3.2.25: . 43002:44002(1000) ack 256002 win 28000 
0:0:2.799747200 0.0.3.2.25 > 0.0.1.1.1024: . ack 37002 win 28000 
0:0:2.799747200 0.0.1.1.1024 > 0.0.3.2.25: . 44002:45002(1000) ack 256002 win 28000 
0:0:2.853147200 0.0.3.2.25 > 0.0.1.1.1024: . ack 38002 win 28000 
0:0:2.853147200 0.0.1.1.1024 > 0.0.3.2.25: . 45002:46002(1000) ack 256002 win 28000 
0:0:2.853147200 0.0.1.1.1024 > 0.0.3.2.25: . 46002:47002(1000) ack 256002 win 28000 
0:0:2.863827200 0.0.3.2.25 > 0.0.1.1.1024: . ack 39002 win 28000 
0:0:2.863827200 0.0.1.1.1024 > 0.0.3.2.25: . 47002:48002(1000) ack 256002 win 28000 
0:0:2.874507200 0.0.3.2.25 > 0.0.1.1.1024: . ack 40002 win 28000 
0:0:2.874507200 0.0.1.1.1024 > 0.0.3.2.25: . 48002:49002(1000) ack 256002 win 28000 
0:0:2.885187200 0.0.3.2.25 > 0.0.1.1.1024: . ack 41002 win 28000 
0:0:2.885187200 0.0.1.1.1024 > 0.0.3.2.25: . 49002:50002(1000) ack 256002 win 28000 
0:0:2.895867200 0.0.3.2.25 > 0.0.1.1.1024: . ack 42002 win 28000 
0:0:2.895867200 0.0.1.1.1024 > 0.0.3.2.25: . 50002:51002(1000) ack 256002 win 28000 
0:0:2.906547200 0.0.3.2.25 > 0.0.1.1.1024: . ack 43002 win 28000 
0:0:2.906547200 0.0.1.1.1024 > 0.0.3.2.25: . 51002:52002(1000) ack 256002 win 28000 
0:0:3.011336000 0.0.3.2.25 > 0.0.1.1.1024: . ack 44002 win 28000 
0:0:3.011336000 0.0.1.1.1024 > 0.0.3.2.25: . 52002:53002(1000) ack 256002 win 28000 
0:0:3.022016000 0.0.3.2.25 > 0.0.1.1.1024: . ack 45002 win 28000 
0:0:3.022016000 0.0.1.1.1024 > 0.0.3.2.25: . 53002:54002(1000) ack 256002 win 28000 
0:0:3.075416000 0.0.3.2.25 > 0.0.1.1.1024: . ack 46002 win 28000 
0:0:3.075416000 0.0.1.1.1024 > 0.0.3.2.25: . 54002:55002(1000) ack 256002 win 28000 
0:0:3.086096000 0.0.3.2.25 > 0.0.1.1.1024: . ack 47002 win 28000 
0:0:3.086096000 0.0.1.1.1024 > 0.0.3.2.25: . 55002:56002(1000) ack 256002 win 28000 
0:0:3.086096000 0.0.1.1.1024 > 0.0.3.2.25: . 56002:57002(1000) ack 256002 win 28000 
0:0:3.096776000 0.0.3.2.25 > 0.0.1.1.1024: . ack 48002 win 28000 
0:0:3.096776000 0.0.1.1.1024 > 0.0.3.2.25: . 57002:58002(1000) ack 256002 win 28000 
0:0:3.107456000 0.0.3.2.25 > 0.0.1.1.1024: . ack 49002 win 28000 
0:0:3.107456000 0.0.1.1.1024 > 0.0.3.2.25: . 58002:59002(1000) ack 256002 win 28000 
0:0:3.118136000 0.0.3.2.25 > 0.0.1.1.1024: . ack 50002 win 28000 
0:0:3.118136000 0.0.1.1.1024 > 0.0.3.2.25: . 59002:60002(1000) ack 256002 win 28000 
0:0:3.128816000 0.0.3.2.25 > 0.0.1.1.1024: . ack 51002 win 28000 
0:0:3.128816000 0.0.1.1.1024 > 0.0.3.2.25: . 60002:61002(1000) ack 256002 win 28000 
0:0:3.139496000 0.0.3.2.25 > 0.0.1.1.1024: . ack 52002 win 28000 
0:0:3.139496000 0.0.1.1.1024 > 0.0.3.2.25: . 61002:62002(1000) ack 256002 win 28000 
0:0:3.233604800 0.0.3.2.25 > 0.0.1.1.1024: . ack 53002 win 28000 
0:0:3.233604800 0.0.1.1.1024 > 0.0.3.2.25: . 62002:63002(1000) ack 256002 win 28000 
0:0:3.244284800 0.0.3.2.25 > 0.0.1.1.1024: . ack 54002 win 28000 
0:0:3.244284800 0.0.1.1.1024 > 0.0.3.2.25: . 63002:64002(1000) ack 256002 win 28000 
0:0:3.297684800 0.0.3.2.25 > 0.0.1.1.1024: . ack 55002 win 28000 
0:0:3.297684800 0.0.1.1.1024 > 0.0.3.2.25: . 64002:65002(1000) ack 256002 win 28000 
0:0:3.308364800 0.0.3.2.25 > 0.0.1.1.1024: . ack 56002 win 28000 
0:0:3.308364800 0.0.1.1.1024 > 0.0.3.2.25: . 65002:66002(1000) ack 256002 win 28000 
0:0:3.319044800 0.0.3.2.25 > 0.0.1.1.1024: . ack 57002 win 28000 
0:0:3.319044800 0.0.1.1.1024 > 0.0.3.2.25: . 66002:67002(1000) ack 256002 win 28000 
0:0:3.329724800 0.0.3.2.25 > 0.0.1.1.1024: . ack 58002 win 28000 
0:0:3.329724800 0.0.1.1.1024 > 0.0.3.2.25: . 67002:68002(1000) ack 256002 win 28000 
0:0:3.329724800 0.0.1.1.1024 > 0.0.3.2.25: . 68002:69002(1000) ack 256002 win 28000 
0:0:3.340404800 0.0.3.2.25 > 0.0.1.1.1024: . ack 59002 win 28000 
0:0:3.340404800 0.0.1.1.1024 > 0.0.3.2.25: . 69002:70002(1000) ack 256002 win 28000 
0:0:3.351084800 0.0.3.2.25 > 0.0.1.1.1024: . ack 60002 win 28000 
0:0:3.351084800 0.0.1.1.1024 > 0.0.3.2.25: . 70002:71002(1000) ack 256002 win 28000 
0:0:3.361764800 0.0.3.2.25 > 0.0.1.1.1024: . ack 61002 win 28000 
0:0:3.361764800 0.0.1.1.1024 > 0.0.3.2.25: . 71002:72002(1000) ack 256002 win 28000 
0:0:3.372444800 0.0.3.2.25 > 0.0.1.1.1024: . ack 62002 win 28000 
0:0:3.372444800 0.0.1.1.1024 > 0.0.3.2.25: . 72002:73002(1000) ack 256002 win 28000 
0:0:3.455873600 0.0.3.2.25 > 0.0.1.1.1024: . ack 63002 win 28000 
0:0:3.455873600 0.0.1.1.1024 > 0.0.3.2.25: . 73002:74002(1000) ack 256002 win 28000 
0:0:3.466553600 0.0.3.2.25 > 0.0.1.1.1024: . ack 64002 win 28000 
0:0:3.466553600 0.0.1.1.1024 > 0.0.3.2.25: . 74002:75002(1000) ack 256002 win 28000 
0:0:3.519953600 0.0.3.2.25 > 0.0.1.1.1024: . ack 65002 win 28000 
0:0:3.519953600 0.0.1.1.1024 > 0.0.3.2.25: . 75002:76002(1000) ack 256002 win 28000 
0:0:3.530633600 0.0.3.2.25 > 0.0.1.1.1024: . ack 66002 win 28000 
0:0:3.530633600 0.0.1.1.1024 > 0.0.3.2.25: . 76002:77002(1000) ack 256002 win 28000 
0:0:3.541313600 0.0.3.2.25 > 0.0.1.1.1024: . ack 67002 win 28000 
0:0:3.541313600 0.0.1.1.1024 > 0.0.3.2.25: . 77002:78002(1000) ack 256002 win 28000 
0:0:3.551993600 0.0.3.2.25 > 0.0.1.1.1024: . ack 68002 win 28000 
0:0:3.551993600 0.0.1.1.1024 > 0.0.3.2.25: . 78002:79002(1000) ack 256002 win 28000 
0:0:3.562673600 0.0.3.2.25 > 0.0.1.1.1024: . ack 69002 win 28000 
0:0:3.562673600 0.0.1.1.1024 > 0.0.3.2.25: . 79002:80002(1000) ack 256002 win 28000 
0:0:3.562673600 0.0.1.1.1024 > 0.0.3.2.25: . 80002:81002(1000) ack 256002 win 28000 
0:0:3.573353600 0.0.3.2.25 > 0.0.1.1.1024: . ack 70002 win 28000 
0:0:3.573353600 0.0.1.1.1024 > 0.0.3.2.25: . 81002:82002(1000) ack 256002 win 28000 
0:0:3.584033600 0.0.3.2.25 > 0.0.1.1.1024: . ack 71002 win 28000 
0:0:3.584033600 0.0.1.1.1024 > 0.0.3.2.25: . 82002:83002(1000) ack 256002 win 28000 
0:0:3.594713600 0.0.3.2.25 > 0.0.1.1.1024: . ack 72002 win 28000 
0:0:3.594713600 0.0.1.1.1024 > 0.0.3.2.25: . 83002:84002(1000) ack 256002 win 28000 
0:0:3.605393600 0.0.3.2.25 > 0.0.1.1.1024: . ack 73002 win 28000 
0:0:3.605393600 0.0.1.1.1024 > 0.0.3.2.25: . 84002:85002(1000) ack 256002 win 28000 
0:0:3.678142400 0.0.3.2.25 > 0.0.1.1.1024: . ack 74002 win 28000 
0:0:3.678142400 0.0.1.1.1024 > 0.0.3.2.25: . 85002:86002(1000) ack 256002 win 28000 
0:0:3.688822400 0.0.3.2.25 > 0.0.1.1.1024: . ack 75002 win 28000 
0:0:3.688822400 0.0.1.1.1024 > 0.0.3.2.25: . 86002:87002(1000) ack 256002 win 28000 
0:0:3.742222400 0.0.3.2.25 > 0.0.1.1.1024: . ack 76002 win 28000 
0:0:3.742222400 0.0.1.1.1024 > 0.0.3.2.25: . 87002:88002(1000) ack 256002 win 28000 
0:0:3.752902400 0.0.3.2.25 > 0.0.1.1.1024: . ack 77002 win 28000 
0:0:3.752902400 0.0.1.1.1024 > 0.0.3.2.25: . 88002:89002(1000) ack 256002 win 28000 
0:0:3.763582400 0.0.3.2.25 > 0.0.1.1.1024: . ack 78002 win 28000 
0:0:3.763582400 0.0.1.1.1024 > 0.0.3.2.25: . 89002:90002(1000) ack 256002 win 28000 
0:0:3.774262400 0.0.3.2.25 > 0.0.1.1.1024: . ack 79002 win 28000 
0:0:3.774262400 0.0.1.1.1024 > 0.0.3.2.25: . 90002:91002(1000) ack 256002 win 28000 
0:0:3.784942400 0.0.3.2.25 > 0.0.1.1.1024: . ack 80002 win 28000 
0:0:3.784942400 0.0.1.1.1024 > 0.0.3.2.25: . 91002:92002(1000) ack 256002 win 28000 
0:0:3.795622400 0.0.3.2.25 > 0.0.1.1.1024: . ack 81002 win 28000 
0:0:3.795622400 0.0.1.1.1024 > 0.0.3.2.25: . 92002:93002(1000) ack 256002 win 28000 
0:0:3.806302400 0.0.3.2.25 > 0.0.1.1.1024: . ack 82002 win 28000 
0:0:3.806302400 0.0.1.1.1024 > 0.0.3.2.25: . 93002:94002(1000) ack 256002 win 28000 
0:0:3.806302400 0.0.1.1.1024 > 0.0.3.2.25: . 94002:95002(1000) ack 256002 win 28000 
0:0:3.816982400 0.0.3.2.25 > 0.0.1.1.1024: . ack 83002 win 28000 
0:0:3.816982400 0.0.1.1.1024 > 0.0.3.2.25: . 95002:96002(1000) ack 256002 win 28000 
0:0:3.828302400 0.0.3.2.25 > 0.0.1.1.1024: . ack 84002 win 28000 
0:0:3.828302400 0.0.1.1.1024 > 0.0.3.2.25: . 96002:97002(1000) ack 256002 win 28000 
0:0:3.838982400 0.0.3.2.25 > 0.0.1.1.1024: . ack 85002 win 28000 
0:0:3.838982400 0.0.1.1.1024 > 0.0.3.2.25: . 97002:98002(1000) ack 256002 win 28000 
0:0:3.900411200 0.0.3.2.25 > 0.0.1.1.1024: . ack 86002 win 28000 
0:0:3.900411200 0.0.1.1.1024 > 0.0.3.2.25: . 98002:99002(1000) ack 256002 win 28000 
0:0:3.911091200 0.0.3.2.25 > 0.0.1.1.1024: . ack 87002 win 28000 
0:0:3.911091200 0.0.1.1.1024 > 0.0.3.2.25: . 99002:100002(1000) ack 256002 win 28000 
0:0:3.964491200 0.0.3.2.25 > 0.0.1.1.1024: . ack 88002 win 28000 
0:0:3.964491200 0.0.1.1.1024 > 0.0.3.2.25: . 100002:101002(1000) ack 256002 win 28000 
0:0:3.975171200 0.0.3.2.25 > 0.0.1.1.1024: . ack 89002 win 28000 
0:0:3.975171200 0.0.1.1.1024 > 0.0.3.2.25: . 101002:102002(1000) ack 256002 win 28000 
0:0:3.985851200 0.0.3.2.25 > 0.0.1.1.1024: . ack 90002 win 28000 
0:0:3.985851200 0.0.1.1.1024 > 0.0.3.2.25: . 102002:103002(1000) ack 256002 win 28000 
0:0:3.996531200 0.0.3.2.25 > 0.0.1.1.1024: . ack 91002 win 28000 
0:0:3.996531200 0.0.1.1.1024 > 0.0.3.2.25: . 103002:104002(1000) ack 256002 win 28000 
0:0:4.007211200 0.0.3.2.25 > 0.0.1.1.1024: . ack 92002 win 28000 
0:0:4.007211200 0.0.1.1.1024 > 0.0.3.2.25: . 104002:105002(1000) ack 256002 win 28000 
0:0:4.017891200 0.0.3.2.25 > 0.0.1.1.1024: . ack 93002 win 28000 
0:0:4.017891200 0.0.1.1.1024 > 0.0.3.2.25: . 105002:106002(1000) ack 256002 win 28000 
0:0:4.028571200 0.0.3.2.25 > 0.0.1.1.1024: . ack 94002 win 28000 
0:0:4.028571200 0.0.1.1.1024 > 0.0.3.2.25: . 106002:107002(1000) ack 256002 win 28000 
0:0:4.039251200 0.0.3.2.25 > 0.0.1.1.1024: . ack 95002 win 28000 
0:0:4.039251200 0.0.1.1.1024 > 0.0.3.2.25: . 107002:108002(1000) ack 256002 win 28000 
0:0:4.049931200 0.0.3.2.25 > 0.0.1.1.1024: . ack 96002 win 28000 
0:0:4.049931200 0.0.1.1.1024 > 0.0.3.2.25: . 108002:109002(1000) ack 256002 win 28000 
0:0:4.049931200 0.0.1.1.1024 > 0.0.3.2.25: . 109002:110002(1000) ack 256002 win 28000 
0:0:4.060611200 0.0.3.2.25 > 0.0.1.1.1024: . ack 97002 win 28000 
0:0:4.060611200 0.0.1.1.1024 > 0.0.3.2.25: . 110002:111002(1000) ack 256002 win 28000 
0:0:4.071291200 0.0.3.2.25 > 0.0.1.1.1024: . ack 98002 win 28000 
0:0:4.071291200 0.0.1.1.1024 > 0.0.3.2.25: . 111002:112002(1000) ack 256002 win 28000 
0:0:4.122680000 0.0.3.2.25 > 0.0.1.1.1024: . ack 99002 win 28000 
0:0:4.122680000 0.0.1.1.1024 > 0.0.3.2.25: . 112002:113002(1000) ack 256002 win 28000 
0:0:4.133360000 0.0.3.2.25 > 0.0.1.1.1024: . ack 100002 win 28000 
0:0:4.133360000 0.0.1.1.1024 > 0.0.3.2.25: . 113002:114002(1000) ack 256002 win 28000 
0:0:4.186760000 0.0.3.2.25 > 0.0.1.1.1024: . ack 101002 win 28000 
0:0:4.186760000 0.0.1.1.1024 > 0.0.3.2.25: . 114002:115002(1000) ack 256002 win 28000 
0:0:4.197440000 0.0.3.2.25 > 0.0.1.1.1024: . ack 102002 win 28000 
0:0:4.197440000 0.0.1.1.1024 > 0.0.3.2.25: . 115002:116002(1000) ack 256002 win 28000 
0:0:4.208120000 0.0.3.2.25 > 0.0.1.1.1024: . ack 103002 win 28000 
0:0:4.208120000 0.0.1.1.1024 > 0.0.3.2.25: . 116002:117002(1000) ack 256002 win 28000 
0:0:4.218800000 0.0.3.2.25 > 0.0.1.1.1024: . ack 104002 win 28000 
0:0:4.218800000 0.0.1.1.1024 > 0.0.3.2.25: . 117002:118002(1000) ack 256002 win 28000 
0:0:4.229480000 0.0.3.2.25 > 0.0.1.1.1024: . ack 105002 win 28000 
0:0:4.229480000 0.0.1.1.1024 > 0.0.3.2.25: . 118002:119002(1000) ack 256002 win 28000 
0:0:4.240160000 0.0.3.2.25 > 0.0.1.1.1024: . ack 106002 win 28000 
0:0:4.240160000 0.0.1.1.1024 > 0.0.3.2.25: . 119002:120002(1000) ack 256002 win 28000 
0:0:4.250840000 0.0.3.2.25 > 0.0.1.1.1024: . ack 107002 win 28000 
0:0:4.250840000 0.0.1.1.1024 > 0.0.3.2.25: . 120002:121002(1000) ack 256002 win 28000 
0:0:4.261520000 0.0.3.2.25 > 0.0.1.1.1024: . ack 108002 win 28000 
0:0:4.261520000 0.0.1.1.1024 > 0.0.3.2.25: . 121002:122002(1000) ack 256002 win 28000 
0:0:4.272200000 0.0.3.2.25 > 0.0.1.1.1024: . ack 109002 win 28000 
0:0:4.272200000 0.0.1.1.1024 > 0.0.3.2.25: . 122002:123002(1000) ack 256002 win 28000 
0:0:4.282880000 0.0.3.2.25 > 0.0.1.1.1024: . ack 110002 win 28000 
0:0:4.282880000 0.0.1.1.1024 > 0.0.3.2.25: . 123002:124002(1000) ack 256002 win 28000 
0:0:4.282880000 0.0.1.1.1024 > 0.0.3.2.25: . 124002:125002(1000) ack 256002 win 28000 
0:0:4.293560000 0.0.3.2.25 > 0.0.1.1.1024: . ack 111002 win 28000 
0:0:4.293560000 0.0.1.1.1024 > 0.0.3.2.25: . 125002:126002(1000) ack 256002 win 28000 
0:0:4.304240000 0.0.3.2.25 > 0.0.1.1.1024: . ack 112002 win 28000 
0:0:4.304240000 0.0.1.1.1024 > 0.0.3.2.25: . 126002:127002(1000) ack 256002 win 28000 
0:0:4.344948800 0.0.3.2.25 > 0.0.1.1.1024: . ack 113002 win 28000 
0:0:4.344948800 0.0.1.1.1024 > 0.0.3.2.25: . 127002:128002(1000) ack 256002 win 28000 
0:0:4.355628800 0.0.3.2.25 > 0.0.1.1.1024: . ack 114002 win 28000 
0:0:4.355628800 0.0.1.1.1024 > 0.0.3.2.25: . 128002:129002(1000) ack 256002 win 28000 
0:0:4.409028800 0.0.3.2.25 > 0.0.1.1.1024: . ack 115002 win 28000 
0:0:4.409028800 0.0.1.1.1024 > 0.0.3.2.25: . 129002:130002(1000) ack 256002 win 28000 
0:0:4.419708800 0.0.3.2.25 > 0.0.1.1.1024: . ack 116002 win 28000 
0:0:4.419708800 0.0.1.1.1024 > 0.0.3.2.25: . 130002:131002(1000) ack 256002 win 28000 
0:0:4.430388800 0.0.3.2.25 > 0.0.1.1.1024: . ack 117002 win 28000 
0:0:4.430388800 0.0.1.1.1024 > 0.0.3.2.25: . 131002:132002(1000) ack 256002 win 28000 
0:0:4.441068800 0.0.3.2.25 > 0.0.1.1.1024: . ack 118002 win 28000 
0:0:4.441068800 0.0.1.1.1024 > 0.0.3.2.25: . 132002:133002(1000) ack 256002 win 28000 
0:0:4.451748800 0.0.3.2.25 > 0.0.1.1.1024: . ack 119002 win 28000 
0:0:4.451748800 0.0.1.1.1024 > 0.0.3.2.25: . 133002:134002(1000) ack 256002 win 28000 
0:0:4.462428800 0.0.3.2.25 > 0.0.1.1.1024: . ack 120002 win 28000 
0:0:4.462428800 0.0.1.1.1024 > 0.0.3.2.25: . 134002:135002(1000) ack 256002 win 28000 
0:0:4.473108800 0.0.3.2.25 > 0.0.1.1.1024: . ack 121002 win 28000 
0:0:4.473108800 0.0.1.1.1024 > 0.0.3.2.25: . 135002:136002(1000) ack 256002 win 28000 
0:0:4.483788800 0.0.3.2.25 > 0.0.1.1.1024: . ack 122002 win 28000 
0:0:4.483788800 0.0.1.1.1024 > 0.0.3.2.25: . 136002:137002(1000) ack 256002 win 28000 
0:0:4.494468800 0.0.3.2.25 > 0.0.1.1.1024: . ack 123002 win 28000 
0:0:4.494468800 0.0.1.1.1024 > 0.0.3.2.25: . 137002:138002(1000) ack 256002 win 28000 
0:0:4.505148800 0.0.3.2.25 > 0.0.1.1.1024: . ack 124002 win 28000 
0:0:4.505148800 0.0.1.1.1024 > 0.0.3.2.25: . 138002:139002(1000) ack 256002 win 28000 
0:0:4.515828800 0.0.3.2.25 > 0.0.1.1.1024: . ack 125002 win 28000 
0:0:4.515828800 0.0.1.1.1024 > 0.0.3.2.25: . 139002:140002(1000) ack 256002 win 28000 
0:0:4.526508800 0.0.3.2.25 > 0.0.1.1.1024: . ack 126002 win 28000 
0:0:4.526508800 0.0.1.1.1024 > 0.0.3.2.25: . 140002:141002(1000) ack 256002 win 28000 
0:0:4.526508800 0.0.1.1.1024 > 0.0.3.2.25: . 141002:142002(1000) ack 256002 win 28000 
0:0:4.537188800 0.0.3.2.25 > 0.0.1.1.1024: . ack 127002 win 28000 
0:0:4.537188800 0.0.1.1.1024 > 0.0.3.2.25: . 142002:143002(1000) ack 256002 win 28000 
0:0:4.567217600 0.0.3.2.25 > 0.0.1.1.1024: . ack 128002 win 28000 
0:0:4.567217600 0.0.1.1.1024 > 0.0.3.2.25: . 143002:144002(1000) ack 256002 win 28000 
0:0:4.577897600 0.0.3.2.25 > 0.0.1.1.1024: . ack 129002 win 28000 
0:0:4.577897600 0.0.1.1.1024 > 0.0.3.2.25: . 144002:145002(1000) ack 256002 win 28000 
0:0:4.631297600 0.0.3.2.25 > 0.0.1.1.1024: . ack 130002 win 28000 
0:0:4.631297600 0.0.1.1.1024 > 0.0.3.2.25: . 145002:146002(1000) ack 256002 win 28000 
0:0:4.641977600 0.0.3.2.25 > 0.0.1.1.1024: . ack 131002 win 28000 
0:0:4.641977600 0.0.1.1.1024 > 0.0.3.2.25: . 146002:147002(1000) ack 256002 win 28000 
0:0:4.652657600 0.0.3.2.25 > 0.0.1.1.1024: . ack 132002 win 28000 
0:0:4.652657600 0.0.1.1.1024 > 0.0.3.2.25: . 147002:148002(1000) ack 256002 win 28000 
0:0:4.663337600 0.0.3.2.25 > 0.0.1.1.1024: . ack 133002 win 28000 
0:0:4.663337600 0.0.1.1.1024 > 0.0.3.2.25: . 148002:149002(1000) ack 256002 win 28000 
0:0:4.674017600 0.0.3.2.25 > 0.0.1.1.1024: . ack 134002 win 28000 
0:0:4.674017600 0.0.1.1.1024 > 0.0.3.2.25: . 149002:150002(1000) ack 256002 win 28000 
0:0:4.684697600 0.0.3.2.25 > 0.0.1.1.1024: . ack 135002 win 28000 
0:0:4.684697600 0.0.1.1.1024 > 0.0.3.2.25: . 150002:151002(1000) ack 256002 win 28000 
0:0:4.695377600 0.0.3.2.25 > 0.0.1.1.1024: . ack 136002 win 28000 
0:0:4.695377600 0.0.1.1.1024 > 0.0.3.2.25: . 151002:152002(1000) ack 256002 win 28000 
0:0:4.706057600 0.0.3.2.25 > 0.0.1.1.1024: . ack 137002 win 28000 
0:0:4.706057600 0.0.1.1.1024 > 0.0.3.2.25: . 152002:153002(1000) ack 256002 win 28000 
0:0:4.716737600 0.0.3.2.25 > 0.0.1.1.1024: . ack 138002 win 28000 
0:0:4.716737600 0.0.1.1.1024 > 0.0.3.2.25: . 153002:154002(1000) ack 256002 win 28000 
0:0:4.727417600 0.0.3.2.25 > 0.0.1.1.1024: . ack 139002 win 28000 
0:0:4.727417600 0.0.1.1.1024 > 0.0.3.2.25: . 154002:155002(1000) ack 256002 win 28000 
0:0:4.738097600 0.0.3.2.25 > 0.0.1.1.1024: . ack 140002 win 28000 
0:0:4.738097600 0.0.1.1.1024 > 0.0.3.2.25: . 155002:156002(1000) ack 256002 win 28000 
0:0:4.748777600 0.0.3.2.25 > 0.0.1.1.1024: . ack 141002 win 28000 
0:0:4.748777600 0.0.1.1.1024 > 0.0.3.2.25: . 156002:157002(1000) ack 256002 win 28000 
0:0:4.759457600 0.0.3.2.25 > 0.0.1.1.1024: . ack 142002 win 28000 
0:0:4.759457600 0.0.1.1.1024 > 0.0.3.2.25: . 157002:158002(1000) ack 256002 win 28000 
0:0:4.759457600 0.0.1.1.1024 > 0.0.3.2.25: . 158002:159002(1000) ack 256002 win 28000 
0:0:4.770137600 0.0.3.2.25 > 0.0.1.1.1024: . ack 143002 win 28000 
0:0:4.770137600 0.0.1.1.1024 > 0.0.3.2.25: . 159002:160002(1000) ack 256002 win 28000 
0:0:4.789486400 0.0.3.2.25 > 0.0.1.1.1024: . ack 144002 win 28000 
0:0:4.789486400 0.0.1.1.1024 > 0.0.3.2.25: . 160002:161002(1000) ack 256002 win 28000 
0:0:4.800166400 0.0.3.2.25 > 0.0.1.1.1024: . ack 145002 win 28000 
0:0:4.800166400 0.0.1.1.1024 > 0.0.3.2.25: . 161002:162002(1000) ack 256002 win 28000 
0:0:4.853566400 0.0.3.2.25 > 0.0.1.1.1024: . ack 146002 win 28000 
0:0:4.853566400 0.0.1.1.1024 > 0.0.3.2.25: . 162002:163002(1000) ack 256002 win 28000 
0:0:4.864246400 0.0.3.2.25 > 0.0.1.1.1024: . ack 147002 win 28000 
0:0:4.864246400 0.0.1.1.1024 > 0.0.3.2.25: . 163002:164002(1000) ack 256002 win 28000 
0:0:4.874926400 0.0.3.2.25 > 0.0.1.1.1024: . ack 148002 win 28000 
0:0:4.874926400 0.0.1.1.1024 > 0.0.3.2.25: . 164002:165002(1000) ack 256002 win 28000 
0:0:4.885606400 0.0.3.2.25 > 0.0.1.1.1024: . ack 149002 win 28000 
0:0:4.885606400 0.0.1.1.1024 > 0.0.3.2.25: . 165002:166002(1000) ack 256002 win 28000 
0:0:4.896286400 0.0.3.2.25 > 0.0.1.1.1024: . ack 150002 win 28000 
0:0:4.896286400 0.0.1.1.1024 > 0.0.3.2.25: . 166002:167002(1000) ack 256002 win 28000 
0:0:4.906966400 0.0.3.2.25 > 0.0.1.1.1024: . ack 151002 win 28000 
0:0:4.906966400 0.0.1.1.1024 > 0.0.3.2.25: . 167002:168002(1000) ack 256002 win 28000 
0:0:4.917646400 0.0.3.2.25 > 0.0.1.1.1024: . ack 152002 win 28000 
0:0:4.917646400 0.0.1.1.1024 > 0.0.3.2.25: . 168002:169002(1000) ack 256002 win 28000 
0:0:4.928326400 0.0.3.2.25 > 0.0.1.1.1024: . ack 153002 win 28000 
0:0:4.928326400 0.0.1.1.1024 > 0.0.3.2.25: . 169002:170002(1000) ack 256002 win 28000 
0:0:4.939006400 0.0.3.2.25 > 0.0.1.1.1024: . ack 154002 win 28000 
0:0:4.939006400 0.0.1.1.1024 > 0.0.3.2.25: . 170002:171002(1000) ack 256002 win 28000 
0:0:4.949686400 0.0.3.2.25 > 0.0.1.1.1024: . ack 155002 win 28000 
0:0:4.949686400 0.0.1.1.1024 > 0.0.3.2.25: . 171002:172002(1000) ack 256002 win 28000 
0:0:4.960366400 0.0.3.2.25 > 0.0.1.1.1024: . ack 156002 win 28000 
0:0:4.960366400 0.0.1.1.1024 > 0.0.3.2.25: . 172002:173002(1000) ack 256002 win 28000 
0:0:4.971046400 0.0.3.2.25 > 0.0.1.1.1024: . ack 157002 win 28000 
0:0:4.971046400 0.0.1.1.1024 > 0.0.3.2.25: . 173002:174002(1000) ack 256002 win 28000 
0:0:4.981726400 0.0.3.2.25 > 0.0.1.1.1024: . ack 158002 win 28000 
0:0:4.981726400 0.0.1.1.1024 > 0.0.3.2.25: . 174002:175002(1000) ack 256002 win 28000 
0:0:4.992406400 0.0.3.2.25 > 0.0.1.1.1024: . ack 159002 win 28000 
0:0:4.992406400 0.0.1.1.1024 > 0.0.3.2.25: . 175002:176002(1000) ack 256002 win 28000 
0:0:5.003086400 0.0.3.2.25 > 0.0.1.1.1024: . ack 160002 win 28000 
0:0:5.003086400 0.0.1.1.1024 > 0.0.3.2.25: . 176002:177002(1000) ack 256002 win 28000 
0:0:5.003086400 0.0.1.1.1024 > 0.0.3.2.25: . 177002:178002(1000) ack 256002 win 28000 
0:0:5.013766400 0.0.3.2.25 > 0.0.1.1.1024: . ack 161002 win 28000 
0:0:5.013766400 0.0.1.1.1024 > 0.0.3.2.25: . 178002:179002(1000) ack 256002 win 28000 
0:0:5.024446400 0.0.3.2.25 > 0.0.1.1.1024: . ack 162002 win 28000 
0:0:5.024446400 0.0.1.1.1024 > 0.0.3.2.25: . 179002:180002(1000) ack 256002 win 28000 
0:0:5.075835200 0.0.3.2.25 > 0.0.1.1.1024: . ack 163002 win 28000 
0:0:5.075835200 0.0.1.1.1024 > 0.0.3.2.25: . 180002:181002(1000) ack 256002 win 28000 
0:0:5.086515200 0.0.3.2.25 > 0.0.1.1.1024: . ack 164002 win 28000 
0:0:5.086515200 0.0.1.1.1024 > 0.0.3.2.25: . 181002:182002(1000) ack 256002 win 28000 
0:0:5.097195200 0.0.3.2.25 > 0.0.1.1.1024: . ack 165002 win 28000 
0:0:5.097195200 0.0.1.1.1024 > 0.0.3.2.25: . 182002:183002(1000) ack 256002 win 28000 
0:0:5.107875200 0.0.3.2.25 > 0.0.1.1.1024: . ack 166002 win 28000 
0:0:5.107875200 0.0.1.1.1024 > 0.0.3.2.25: . 183002:184002(1000) ack 256002 win 28000 
0:0:5.118555200 0.0.3.2.25 > 0.0.1.1.1024: . ack 167002 win 28000 
0:0:5.118555200 0.0.1.1.1024 > 0.0.3.2.25: . 184002:185002(1000) ack 256002 win 28000 
0:0:5.129235200 0.0.3.2.25 > 0.0.1.1.1024: . ack 168002 win 28000 
0:0:5.129235200 0.0.1.1.1024 > 0.0.3.2.25: . 185002:186002(1000) ack 256002 win 28000 
0:0:5.139915200 0.0.3.2.25 > 0.0.1.1.1024: . ack 169002 win 28000 
0:0:5.139915200 0.0.1.1.1024 > 0.0.3.2.25: . 186002:187002(1000) ack 256002 win 28000 
0:0:5.150595200 0.0.3.2.25 > 0.0.1.1.1024: . ack 170002 win 28000 
0:0:5.150595200 0.0.1.1.1024 > 0.0.3.2.25: . 187002:188002(1000) ack 256002 win 28000 
0:0:5.161275200 0.0.3.2.25 > 0.0.1.1.1024: . ack 171002 win 28000 
0:0:5.161275200 0.0.1.1.1024 > 0.0.3.2.25: . 188002:189002(1000) ack 256002 win 28000 
0:0:5.171955200 0.0.3.2.25 > 0.0.1.1.1024: . ack 172002 win 28000 
0:0:5.171955200 0.0.1.1.1024 > 0.0.3.2.25: . 189002:190002(1000) ack 256002 win 28000 
0:0:5.182635200 0.0.3.2.25 > 0.0.1.1.1024: . ack 173002 win 28000 
0:0:5.182635200 0.0.1.1.1024 > 0.0.3.2.25: . 190002:191002(1000) ack 256002 win 28000 
0:0:5.193315200 0.0.3.2.25 > 0.0.1.1.1024: . ack 174002 win 28000 
0:0:5.193315200 0.0.1.1.1024 > 0.0.3.2.25: . 191002:192002(1000) ack 256002 win 28000 
0:0:5.203995200 0.0.3.2.25 > 0.0.1.1.1024: . ack 175002 win 28000 
0:0:5.203995200 0.0.1.1.1024 > 0.0.3.2.25: . 192002:193002(1000) ack 256002 win 28000 
0:0:5.214675200 0.0.3.2.25 > 0.0.1.1.1024: . ack 176002 win 28000 
0:0:5.214675200 0.0.1.1.1024 > 0.0.3.2.25: . 193002:194002(1000) ack 256002 win 28000 
0:0:5.225355200 0.0.3.2.25 > 0.0.1.1.1024: . ack 177002 win 28000 
0:0:5.225355200 0.0.1.1.1024 > 0.0.3.2.25: . 194002:195002(1000) ack 256002 win 28000 
0:0:5.236035200 0.0.3.2.25 > 0.0.1.1.1024: . ack 178002 win 28000 
0:0:5.236035200 0.0.1.1.1024 > 0.0.3.2.25: . 195002:196002(1000) ack 256002 win 28000 
0:0:5.246715200 0.0.3.2.25 > 0.0.1.1.1024: . ack 179002 win 28000 
0:0:5.246715200 0.0.1.1.1024 > 0.0.3.2.25: . 196002:197002(1000) ack 256002 win 28000 
0:0:5.246715200 0.0.1.1.1024 > 0.0.3.2.25: . 197002:198002(1000) ack 256002 win 28000 
0:0:5.257395200 0.0.3.2.25 > 0.0.1.1.1024: . ack 180002 win 28000 
0:0:5.257395200 0.0.1.1.1024 > 0.0.3.2.25: . 198002:199002(1000) ack 256002 win 28000 
0:0:5.298104000 0.0.3.2.25 > 0.0.1.1.1024: . ack 181002 win 28000 
0:0:5.298104000 0.0.1.1.1024 > 0.0.3.2.25: . 199002:200002(1000) ack 256002 win 28000 
0:0:5.308784000 0.0.3.2.25 > 0.0.1.1.1024: . ack 182002 win 28000 
0:0:5.308784000 0.0.1.1.1024 > 0.0.3.2.25: . 200002:201002(1000) ack 256002 win 28000 
0:0:5.319464000 0.0.3.2.25 > 0.0.1.1.1024: . ack 183002 win 28000 
0:0:5.319464000 0.0.1.1.1024 > 0.0.3.2.25: . 201002:202002(1000) ack 256002 win 28000 
0:0:5.330144000 0.0.3.2.25 > 0.0.1.1.1024: . ack 184002 win 28000 
0:0:5.330144000 0.0.1.1.1024 > 0.0.3.2.25: . 202002:203002(1000) ack 256002 win 28000 
0:0:5.340824000 0.0.3.2.25 > 0.0.1.1.1024: . ack 185002 win 28000 
0:0:5.340824000 0.0.1.1.1024 > 0.0.3.2.25: . 203002:204002(1000) ack 256002 win 28000 
0:0:5.351504000 0.0.3.2.25 > 0.0.1.1.1024: . ack 186002 win 28000 
0:0:5.351504000 0.0.1.1.1024 > 0.0.3.2.25: . 204002:205002(1000) ack 256002 win 28000 
0:0:5.362184000 0.0.3.2.25 > 0.0.1.1.1024: . ack 187002 win 28000 
0:0:5.362184000 0.0.1.1.1024 > 0.0.3.2.25: . 205002:206002(1000) ack 256002 win 28000 
0:0:5.372864000 0.0.3.2.25 > 0.0.1.1.1024: . ack 188002 win 28000 
0:0:5.372864000 0.0.1.1.1024 > 0.0.3.2.25: . 206002:207002(1000) ack 256002 win 28000 
0:0:5.383544000 0.0.3.2.25 > 0.0.1.1.1024: . ack 189002 win 28000 
0:0:5.383544000 0.0.1.1.1024 > 0.0.3.2.25: . 207002:208002(1000) ack 256002 win 28000 
0:0:5.394224000 0.0.3.2.25 > 0.0.1.1.1024: . ack 190002 win 28000 
0:0:5.394224000 0.0.1.1.1024 > 0.0.3.2.25: . 208002:209002(1000) ack 256002 win 28000 
0:0:5.404904000 0.0.3.2.25 > 0.0.1.1.1024: . ack 191002 win 28000 
0:0:5.404904000 0.0.1.1.1024 > 0.0.3.2.25: . 209002:210002(1000) ack 256002 win 28000 
0:0:5.415584000 0.0.3.2.25 > 0.0.1.1.1024: . ack 192002 win 28000 
0:0:5.415584000 0.0.1.1.1024 > 0.0.3.2.25: . 210002:211002(1000) ack 256002 win 28000 
0:0:5.426264000 0.0.3.2.25 > 0.0.1.1.1024: . ack 193002 win 28000 
0:0:5.426264000 0.0.1.1.1024 > 0.0.3.2.25: . 211002:212002(1000) ack 256002 win 28000 
0:0:5.436944000 0.0.3.2.25 > 0.0.1.1.1024: . ack 194002 win 28000 
0:0:5.436944000 0.0.1.1.1024 > 0.0.3.2.25: . 212002:213002(1000) ack 256002 win 28000 
0:0:5.447624000 0.0.3.2.25 > 0.0.1.1.1024: . ack 195002 win 28000 
0:0:5.447624000 0.0.1.1.1024 > 0.0.3.2.25: . 213002:214002(1000) ack 256002 win 28000 
0:0:5.458304000 0.0.3.2.25 > 0.0.1.1.1024: . ack 196002 win 28000 
0:0:5.458304000 0.0.1.1.1024 > 0.0.3.2.25: . 214002:215002(1000) ack 256002 win 28000 
0:0:5.468984000 0.0.3.2.25 > 0.0.1.1.1024: . ack 197002 win 28000 
0:0:5.468984000 0.0.1.1.1024 > 0.0.3.2.25: . 215002:216002(1000) ack 256002 win 28000 
0:0:5.479664000 0.0.3.2.25 > 0.0.1.1.1024: . ack 198002 win 28000 
0:0:5.479664000 0.0.1.1.1024 > 0.0.3.2.25: . 216002:217002(1000) ack 256002 win 28000 
0:0:5.479664000 0.0.1.1.1024 > 0.0.3.2.25: . 217002:218002(1000) ack 256002 win 28000 
0:0:5.490344000 0.0.3.2.25 > 0.0.1.1.1024: . ack 199002 win 28000 
0:0:5.490344000 0.0.1.1.1024 > 0.0.3.2.25: . 218002:219002(1000) ack 256002 win 28000 
0:0:5.520372800 0.0.3.2.25 > 0.0.1.1.1024: . ack 200002 win 28000 
0:0:5.520372800 0.0.1.1.1024 > 0.0.3.2.25: . 219002:220002(1000) ack 256002 win 28000 
0:0:5.531052800 0.0.3.2.25 > 0.0.1.1.1024: . ack 201002 win 28000 
0:0:5.531052800 0.0.1.1.1024 > 0.0.3.2.25: . 220002:221002(1000) ack 256002 win 28000 
0:0:5.541732800 0.0.3.2.25 > 0.0.1.1.1024: . ack 202002 win 28000 
0:0:5.541732800 0.0.1.1.1024 > 0.0.3.2.25: . 221002:222002(1000) ack 256002 win 28000 
0:0:5.552412800 0.0.3.2.25 > 0.0.1.1.1024: . ack 203002 win 28000 
0:0:5.552412800 0.0.1.1.1024 > 0.0.3.2.25: . 222002:223002(1000) ack 256002 win 28000 
0:0:5.563092800 0.0.3.2.25 > 0.0.1.1.1024: . ack 204002 win 28000 
0:0:5.563092800 0.0.1.1.1024 > 0.0.3.2.25: . 223002:224002(1000) ack 256002 win 28000 
0:0:5.573772800 0.0.3.2.25 > 0.0.1.1.1024: . ack 205002 win 28000 
0:0:5.573772800 0.0.1.1.1024 > 0.0.3.2.25: . 224002:225002(1000) ack 256002 win 28000 
0:0:5.584452800 0.0.3.2.25 > 0.0.1.1.1024: . ack 206002 win 28000 
0:0:5.584452800 0.0.1.1.1024 > 0.0.3.2.25: . 225002:226002(1000) ack 256002 win 28000 
0:0:5.595132800 0.0.3.2.25 > 0.0.1.1.1024: . ack 207002 win 28000 
0:0:5.595132800 0.0.1.1.1024 > 0.0.3.2.25: . 226002:227002(1000) ack 256002 win 28000 
0:0:5.605812800 0.0.3.2.25 > 0.0.1.1.1024: . ack 208002 win 28000 
0:0:5.605812800 0.0.1.1.1024 > 0.0.3.2.25: . 227002:228002(1000) ack 256002 win 28000 
0:0:5.616492800 0.0.3.2.25 > 0.0.1.1.1024: . ack 209002 win 28000 
0:0:5.616492800 0.0.1.1.1024 > 0.0.3.2.25: . 228002:229002(1000) ack 256002 win 28000 
0:0:5.627172800 0.0.3.2.25 > 0.0.1.1.1024: . ack 210002 win 28000 
0:0:5.627172800 0.0.1.1.1024 > 0.0.3.2.25: . 229002:230002(1000) ack 256002 win 28000 
0:0:5.637852800 0.0.3.2.25 > 0.0.1.1.1024: . ack 211002 win 28000 
0:0:5.637852800 0.0.1.1.1024 > 0.0.3.2.25: . 230002:231002(1000) ack 256002 win 28000 
0:0:5.648532800 0.0.3.2.25 > 0.0.1.1.1024: . ack 212002 win 28000 
0:0:5.648532800 0.0.1.1.1024 > 0.0.3.2.25: . 231002:232002(1000) ack 256002 win 28000 
0:0:5.659212800 0.0.3.2.25 > 0.0.1.1.1024: . ack 213002 win 28000 
0:0:5.659212800 0.0.1.1.1024 > 0.0.3.2.25: . 232002:233002(1000) ack 256002 win 28000 
0:0:5.669892800 0.0.3.2.25 > 0.0.1.1.1024: . ack 214002 win 28000 
0:0:5.669892800 0.0.1.1.1024 > 0.0.3.2.25: . 233002:234002(1000) ack 256002 win 28000 
0:0:5.680572800 0.0.3.2.25 > 0.0.1.1.1024: . ack 215002 win 28000 
0:0:5.680572800 0.0.1.1.1024 > 0.0.3.2.25: . 234002:235002(1000) ack 256002 win 28000 
0:0:5.691252800 0.0.3.2.25 > 0.0.1.1.1024: . ack 216002 win 28000 
0:0:5.691252800 0.0.1.1.1024 > 0.0.3.2.25: . 235002:236002(1000) ack 256002 win 28000 
0:0:5.701932800 0.0.3.2.25 > 0.0.1.1.1024: . ack 217002 win 28000 
0:0:5.701932800 0.0.1.1.1024 > 0.0.3.2.25: . 236002:237002(1000) ack 256002 win 28000 
0:0:5.712612800 0.0.3.2.25 > 0.0.1.1.1024: . ack 218002 win 28000 
0:0:5.712612800 0.0.1.1.1024 > 0.0.3.2.25: . 237002:238002(1000) ack 256002 win 28000 
0:0:5.723292800 0.0.3.2.25 > 0.0.1.1.1024: . ack 219002 win 28000 
0:0:5.723292800 0.0.1.1.1024 > 0.0.3.2.25: . 238002:239002(1000) ack 256002 win 28000 
0:0:5.723292800 0.0.1.1.1024 > 0.0.3.2.25: . 239002:240002(1000) ack 256002 win 28000 
0:0:5.742641600 0.0.3.2.25 > 0.0.1.1.1024: . ack 220002 win 28000 
0:0:5.742641600 0.0.1.1.1024 > 0.0.3.2.25: . 240002:241002(1000) ack 256002 win 28000 
0:0:5.753321600 0.0.3.2.25 > 0.0.1.1.1024: . ack 221002 win 28000 
0:0:5.753321600 0.0.1.1.1024 > 0.0.3.2.25: . 241002:242002(1000) ack 256002 win 28000 
0:0:5.764001600 0.0.3.2.25 > 0.0.1.1.1024: . ack 222002 win 28000 
0:0:5.764001600 0.0.1.1.1024 > 0.0.3.2.25: . 242002:243002(1000) ack 256002 win 28000 
0:0:5.774681600 0.0.3.2.25 > 0.0.1.1.1024: . ack 223002 win 28000 
0:0:5.774681600 0.0.1.1.1024 > 0.0.3.2.25: . 243002:244002(1000) ack 256002 win 28000 
0:0:5.785361600 0.0.3.2.25 > 0.0.1.1.1024: . ack 224002 win 28000 
0:0:5.785361600 0.0.1.1.1024 > 0.0.3.2.25: . 244002:245002(1000) ack 256002 win 28000 
0:0:5.796041600 0.0.3.2.25 > 0.0.1.1.1024: . ack 225002 win 28000 
0:0:5.796041600 0.0.1.1.1024 > 0.0.3.2.25: . 245002:246002(1000) ack 256002 win 28000 
0:0:5.806721600 0.0.3.2.25 > 0.0.1.1.1024: . ack 226002 win 28000 
0:0:5.806721600 0.0.1.1.1024 > 0.0.3.2.25: . 246002:247002(1000) ack 256002 win 28000 
0:0:5.817401600 0.0.3.2.25 > 0.0.1.1.1024: . ack 227002 win 28000 
0:0:5.817401600 0.0.1.1.1024 > 0.0.3.2.25: . 247002:248002(1000) ack 256002 win 28000 
0:0:5.828081600 0.0.3.2.25 > 0.0.1.1.1024: . ack 228002 win 28000 
0:0:5.828081600 0.0.1.1.1024 > 0.0.3.2.25: . 248002:249002(1000) ack 256002 win 28000 
0:0:5.838761600 0.0.3.2.25 > 0.0.1.1.1024: . ack 229002 win 28000 
0:0:5.838761600 0.0.1.1.1024 > 0.0.3.2.25: . 249002:250002(1000) ack 256002 win 28000 
0:0:5.849441600 0.0.3.2.25 > 0.0.1.1.1024: . ack 230002 win 28000 
0:0:5.849441600 0.0.1.1.1024 > 0.0.3.2.25: . 250002:251002(1000) ack 256002 win 28000 
0:0:5.860121600 0.0.3.2.25 > 0.0.1.1.1024: . ack 231002 win 28000 
0:0:5.860121600 0.0.1.1.1024 > 0.0.3.2.25: . 251002:252002(1000) ack 256002 win 28000 
0:0:5.870801600 0.0.3.2.25 > 0.0.1.1.1024: . ack 232002 win 28000 
0:0:5.870801600 0.0.1.1.1024 > 0.0.3.2.25: . 252002:253002(1000) ack 256002 win 28000 
0:0:5.881481600 0.0.3.2.25 > 0.0.1.1.1024: . ack 233002 win 28000 
0:0:5.881481600 0.0.1.1.1024 > 0.0.3.2.25: . 253002:254002(1000) ack 256002 win 28000 
0:0:5.892161600 0.0.3.2.25 > 0.0.1.1.1024: . ack 234002 win 28000 
0:0:5.892161600 0.0.1.1.1024 > 0.0.3.2.25: . 254002:255002(1000) ack 256002 win 28000 
0:0:5.902841600 0.0.3.2.25 > 0.0.1.1.1024: . ack 235002 win 28000 
0:0:5.902841600 0.0.1.1.1024 > 0.0.3.2.25: . 255002:256002(1000) ack 256002 win 28000 
0:0:5.913521600 0.0.3.2.25 > 0.0.1.1.1024: . ack 236002 win 28000 
0:0:5.913521600 0.0.1.1.1024 > 0.0.3.2.25: . 256002:257002(1000) ack 256002 win 28000 
0:0:5.924201600 0.0.3.2.25 > 0.0.1.1.1024: . ack 237002 win 28000 
0:0:5.924201600 0.0.1.1.1024 > 0.0.3.2.25: . 257002:258002(1000) ack 256002 win 28000 
0:0:5.934881600 0.0.3.2.25 > 0.0.1.1.1024: . ack 238002 win 28000 
0:0:5.934881600 0.0.1.1.1024 > 0.0.3.2.25: . 258002:259002(1000) ack 256002 win 28000 
0:0:5.945561600 0.0.3.2.25 > 0.0.1.1.1024: . ack 239002 win 28000 
0:0:5.945561600 0.0.1.1.1024 > 0.0.3.2.25: . 259002:260002(1000) ack 256002 win 28000 
0:0:5.956241600 0.0.3.2.25 > 0.0.1.1.1024: . ack 240002 win 28000 
0:0:5.956241600 0.0.1.1.1024 > 0.0.3.2.25: . 260002:261002(1000) ack 256002 win 28000 
0:0:5.966921600 0.0.3.2.25 > 0.0.1.1.1024: . ack 241002 win 28000 
0:0:5.966921600 0.0.1.1.1024 > 0.0.3.2.25: . 261002:262002(1000) ack 256002 win 28000 
0:0:5.966921600 0.0.1.1.1024 > 0.0.3.2.25: . 262002:263002(1000) ack 256002 win 28000 
0:0:5.977601600 0.0.3.2.25 > 0.0.1.1.1024: . ack 242002 win 28000 
0:0:5.977601600 0.0.1.1.1024 > 0.0.3.2.25: . 263002:264002(1000) ack 256002 win 28000 
0:0:5.988281600 0.0.3.2.25 > 0.0.1.1.1024: . ack 243002 win 28000 
0:0:5.988281600 0.0.1.1.1024 > 0.0.3.2.25: . 264002:265002(1000) ack 256002 win 28000 
0:0:5.998961600 0.0.3.2.25 > 0.0.1.1.1024: . ack 244002 win 28000 
0:0:5.998961600 0.0.1.1.1024 > 0.0.3.2.25: . 265002:266002(1000) ack 256002 win 28000 
