0:0:1.000000000 2001:0:1:1::1.1024 > 2001:0:1:3::2.25: S win 28000 <mss 1000>
0:0:1.211987200 2001:0:1:3::2.25 > 2001:0:1:1::1.1024: S ack 2 win 28000 <mss 1000>
0:0:1.211987200 2001:0:1:1::1.1024 > 2001:0:1:3::2.25: . ack 256002 win 28000 
0:0:1.211988200 2001:0:1:1::1.1024 > 2001:0:1:3::2.25: P 2:1002(1000) ack 256002 win 28000 
0:0:1.434768000 2001:0:1:3::2.25 > 2001:0:1:1::1.1024: . ack 1002 win 28000 
0:0:1.434768000 2001:0:1:1::1.1024 > 2001:0:1:3::2.25: . 1002:2002(1000) ack 256002 win 28000 
0:0:1.434768000 2001:0:1:1::1.1024 > 2001:0:1:3::2.25: . 2002:3002(1000) ack 256002 win 28000 
0:0:1.657468800 2001:0:1:3::2.25 > 2001:0:1:1::1.1024: . ack 2002 win 28000 
0:0:1.657468800 2001:0:1:1::1.1024 > 2001:0:1:3::2.25: . 3002:4002(1000) ack 256002 win 28000 
0:0:1.657468800 2001:0:1:1::1.1024 > 2001:0:1:3::2.25: . 4002:5002(1000) ack 256002 win 28000 
0:0:1.668348800 2001:0:1:3::2.25 > 2001:0:1:1::1.1024: . ack 3002 win 28000 
0:0:1.668348800 2001:0:1:1::1.1024 > 2001:0:1:3::2.25: . 5002:6002(1000) ack 256002 win 28000 
0:0:1.668348800 2001:0:1:1::1.1024 > 2001:0:1:3::2.25: . 6002:7002(1000) ack 256002 win 28000 
0:0:1.880169600 2001:0:1:3::2.25 > 2001:0:1:1::1.1024: . ack 4002 win 28000 
0:0:1.880169600 2001:0:1:1::1.1024 > 2001:0:1:3::2.25: . 7002:8002(1000) ack 256002 win 28000 
0:0:1.880169600 2001:0:1:1::1.1024 > 2001:0:1:3::2.25: . 8002:9002(1000) ack 256002 win 28000 
0:0:1.891049600 2001:0:1:3::2.25 > 2001:0:1:1::1.1024: . ack 5002 win 28000 
0:0:1.891049600 2001:0:1:1::1.1024 > 2001:0:1:3::2.25: . 9002:10002(1000) ack 256002 win 28000 
0:0:1.891049600 2001:0:1:1::1.1024 > 2001:0:1:3::2.25: . 10002:11002(1000) ack 256002 win 28000 
0:0:1.901929600 2001:0:1:3::2.25 > 2001:0:1:1::1.1024: . ack 6002 win 28000 
0:0:1.901929600 2001:0:1:1::1.1024 > 2001:0:1:3::2.25: . 11002:12002(1000) ack 256002 win 28000 
0:0:1.901929600 2001:0:1:1::1.1024 > 2001:0:1:3::2.25: . 12002:13002(1000) ack 256002 win 28000 
0:0:1.912809600 2001:0:1:3::2.25 > 2001:0:1:1::1.1024: . ack 7002 win 28000 
0:0:1.912809600 2001:0:1:1::1.1024 > 2001:0:1:3::2.25: . 13002:14002(1000) ack 256002 win 28000 
0:0:1.912809600 2001:0:1:1::1.1024 > 2001:0:1:3::2.25: . 14002:15002(1000) ack 256002 win 28000 
0:0:2.102870400 2001:0:1:3::2.25 > 2001:0:1:1::1.1024: . ack 8002 win 28000 
0:0:2.102870400 2001:0:1:1::1.1024 > 2001:0:1:3::2.25: . 15002:16002(1000) ack 256002 win 28000 
0:0:2.102870400 2001:0:1:1::1.1024 > 2001:0:1:3::2.25: . 16002:17002(1000) ack 256002 win 28000 
0:0:2.113750400 2001:0:1:3::2.25 > 2001:0:1:1::1.1024: . ack 9002 win 28000 
0:0:2.113750400 2001:0:1:1::1.1024 > 2001:0:1:3::2.25: . 17002:18002(1000) ack 256002 win 28000 
0:0:2.113750400 2001:0:1:1::1.1024 > 2001:0:1:3::2.25: . 18002:19002(1000) ack 256002 win 28000 
0:0:2.124630400 2001:0:1:3::2.25 > 2001:0:1:1::1.1024: . ack 10002 win 28000 
0:0:2.124630400 2001:0:1:1::1.1024 > 2001:0:1:3::2.25: . 19002:20002(1000) ack 256002 win 28000 
0:0:2.124630400 2001:0:1:1::1.1024 > 2001:0:1:3::2.25: . 20002:21002(1000) ack 256002 win 28000 
0:0:2.135510400 2001:0:1:3::2.25 > 2001:0:1:1::1.1024: . ack 11002 win 28000 
0:0:2.135510400 2001:0:1:1::1.1024 > 2001:0:1:3::2.25: . 21002:22002(1000) ack 256002 win 28000 
0:0:2.135510400 2001:0:1:1::1.1024 > 2001:0:1:3::2.25: . 22002:23002(1000) ack 256002 win 28000 
0:0:2.146390400 2001:0:1:3::2.25 > 2001:0:1:1::1.1024: . ack 12002 win 28000 
0:0:2.146390400 2001:0:1:1::1.1024 > 2001:0:1:3::2.25: . 23002:24002(1000) ack 256002 win 28000 
0:0:2.146390400 2001:0:1:1::1.1024 > 2001:0:1:3::2.25: . 24002:25002(1000) ack 256002 win 28000 
0:0:2.157270400 2001:0:1:3::2.25 > 2001:0:1:1::1.1024: . ack 13002 win 28000 
0:0:2.157270400 2001:0:1:1::1.1024 > 2001:0:1:3::2.25: . 25002:26002(1000) ack 256002 win 28000 
0:0:2.157270400 2001:0:1:1::1.1024 > 2001:0:1:3::2.25: . 26002:27002(1000) ack 256002 win 28000 
0:0:2.168150400 2001:0:1:3::2.25 > 2001:0:1:1::1.1024: . ack 14002 win 28000 
0:0:2.168150400 2001:0:1:1::1.1024 > 2001:0:1:3::2.25: . 27002:28002(1000) ack 256002 win 28000 
0:0:2.168150400 2001:0:1:1::1.1024 > 2001:0:1:3::2.25: . 28002:29002(1000) ack 256002 win 28000 
0:0:2.325571200 2001:0:1:3::2.25 > 2001:0:1:1::1.1024: . ack 14002 win 28000 
0:0:2.336451200 2001:0:1:3::2.25 > 2001:0:1:1::1.1024: . ack 14002 win 28000 
0:0:2.347331200 2001:0:1:3::2.25 > 2001:0:1:1::1.1024: . ack 14002 win 28000 
0:0:2.347331200 2001:0:1:1::1.1024 > 2001:0:1:3::2.25: . 14002:15002(1000) ack 256002 win 28000 
0:0:2.358211200 2001:0:1:3::2.25 > 2001:0:1:1::1.1024: . ack 14002 win 28000 
0:0:2.369091200 2001:0:1:3::2.25 > 2001:0:1:1::1.1024: . ack 14002 win 28000 
0:0:2.379971200 2001:0:1:3::2.25 > 2001:0:1:1::1.1024: . ack 14002 win 28000 
0:0:2.390851200 2001:0:1:3::2.25 > 2001:0:1:1::1.1024: . ack 14002 win 28000 
0:0:2.401731200 2001:0:1:3::2.25 > 2001:0:1:1::1.1024: . ack 14002 win 28000 
0:0:2.412611200 2001:0:1:3::2.25 > 2001:0:1:1::1.1024: . ack 14002 win 28000 
0:0:2.412611200 2001:0:1:1::1.1024 > 2001:0:1:3::2.25: . 29002:30002(1000) ack 256002 win 28000 
0:0:2.434371200 2001:0:1:3::2.25 > 2001:0:1:1::1.1024: . ack 14002 win 28000 
0:0:2.434371200 2001:0:1:1::1.1024 > 2001:0:1:3::2.25: . 30002:31002(1000) ack 256002 win 28000 
0:0:2.456131200 2001:0:1:3::2.25 > 2001:0:1:1::1.1024: . ack 14002 win 28000 
0:0:2.456131200 2001:0:1:1::1.1024 > 2001:0:1:3::2.25: . 31002:32002(1000) ack 256002 win 28000 
0:0:2.570032000 2001:0:1:3::2.25 > 2001:0:1:1::1.1024: . ack 24002 win 28000 
0:0:2.635312000 2001:0:1:3::2.25 > 2001:0:1:1::1.1024: . ack 24002 win 28000 
0:0:2.657072000 2001:0:1:3::2.25 > 2001:0:1:1::1.1024: . ack 24002 win 28000 
0:0:2.678832000 2001:0:1:3::2.25 > 2001:0:1:1::1.1024: . ack 24002 win 28000 
0:0:2.678832000 2001:0:1:1::1.1024 > 2001:0:1:3::2.25: . 24002:25002(1000) ack 256002 win 28000 
0:0:2.901532800 2001:0:1:3::2.25 > 2001:0:1:1::1.1024: . ack 26002 win 28000 
0:0:5.652332788 2001:0:1:1::1.1024 > 2001:0:1:3::2.25: . 26002:27002(1000) ack 256002 win 28000 
0:0:5.875033588 2001:0:1:3::2.25 > 2001:0:1:1::1.1024: . ack 28002 win 28000 
0:0:5.875033588 2001:0:1:1::1.1024 > 2001:0:1:3::2.25: . 28002:29002(1000) ack 256002 win 28000 
0:0:5.875033588 2001:0:1:1::1.1024 > 2001:0:1:3::2.25: . 29002:30002(1000) ack 256002 win 28000 
